BEACON,SECTOR NUMBER,SECTOR TYPE,SECTOR TITLE,FLEET ADVANCEMENT,TOTAL SHIPS DEFEATED,TOTAL SCRAP COLLECTED,TOTAL CREW HIRED,SCORE,HAZARDS,EVENT TEXT,STORE,SCRAP,HULL,FUEL,DRONE PARTS,MISSILES,CREW SIZE,OXYGEN LEVEL,POWER CAPACITY,SHIELDS CAPACITY,SHIELD POWER,SHIELD DAMAGE,ENGINES CAPACITY,ENGINES POWER,ENGINES DAMAGE,OXYGEN SYSTEM CAPACITY,OXYGEN SYSTEM POWER,OXYGEN SYSTEM DAMAGE,WEAPONS SYSTEM CAPACITY,WEAPONS SYSTEM POWER,WEAPONS SYSTEM DAMAGE,WEAPON SLOT 1,WEAPON SLOT 2,WEAPON SLOT 3,WEAPON SLOT 4,DRONE CONTROL SYSTEM CAPACITY,DRONE CONTROL SYSTEM POWER,DRONE CONTROL SYSTEM DAMAGE,DRONE SLOT 1,DRONE SLOT 2,MEDBAY SYSTEM CAPACITY,MEDBAY SYSTEM POWER,MEDBAY SYSTEM DAMAGE,TELEPORTER SYSTEM CAPACITY,TELEPORTER SYSTEM POWER,TELEPORTER SYSTEM DAMAGE,CLOAKING SYSTEM CAPACITY,CLOAKING SYSTEM POWER,CLOAKING SYSTEM DAMAGE,ARTILLERY SYSTEM CAPACITY,ARTILLERY SYSTEM POWER,ARTILLERY SYSTEM DAMAGE,CLONEBAY SYSTEM CAPACITY,CLONEBAY SYSTEM POWER,CLONEBAY SYSTEM DAMAGE,MINDCONTROL SYSTEM CAPACITY,MINDCONTROL SYSTEM POWER,MINDCONTROL SYSTEM DAMAGE,HACKING SYSTEM CAPACITY,HACKING SYSTEM POWER,HACKING SYSTEM DAMAGE,PILOT SYTEM CAPACITY,PILOT SYSTEM DAMAGE,SENSORS SYSTEM CAPACITY,SENSORS SYSTEM DAMAGE,DOORS SYSTEM CAPACITY,DOORS SYSTEM DAMAGE,BATTERY SYSTEM CAPACITY,BATTERY SYSTEM DAMAGE,AUGMENTS,CARGO,CREW MEMBER 1 NAME,CREW MEMBER 1 SPECIES,CREW MEMBER 1 HEALTH,CREW MEMBER 1 PILOT SKILL,CREW MEMBER 1 ENGINE SKILL,CREW MEMBER 1 SHIELD SKILL,CREW MEMBER 1 WEAPON SKILL,CREW MEMBER 1 REPAIR SKILL,CREW MEMBER 1 COMBAT SKILL,CREW MEMBER 1 REPAIRS,CREW MEMBER 1 COMBAT KILLS,CREW MEMBER 1 PILOTED EVASIONS,CREW MEMBER 1 JUMPS SURVIVED,CREW MEMBER 1 SKILLS MASTERED,CREW MEMBER 2 NAME,CREW MEMBER 2 SPECIES,CREW MEMBER 2 HEALTH,CREW MEMBER 2 PILOT SKILL,CREW MEMBER 2 ENGINE SKILL,CREW MEMBER 2 SHIELD SKILL,CREW MEMBER 2 WEAPON SKILL,CREW MEMBER 2 REPAIR SKILL,CREW MEMBER 2 COMBAT SKILL,CREW MEMBER 2 REPAIRS,CREW MEMBER 2 COMBAT KILLS,CREW MEMBER 2 PILOTED EVASIONS,CREW MEMBER 2 JUMPS SURVIVED,CREW MEMBER 2 SKILLS MASTERED,CREW MEMBER 3 NAME,CREW MEMBER 3 SPECIES,CREW MEMBER 3 HEALTH,CREW MEMBER 3 PILOT SKILL,CREW MEMBER 3 ENGINE SKILL,CREW MEMBER 3 SHIELD SKILL,CREW MEMBER 3 WEAPON SKILL,CREW MEMBER 3 REPAIR SKILL,CREW MEMBER 3 COMBAT SKILL,CREW MEMBER 3 REPAIRS,CREW MEMBER 3 COMBAT KILLS,CREW MEMBER 3 PILOTED EVASIONS,CREW MEMBER 3 JUMPS SURVIVED,CREW MEMBER 3 SKILLS MASTERED,CREW MEMBER 4 NAME,CREW MEMBER 4 SPECIES,CREW MEMBER 4 HEALTH,CREW MEMBER 4 PILOT SKILL,CREW MEMBER 4 ENGINE SKILL,CREW MEMBER 4 SHIELD SKILL,CREW MEMBER 4 WEAPON SKILL,CREW MEMBER 4 REPAIR SKILL,CREW MEMBER 4 COMBAT SKILL,CREW MEMBER 4 REPAIRS,CREW MEMBER 4 COMBAT KILLS,CREW MEMBER 4 PILOTED EVASIONS,CREW MEMBER 4 JUMPS SURVIVED,CREW MEMBER 4 SKILLS MASTERED,NEARBY SHIP TYPE,NEARBY SHIP HULL,NEARBY SHIP FUEL,NEARBY SHIP DRONE PARTS,NEARBY SHIP MISSILES,NEARBY SHIP CREW SIZE,OXYGEN LEVEL,NEARBY SHIP POWER CAPACITY,NEARBY SHIP SHIELDS CAPACITY,NEARBY SHIP SHIELD POWER,NEARBY SHIP SHIELD DAMAGE,NEARBY SHIP ENGINES CAPACITY,NEARBY SHIP ENGINES POWER,NEARBY SHIP ENGINES DAMAGE,NEARBY SHIP OXYGEN SYSTEM CAPACITY,NEARBY SHIP OXYGEN SYSTEM POWER,NEARBY SHIP OXYGEN SYSTEM DAMAGE,NEARBY SHIP WEAPONS SYSTEM CAPACITY,NEARBY SHIP WEAPONS SYSTEM POWER,NEARBY SHIP WEAPONS SYSTEM DAMAGE,NEARBY SHIP WEAPON SLOT 1,NEARBY SHIP WEAPON SLOT 2,NEARBY SHIP DRONE CONTROL SYSTEM CAPACITY,NEARBY SHIP DRONE CONTROL SYSTEM POWER,NEARBY SHIP DRONE CONTROL SYSTEM DAMAGE,NEARBY SHIP MEDBAY SYSTEM CAPACITY,NEARBY SHIP MEDBAY SYSTEM POWER,NEARBY SHIP MEDBAY SYSTEM DAMAGE,NEARBY SHIP TELEPORTER SYSTEM CAPACITY,NEARBY SHIP TELEPORTER SYSTEM POWER,NEARBY SHIP TELEPORTER SYSTEM DAMAGE,NEARBY SHIP CLOAKING SYSTEM CAPACITY,NEARBY SHIP CLOAKING SYSTEM POWER,NEARBY SHIP CLOAKING SYSTEM DAMAGE,NEARBY SHIP ARTILLERY SYSTEM CAPACITY,NEARBY SHIP ARTILLERY SYSTEM POWER,NEARBY SHIP ARTILLERY SYSTEM DAMAGE,NEARBY SHIP CLONEBAY SYSTEM CAPACITY,NEARBY SHIP CLONEBAY SYSTEM POWER,NEARBY SHIP CLONEBAY SYSTEM DAMAGE,NEARBY SHIP MINDCONTROL SYSTEM CAPACITY,NEARBY SHIP MINDCONTROL SYSTEM POWER,NEARBY SHIP MINDCONTROL SYSTEM DAMAGE,NEARBY SHIP HACKING SYSTEM CAPACITY,NEARBY SHIP HACKING SYSTEM POWER,NEARBY SHIP HACKING SYSTEM DAMAGE,NEARBY SHIP PILOT SYTEM CAPACITY,NEARBY SHIP PILOT SYSTEM DAMAGE,NEARBY SHIP SENSORS SYSTEM CAPACITY,NEARBY SHIP SENSORS SYSTEM DAMAGE,NEARBY SHIP DOORS SYSTEM CAPACITY,NEARBY SHIP DOORS SYSTEM DAMAGE,NEARBY SHIP BATTERY SYSTEM CAPACITY,NEARBY SHIP BATTERY SYSTEM DAMAGE,NEARBY SHIP AUGMENTS,ENEMY CREW MEMBER 1 NAME,ENEMY CREW MEMBER 1 SPECIES,ENEMY CREW MEMBER 1 HEALTH,CREW MEMBER 1 REPAIRS,CREW MEMBER 1 COMBAT KILLS,ENEMY CREW MEMBER 2 NAME,ENEMY CREW MEMBER 2 SPECIES,ENEMY CREW MEMBER 2 HEALTH,CREW MEMBER 2 REPAIRS,CREW MEMBER 2 COMBAT KILLS,ENEMY CREW MEMBER 3 NAME,ENEMY CREW MEMBER 3 SPECIES,ENEMY CREW MEMBER 3 HEALTH,CREW MEMBER 3 REPAIRS,CREW MEMBER 3 COMBAT KILLS,ENEMY CREW MEMBER 4 NAME,ENEMY CREW MEMBER 4 SPECIES,ENEMY CREW MEMBER 4 HEALTH,CREW MEMBER 4 REPAIRS,CREW MEMBER 4 COMBAT KILLS,HAS SURRENDERED,HULL DAMAGE NEEDED FOR SURRENDER,IS TRYING TO ESCAPE,HULL DAMAGE NEEDED FOR ESCAPE ATTEMPT,ENEMY BOARDING ATTEMPTS,ENEMY BOARDING STRENGTH
1,1,CIVILIAN,Civilian Sector,0%,0,0,3,15,"","The data you carry is vital to the remaining Federation fleet. You'll need supplies for the journey, so make sure to explore each sector before moving on to the next. But get to the exit before the pursuing Rebel fleet can catch up!  TIP: Hotkeys -  You can charge or arm weapons using number hotkeys: The Weapon Slots are 1-4 on your keyboard, and the Drones are 5-7 (customizeable in the options).","",10,30,16,0,9,3,100,9,2,2,0,2,1,0,1,1,0,2,0,0,LASER BURST 2,MISSILES 1,,,0,0,0,,,1,1,0,0,0,0,0,0,0,2,1,0,0,0,0,0,0,0,0,0,0,1,0,1,0,1,0,0,0,"","",Noemi,Human,100,0,0,0,0,0,0,0,0,0,0,0,Ihlay Caris,Zoltan,70,0,0,0,0,0,0,0,0,0,0,0,Gumpo,Slug,100,0,0,0,0,0,0,0,0,0,0,0,,,,,,,,,,,,,,,
2,1,CIVILIAN,Civilian Sector,0%,1,9,3,74,"","The ship breaks apart and you feel relief in the knowledge that you will hopefully still be one step ahead of the fleet.","",19,30,15,1,9,3,100,9,2,2,0,2,2,0,1,1,0,2,2,0,LASER BURST 2,MISSILES 1,,,0,0,0,,,1,0,0,0,0,0,0,0,0,2,1,0,0,0,0,0,0,0,0,0,0,1,0,1,0,1,0,0,0,"","",Noemi,Human,67,0,0,0,0,0,0,0,0,0,1,0,Ihlay Caris,Zoltan,65,0,0,0,0,1,1,1,0,0,1,0,Gumpo,Slug,100,2,0,0,0,0,0,0,0,4,1,0,,,,,,,,,,,,,,,
3,1,CIVILIAN,Civilian Sector,0%,2,33,3,155,"","It seems the crew did not survive the assault. You take what you can from the remains of the ship.","",43,24,17,2,8,3,78,9,2,0,2,2,1,0,1,1,0,2,2,0,LASER BURST 2,MISSILES 1,,,0,0,0,,,1,0,1,0,0,0,0,0,0,2,1,0,0,0,0,0,0,0,0,0,0,1,0,1,0,1,0,0,0,"","",Noemi,Human,100,0,0,0,2,0,0,0,0,0,2,0,Ihlay Caris,Zoltan,70,0,1,0,0,1,1,1,0,0,2,0,Gumpo,Slug,100,3,0,0,0,0,0,0,0,6,2,0,,,,,,,,,,,,,,,
4,1,CIVILIAN,Civilian Sector,0%,2,33,3,170,"","The mercenary ship masks its jump signature to mimic your own and then jumps off in the opposite direction. This should keep the Rebels guessing.","",25,24,16,2,8,3,100,9,2,2,0,2,1,0,1,1,0,2,2,0,LASER BURST 2,MISSILES 1,,,0,0,0,,,1,0,0,0,0,0,0,0,0,2,2,0,0,0,0,0,0,0,0,0,0,1,0,1,0,1,0,0,0,"","",Noemi,Human,100,0,0,0,2,2,0,2,0,0,3,0,Ihlay Caris,Zoltan,70,0,1,0,0,2,1,2,0,0,3,0,Gumpo,Slug,100,3,0,0,0,0,0,0,0,6,3,0,,,,,,,,,,,,,,,ZOLTAN_FIGHTER_P,7,16,0,10,2,100,9,2,2,0,1,1,0,2,1,0,3,0,0,LASER BURST 2 A,LASER HEAVY 1,0,0,0,0,0,0,0,0,0,0,0,0,0,0,0,0,0,0,0,0,0,0,0,0,1,0,0,0,1,0,0,0,"ENERGY SHIELD",Manon,Human,100,0,0,Nick Lanng,Engi,100,0,0,,,,,,,,,,,false,,false,2,0,1
5,1,CIVILIAN,Civilian Sector,0%,3,51,3,242,"","The ship explodes, leaving behind a substantial collection of useful scrap material.","",43,20,15,3,7,3,100,9,2,2,0,2,1,0,1,1,0,2,2,0,LASER BURST 2,MISSILES 1,,,0,0,0,,,1,0,0,0,0,0,0,0,0,2,2,0,0,0,0,0,0,0,0,0,0,1,0,1,0,1,0,0,0,"","",Noemi,Human,70,0,0,0,8,4,0,4,0,0,4,0,Ihlay Caris,Zoltan,70,0,4,0,0,2,1,2,0,0,4,0,Gumpo,Slug,100,6,0,0,0,0,0,0,0,12,4,0,,,,,,,,,,,,,,,
6,1,CIVILIAN,Civilian Sector,0%,4,66,3,309,"Asteroid Field","The ship explodes, leaving behind a substantial collection of useful scrap material.","",43,19,14,4,8,3,100,9,2,2,0,3,2,0,1,1,0,2,2,0,LASER BURST 2,MISSILES 1,,,0,0,0,,,1,0,0,0,0,0,0,0,0,2,2,0,0,0,0,0,0,0,0,0,0,1,0,1,0,1,0,0,0,"","",Noemi,Human,70,0,0,0,14,4,0,4,0,0,5,0,Ihlay Caris,Zoltan,70,0,6,0,0,2,1,2,0,0,5,0,Gumpo,Slug,100,8,0,0,0,0,0,0,0,16,5,0,,,,,,,,,,,,,,,
7,1,CIVILIAN,Civilian Sector,5%,4,66,4,324,"","You follow their directions and discover an ancient Engi ship. You find a deactivated Engi inside and reroute power from your shuttle to resuscitate it. After a while it reboots, rebuilds itself, and offers to join your crew.","",43,19,13,4,8,4,100,9,2,2,0,3,2,0,1,1,0,2,2,0,LASER BURST 2,MISSILES 1,,,0,0,0,,,1,0,0,0,0,0,0,0,0,2,2,0,0,0,0,0,0,0,0,0,0,1,0,1,0,1,0,0,0,"","",Noemi,Human,70,0,0,0,14,4,0,4,0,0,6,0,Ihlay Caris,Zoltan,70,0,6,0,0,2,1,2,0,0,6,0,Gumpo,Slug,100,8,0,0,0,0,0,0,0,16,6,0,Bjorn,Engi,100,0,0,0,0,0,0,0,0,0,0,0,
8,1,CIVILIAN,Civilian Sector,15%,4,78,4,357,"","You arrive in a system and immediately discover a pirate ship nearby. Strangely, scans indicate there are no lifeforms aboard. You salvage anything useful, but find no clue as to the whereabouts of the former crew.","",55,19,15,5,8,4,100,9,2,2,0,3,2,0,1,1,0,2,2,0,LASER BURST 2,MISSILES 1,,,0,0,0,,,1,0,0,0,0,0,0,0,0,2,2,0,0,0,0,0,0,0,0,0,0,1,0,1,0,1,0,0,0,"","",Noemi,Human,70,0,0,0,14,4,0,4,0,0,7,0,Ihlay Caris,Zoltan,70,0,6,0,0,2,1,2,0,0,7,0,Gumpo,Slug,100,8,0,0,0,0,0,0,0,16,7,0,Bjorn,Engi,100,0,0,0,0,0,0,0,0,0,1,0,
9,1,CIVILIAN,Civilian Sector,25%,5,100,4,435,"","The outpost hails you after the scout was destroyed, Thanks for the help. We've been harassed non-stop by those scouts. Take this on the house.","",77,19,18,6,7,4,100,9,2,2,0,3,2,0,1,1,0,2,2,0,LASER BURST 2,MISSILES 1,,,0,0,0,,,1,0,0,0,0,0,0,0,0,2,2,0,0,0,0,0,0,0,0,0,0,1,0,1,0,1,0,0,0,"","",Noemi,Human,70,0,0,0,21,4,0,4,0,0,8,0,Ihlay Caris,Zoltan,70,0,6,0,0,2,1,2,0,0,8,0,Gumpo,Slug,100,8,0,0,0,0,0,0,0,16,8,0,Bjorn,Engi,100,0,0,1,0,0,0,0,0,0,2,0,
10,1,CIVILIAN,Civilian Sector,35%,6,117,4,506,"","The ship explodes, leaving behind a substantial collection of useful scrap material.","",94,17,18,7,6,4,100,9,2,2,0,3,2,0,1,1,0,2,2,0,LASER BURST 2,MISSILES 1,,,0,0,0,,,1,0,0,0,0,0,0,0,0,2,2,0,0,0,0,0,0,0,0,0,0,1,0,1,0,1,0,0,0,"","",Noemi,Human,70,0,0,0,27,4,0,4,0,0,9,0,Ihlay Caris,Zoltan,70,0,7,0,0,2,1,2,0,0,9,0,Gumpo,Slug,100,9,0,0,0,0,0,0,0,18,9,0,Bjorn,Engi,100,0,0,3,0,0,0,0,0,0,3,0,
11,1,CIVILIAN,Civilian Sector,45%,6,117,4,521,"","","",94,17,17,7,6,4,100,9,2,2,0,3,2,0,1,1,0,2,2,0,LASER BURST 2,MISSILES 1,,,0,0,0,,,1,0,0,0,0,0,0,0,0,2,2,0,0,0,0,0,0,0,0,0,0,1,0,1,0,1,0,0,0,"","",Noemi,Human,70,0,0,0,27,4,0,4,0,0,10,0,Ihlay Caris,Zoltan,70,0,7,0,0,2,1,2,0,0,10,0,Gumpo,Slug,100,9,0,0,0,0,0,0,0,18,10,0,Bjorn,Engi,100,0,0,3,0,0,0,0,0,0,4,0,
12,1,CIVILIAN,Civilian Sector,54%,7,125,4,578,"","With the pirate ship destroyed, your ship's system is restored to full functionality. You salvage what you can from the debris.","",32,13,18,7,5,4,100,10,4,4,0,3,0,0,1,1,0,2,2,0,LASER BURST 2,MISSILES 1,,,0,0,0,,,1,0,0,0,0,0,0,0,0,2,2,0,0,0,0,0,0,0,0,0,0,1,0,1,0,1,0,0,0,"","",Noemi,Human,70,0,0,0,33,4,0,4,0,0,11,0,Ihlay Caris,Zoltan,70,0,7,0,0,2,1,2,0,0,11,0,Gumpo,Slug,100,9,0,0,0,0,0,0,0,18,11,0,Bjorn,Engi,70,0,0,5,0,2,0,2,0,0,5,0,
13,1,CIVILIAN,Civilian Sector,64%,7,125,4,593,"","As you approach the wreckage, a Slug ship makes its arrival. It hesitates for a moment, as if surprised to see anyone remaining, and then jumps away without a word. You resume scanning the system, wary of any other visitors.","",32,13,17,7,5,4,100,10,4,4,0,3,0,0,1,1,0,2,2,0,LASER BURST 2,MISSILES 1,,,0,0,0,,,1,0,0,0,0,0,0,0,0,2,2,0,0,0,0,0,0,0,0,0,0,1,0,1,0,1,0,0,0,"","",Noemi,Human,70,0,0,0,33,4,0,4,0,0,12,0,Ihlay Caris,Zoltan,70,0,7,0,0,2,1,2,0,0,12,0,Gumpo,Slug,100,9,0,0,0,0,0,0,0,18,12,0,Bjorn,Engi,70,0,0,5,0,2,0,2,0,0,6,0,
14,2,HOSTILE,Rock Controlled Sector,0%,7,125,4,608,"","The Rock people are a powerful and proud race. It is not unheard of to have a peaceful journey through their lands, but don't count on it.","",32,13,16,7,5,4,100,10,4,4,0,3,0,0,1,1,0,2,2,0,LASER BURST 2,MISSILES 1,,,0,0,0,,,1,0,0,0,0,0,0,0,0,2,2,0,0,0,0,0,0,0,0,0,0,1,0,1,0,1,0,0,0,"","",Noemi,Human,70,0,0,0,33,4,0,4,0,0,13,0,Ihlay Caris,Zoltan,70,0,7,0,0,2,1,2,0,0,13,0,Gumpo,Slug,100,9,0,0,0,0,0,0,0,18,13,0,Bjorn,Engi,70,0,0,5,0,2,0,2,0,0,7,0,
15,2,HOSTILE,Rock Controlled Sector,0%,7,125,4,623,"","No one bothers your ship as you float among numerous space stations and mining platforms. The Rock certainly run efficient operations.","",7,13,15,7,5,4,100,11,4,4,0,3,2,0,1,1,0,2,2,0,LASER BURST 2,MISSILES 1,,,0,0,0,,,1,0,0,0,0,0,0,0,0,2,2,0,0,0,0,0,0,0,0,0,0,1,0,1,0,1,0,0,0,"","",Noemi,Human,70,0,0,0,33,4,0,4,0,0,14,0,Ihlay Caris,Zoltan,70,0,7,0,0,2,1,2,0,0,14,0,Gumpo,Slug,100,9,0,0,0,0,0,0,0,18,14,0,Bjorn,Engi,70,0,0,5,0,2,0,2,0,0,8,0,
16,2,HOSTILE,Rock Controlled Sector,4%,8,146,4,699,"","The ship explodes, leaving behind a substantial collection of useful scrap material.","",28,11,15,8,4,4,95,11,4,4,0,3,2,0,1,1,0,2,2,0,LASER BURST 2,MISSILES 1,,,0,0,0,,,1,0,0,0,0,0,0,0,0,2,2,0,0,0,0,0,0,0,0,0,0,1,0,1,0,1,0,0,0,"","",Noemi,Human,70,0,0,0,39,4,0,4,0,0,15,0,Ihlay Caris,Zoltan,70,0,8,0,0,2,1,2,0,0,15,0,Gumpo,Slug,100,10,0,0,0,0,0,0,0,20,15,0,Bjorn,Engi,70,0,0,5,0,3,0,3,0,0,9,0,
17,2,HOSTILE,Rock Controlled Sector,14%,8,157,4,731,"","When you ask a nearby station for aid, a friendly programmer gives you the schematics for a drone!","",39,11,14,8,4,4,100,11,4,4,0,3,2,0,1,1,0,2,2,0,LASER BURST 2,MISSILES 1,,,0,0,0,,,1,0,0,0,0,0,0,0,0,2,2,0,0,0,0,0,0,0,0,0,0,1,0,1,0,1,0,0,0,"","REPAIR",Noemi,Human,100,0,0,0,39,4,0,4,0,0,16,0,Ihlay Caris,Zoltan,70,0,8,0,0,2,1,2,0,0,16,0,Gumpo,Slug,100,10,0,0,0,0,0,0,0,20,16,0,Bjorn,Engi,100,0,0,5,0,3,0,3,0,0,10,0,
18,2,HOSTILE,Rock Controlled Sector,24%,8,188,4,792,"","You succeed in preventing them from being entirely destroyed, but your ship took a number of hits in the process. They offer some of the scrap and fuel they were mining out of the asteroid as thanks.","",70,10,16,8,4,4,99,11,4,4,0,3,2,0,1,1,0,2,2,0,LASER BURST 2,MISSILES 1,,,0,0,0,,,1,0,0,0,0,0,0,0,0,2,2,0,0,0,0,0,0,0,0,0,0,1,0,1,0,1,0,0,0,"","REPAIR",Noemi,Human,100,0,0,0,39,4,0,4,0,0,17,0,Ihlay Caris,Zoltan,70,0,8,0,0,2,1,2,0,0,17,0,Gumpo,Slug,100,10,0,0,0,0,0,0,0,20,17,0,Bjorn,Engi,100,0,0,5,0,3,0,3,0,0,11,0,
19,2,HOSTILE,Rock Controlled Sector,34%,8,188,4,807,"","You come across a Rock trading post. It's rare they deal with outsiders, but they need to sell the last of their stock, and will pay their dues for their transgression when they return home.","Crew: Zoltan, Zoltan, Zoltan, Weapon: ION 2, LASER HULL 2, MISSILES BURST, ",85,10,15,8,4,4,99,11,4,4,0,3,2,0,1,1,0,2,2,0,LASER BURST 2,MISSILES 1,,,0,0,0,,,1,0,0,0,0,0,0,0,0,2,2,0,0,0,0,0,0,0,0,0,0,1,0,1,0,1,0,0,0,"","",Noemi,Human,100,0,0,0,39,4,0,4,0,0,18,0,Ihlay Caris,Zoltan,70,0,8,0,0,2,1,2,0,0,18,0,Gumpo,Slug,100,10,0,0,0,0,0,0,0,20,18,0,Bjorn,Engi,100,0,0,5,0,3,0,3,0,0,12,0,
20,2,HOSTILE,Rock Controlled Sector,43%,8,188,4,822,"","","",85,10,14,8,4,4,61,11,4,4,0,3,2,0,1,1,0,2,2,0,LASER BURST 2,MISSILES 1,,,0,0,0,,,1,0,0,0,0,0,0,0,0,2,2,0,0,0,0,0,0,0,0,0,0,1,0,1,0,1,0,0,0,"","",Noemi,Human,100,0,0,0,39,4,0,4,0,0,19,0,Ihlay Caris,Zoltan,70,0,8,0,0,2,1,2,0,0,19,0,Gumpo,Slug,100,10,0,0,0,0,0,0,0,20,19,0,Bjorn,Engi,100,0,0,5,0,3,0,3,0,0,13,0,
21,2,HOSTILE,Rock Controlled Sector,53%,8,216,4,879,"","Your crew-member is able to remotely fix the glitch in the defense AI, allowing the repair crew to close in and finish the job. The station gives you its thanks along with a reward.","",113,10,14,8,6,4,61,11,4,4,0,3,2,0,1,1,0,2,2,0,LASER BURST 2,MISSILES 1,,,0,0,0,,,1,0,0,0,0,0,0,0,0,2,2,0,0,0,0,0,0,0,0,0,0,1,0,1,0,1,0,0,0,"","",Noemi,Human,100,0,0,0,39,4,0,4,0,0,20,0,Ihlay Caris,Zoltan,70,0,8,0,0,2,1,2,0,0,20,0,Gumpo,Slug,100,10,0,0,0,0,0,0,0,20,20,0,Bjorn,Engi,100,0,0,5,0,3,0,3,0,0,14,0,
22,2,HOSTILE,Rock Controlled Sector,63%,8,216,4,894,"","You receive a hail on Federation frequencies: You're Federation?! We- we weren't sure we'd ever see a friendly face again. There's little business here, perhaps you'd like to trade?","Crew: Human, Human, Rock, Weapon: ION 1, BEAM HULL, ION STUN, ",113,10,13,8,6,4,61,11,4,4,0,3,2,0,1,1,0,2,2,0,LASER BURST 2,MISSILES 1,,,0,0,0,,,1,0,0,0,0,0,0,0,0,2,2,0,0,0,0,0,0,0,0,0,0,1,0,1,0,1,0,0,0,"","",Noemi,Human,100,0,0,0,39,4,0,4,0,0,21,0,Ihlay Caris,Zoltan,70,0,8,0,0,2,1,2,0,0,21,0,Gumpo,Slug,100,10,0,0,0,0,0,0,0,20,21,0,Bjorn,Engi,100,0,0,5,0,3,0,3,0,0,15,0,
23,2,HOSTILE,Rock Controlled Sector,73%,8,216,4,909,"","You see a Zoltan merchant and ask about his wares. He responds, Sorry, but it took years to gain their trust. I can't be seen communicating with you. I hope you understand. He cuts communications.","",33,10,12,8,6,4,61,12,4,4,0,3,2,0,1,1,0,3,3,0,LASER BURST 2,MISSILES 1,ION 1,,0,0,0,,,1,0,0,0,0,0,0,0,0,2,2,0,0,0,0,0,0,0,0,0,0,1,0,1,0,1,0,0,0,"","",Noemi,Human,100,0,0,0,39,4,0,4,0,0,22,0,Ihlay Caris,Zoltan,70,0,8,0,0,2,1,2,0,0,22,0,Gumpo,Slug,100,10,0,0,0,0,0,0,0,20,22,0,Bjorn,Engi,100,0,0,5,0,3,0,3,0,0,16,0,
24,2,HOSTILE,Rock Controlled Sector,83%,9,236,4,984,"","The ship explodes, leaving behind a substantial collection of useful scrap material.","",53,10,11,9,7,4,61,12,4,4,0,3,2,0,1,1,0,3,3,0,LASER BURST 2,ION 1,MISSILES 1,,0,0,0,,,1,0,0,0,0,0,0,0,0,2,2,0,0,0,0,0,0,0,0,0,0,1,0,1,0,1,0,0,0,"","",Noemi,Human,100,0,0,0,54,4,0,4,0,0,23,0,Ihlay Caris,Zoltan,70,0,8,0,0,2,1,2,0,0,23,0,Gumpo,Slug,100,10,0,0,0,0,0,0,0,20,23,0,Bjorn,Engi,100,0,0,6,0,3,0,3,0,0,17,0,
25,2,HOSTILE,Rock Controlled Sector,93%,9,256,4,1029,"","You receive a message from a nearby station, A Federation cruiser jumping into Rebel territory? Quite the bold move. You quickly move to arm the weapons but he continues, Lucky for you we're not all in support of the Rebellion. Perhaps these supplies will help you get to friendlier space alive.","",43,10,12,9,9,4,61,12,4,4,0,4,2,0,1,1,0,3,3,0,LASER BURST 2,ION 1,MISSILES 1,,0,0,0,,,1,0,0,0,0,0,0,0,0,2,2,0,0,0,0,0,0,0,0,0,0,1,0,1,0,1,0,0,0,"","",Noemi,Human,100,0,0,0,54,4,0,4,0,0,24,0,Ihlay Caris,Zoltan,70,0,8,0,0,2,1,2,0,0,24,0,Gumpo,Slug,100,10,0,0,0,0,0,0,0,20,24,0,Bjorn,Engi,100,0,0,6,0,3,0,3,0,0,18,0,
26,3,HOSTILE,Mantis Homeworlds,0%,9,256,4,1044,"","You've entered a poorly charted area of space that's known to be home to the Mantis. Ensure your hull plating is up to scratch and that you have enough fuel in the tank to make it through.","",18,7,10,9,6,4,70,13,4,4,0,4,3,0,1,1,0,3,3,0,LASER BURST 2,ION 1,MISSILES 1,,0,0,0,,,1,0,0,0,0,0,0,0,0,2,2,0,0,0,0,0,0,0,0,0,0,1,0,1,0,1,0,0,0,"","",Noemi,Human,58,0,0,0,54,4,0,4,0,0,26,0,Ihlay Caris,Zoltan,70,0,9,0,0,2,1,2,0,0,26,0,Gumpo,Slug,82,11,0,0,0,0,0,0,0,22,26,0,Bjorn,Engi,100,0,0,9,0,3,0,3,0,0,20,0,
27,3,HOSTILE,Mantis Homeworlds,0%,10,283,4,1130,"Asteroid Field","The ship explodes, leaving behind a substantial collection of useful scrap material.","",45,5,11,9,5,4,97,13,4,4,0,4,3,0,1,1,0,3,2,0,LASER BURST 2,ION 1,MISSILES 1,,0,0,0,,,1,1,0,0,0,0,0,0,0,2,2,0,0,0,0,0,0,0,0,0,0,1,0,1,1,1,0,0,0,"","",Noemi,Human,100,0,0,0,64,4,0,4,0,0,27,1,Ihlay Caris,Zoltan,70,0,13,0,0,2,1,2,0,0,27,0,Gumpo,Slug,100,15,0,0,0,0,0,0,0,30,27,1,Bjorn,Engi,100,0,0,18,0,3,1,3,1,0,21,0,
28,3,HOSTILE,Mantis Homeworlds,6%,10,283,4,1145,"","You make the exchange and their team comes on board to try to improve your reactor.","",45,5,10,7,1,4,94,14,4,4,0,4,3,0,1,1,0,3,2,0,LASER BURST 2,ION 1,MISSILES 1,,0,0,0,,,1,1,0,0,0,0,0,0,0,2,2,0,0,0,0,0,0,0,0,0,0,1,0,1,0,1,0,0,0,"","",Noemi,Human,100,0,0,0,64,4,0,4,0,0,28,1,Ihlay Caris,Zoltan,70,0,13,0,0,2,1,2,0,0,28,0,Gumpo,Slug,100,15,0,0,0,0,0,0,0,30,28,1,Bjorn,Engi,100,0,0,18,0,4,1,4,1,0,22,0,
29,3,HOSTILE,Mantis Homeworlds,16%,10,283,4,1160,"","A derelict and still smoking Mantis vessel floats by. The battle must have been recent; its surviving crew beam aboard. Prepare for a fight!","",45,5,9,7,1,4,80,14,4,4,0,4,3,0,1,1,0,3,3,0,LASER BURST 2,ION 1,MISSILES 1,,0,0,0,,,1,1,0,0,0,0,0,0,0,2,2,0,0,0,0,0,0,0,0,0,0,1,0,1,0,1,0,0,0,"","",Noemi,Human,100,0,0,0,64,4,0,4,0,0,29,1,Ihlay Caris,Zoltan,70,0,13,0,0,2,1,2,0,0,29,0,Gumpo,Slug,100,15,0,0,0,0,0,0,0,30,29,1,Bjorn,Engi,86,0,0,18,0,4,1,4,1,0,23,0,
30,3,HOSTILE,Mantis Homeworlds,26%,10,283,4,1175,"","Merchants are not highly respected among the Mantis race, so few undertake the profession. You're mildly surprised to receive an advertisement from a nearby space dock. You decide to see what they have to offer.","Weapon: BOMB 1, BEAM LONG, BEAM 2, Augment: FIRE EXTINGUISHERS, ZOLTAN BYPASS, EXPLOSIVE REPLICATOR, System: drones, clonebay, mind, Crew: Mantis, Human, Mantis, ",1,21,12,7,1,4,62,14,4,4,0,4,3,0,1,1,0,3,3,0,LASER BURST 2,ION 1,MISSILES 1,,0,0,0,,,1,1,0,0,0,0,0,0,0,2,2,0,0,0,0,0,0,0,0,0,0,1,0,1,0,1,0,0,0,"","",Noemi,Human,100,0,0,0,64,4,0,4,0,0,30,1,Ihlay Caris,Zoltan,70,0,13,0,0,2,1,2,0,0,30,0,Gumpo,Slug,100,15,0,0,0,0,1,0,1,30,30,1,Bjorn,Engi,100,0,0,18,0,4,1,4,1,0,24,0,
31,3,HOSTILE,Mantis Homeworlds,36%,11,306,4,1254,"","The ship explodes, leaving behind a substantial collection of useful scrap material.","",24,15,14,7,1,4,72,14,4,4,0,4,4,0,1,1,0,3,2,0,LASER BURST 2,ION 1,MISSILES 1,,0,0,0,,,1,1,0,0,0,0,0,0,0,2,2,0,0,0,0,0,0,0,0,0,0,1,0,1,0,1,0,0,0,"","",Noemi,Human,100,0,0,0,68,5,0,5,0,0,31,1,Ihlay Caris,Zoltan,55,0,14,0,0,3,1,3,0,0,31,0,Gumpo,Slug,85,16,0,0,0,0,1,0,1,32,31,1,Bjorn,Engi,100,0,0,19,0,5,1,5,1,0,25,0,
32,3,HOSTILE,Mantis Homeworlds,46%,11,324,4,1296,"","With no fear of catching the disease, your Engi crewmember helps reassure and organize the infected humans. Calmed by its extensive knowledge of human physiology, the infected submit to the quarantine in the hopes that a cure can be found soon. The colony leaders offer a reward for helping to prevent an ugly incident.","",42,15,15,8,1,4,78,14,4,4,0,4,3,0,1,1,0,3,2,0,LASER BURST 2,ION 1,MISSILES 1,,0,0,0,,,1,1,0,0,0,0,0,0,0,2,2,0,0,0,0,0,0,0,0,0,0,1,0,1,0,1,0,0,0,"","",Noemi,Human,100,0,0,0,68,5,0,5,0,0,32,1,Ihlay Caris,Zoltan,70,0,14,0,0,3,1,3,0,0,32,0,Gumpo,Slug,100,16,0,0,0,0,1,0,1,32,32,1,Bjorn,Engi,100,0,0,19,0,5,1,5,1,0,26,0,
33,3,HOSTILE,Mantis Homeworlds,56%,12,358,4,1392,"","The ship explodes, leaving behind a substantial collection of useful scrap material.","",76,15,14,9,1,4,98,14,4,4,0,4,3,0,1,1,0,3,1,2,LASER BURST 2,ION 1,MISSILES 1,,0,0,0,,,1,1,0,0,0,0,0,0,0,2,2,0,0,0,0,0,0,0,0,0,0,1,0,1,0,1,0,0,0,"","",Noemi,Human,70,0,0,0,86,5,0,5,0,0,33,1,Ihlay Caris,Zoltan,70,0,22,0,0,3,1,3,0,0,33,1,Gumpo,Slug,100,24,0,0,0,0,1,0,1,48,33,1,Bjorn,Engi,100,0,0,21,0,8,1,8,1,0,27,0,
34,3,HOSTILE,Mantis Homeworlds,66%,12,358,4,1407,"Solar Flares","You arrive to find yourself extremely close to a star. You receive a message from a pirate ship, I'm glad you arrived; our ship is damaged and we were getting desperate... I hope you don't mind if we take yours. Hostiles detected on board our ship!","",76,15,13,9,1,4,99,14,4,4,0,4,4,0,1,0,0,3,2,0,LASER BURST 2,ION 1,MISSILES 1,,0,0,0,,,1,1,0,0,0,0,0,0,0,2,1,0,0,0,0,0,0,0,0,0,0,1,0,1,0,1,0,0,0,"","",Noemi,Human,100,0,0,0,86,5,0,5,0,0,34,1,Ihlay Caris,Zoltan,70,0,22,0,0,3,1,3,0,0,34,1,Gumpo,Slug,100,24,0,0,0,0,1,0,1,48,34,1,Bjorn,Engi,100,0,0,21,0,10,1,10,1,0,28,0,
35,3,HOSTILE,Mantis Homeworlds,75%,13,388,4,1497,"","The ship explodes, leaving behind a substantial collection of useful scrap material.","",106,11,12,10,1,4,72,14,4,4,0,4,3,0,1,1,0,3,2,0,LASER BURST 2,ION 1,MISSILES 1,,0,0,0,,,1,1,0,0,0,0,0,0,0,2,2,0,0,0,0,0,0,0,0,0,0,1,0,1,1,1,0,0,0,"","",Noemi,Human,100,0,0,0,99,5,1,5,1,0,35,1,Ihlay Caris,Zoltan,70,0,26,0,0,3,1,3,0,0,35,1,Gumpo,Slug,100,28,0,0,0,0,1,0,1,56,35,1,Bjorn,Engi,100,0,0,21,0,10,2,10,2,0,29,0,
36,3,HOSTILE,Mantis Homeworlds,85%,13,388,4,1512,"","A struggling Mantis cargo ship headed for the node raises what's left of shields as you jump in. You power up your weapons as a show of force, and they reluctantly agree to offload some of their cargo to you - for a price.","System: drones, battery, clonebay, Augment: O2 MASKS, DRONE RECOVERY, FTL JUMPER, Drone: COMBAT BEAM, COMBAT BEAM 2, SHIP REPAIR, Weapon: LASER HULL 2, BOMB FIRE, LASER BURST 5, ",21,11,11,10,1,4,78,14,4,4,0,4,3,0,1,1,0,3,2,0,LASER BURST 2,ION 1,MISSILES 1,,2,0,0,DEFENSE 1,,1,1,0,0,0,0,0,0,0,2,2,0,0,0,0,0,0,0,0,0,0,1,0,1,1,1,0,0,0,"","",Noemi,Human,100,0,0,0,99,5,1,5,1,0,36,1,Ihlay Caris,Zoltan,70,0,26,0,0,3,1,3,0,0,36,1,Gumpo,Slug,100,28,0,0,0,0,1,0,1,56,36,1,Bjorn,Engi,100,0,0,21,0,10,2,10,2,0,30,0,
37,3,HOSTILE,Mantis Homeworlds,95%,13,388,4,1527,"","I understand. Good luck out there. We'll try to make do with what we have.","",21,11,10,10,1,4,78,14,4,4,0,4,3,0,1,1,0,3,2,0,LASER BURST 2,ION 1,MISSILES 1,,2,0,0,DEFENSE 1,,1,1,0,0,0,0,0,0,0,2,2,0,0,0,0,0,0,0,0,0,0,1,0,1,1,1,0,0,0,"","",Noemi,Human,100,0,0,0,99,5,1,5,1,0,37,1,Ihlay Caris,Zoltan,70,0,26,0,0,3,1,3,0,0,37,1,Gumpo,Slug,100,28,0,0,0,0,1,0,1,56,37,1,Bjorn,Engi,100,0,0,21,0,10,2,10,2,0,31,0,
38,4,CIVILIAN,Engi Controlled Sector,0%,13,388,4,1542,"","You have arrived in Engi space. The Mantis have been threatening the Engi core worlds, but you should be able to stock up for your journey.","",21,11,9,10,1,4,79,14,4,4,0,4,3,0,1,1,0,3,2,0,LASER BURST 2,ION 1,MISSILES 1,,2,0,0,DEFENSE 1,,1,1,0,0,0,0,0,0,0,2,2,0,0,0,0,0,0,0,0,0,0,1,0,1,0,1,0,0,0,"","",Noemi,Human,100,0,0,0,99,5,1,5,1,0,38,1,Ihlay Caris,Zoltan,70,0,26,0,0,3,1,3,0,0,38,1,Gumpo,Slug,100,28,0,0,0,0,1,0,1,56,38,1,Bjorn,Engi,100,0,0,21,0,11,2,11,2,0,32,0,
39,4,CIVILIAN,Engi Controlled Sector,0%,13,409,4,1589,"","Debris from a battle is scattered around this system. A few pieces bounce against your ship. You passively scan them and discover there is a functioning weapon among them!","",42,11,8,10,1,4,79,14,4,4,0,4,3,0,1,1,0,3,2,0,LASER BURST 2,ION 1,MISSILES 1,BOMB HEAL,2,0,0,DEFENSE 1,,1,1,0,0,0,0,0,0,0,2,2,0,0,0,0,0,0,0,0,0,0,1,0,1,0,1,0,0,0,"","",Noemi,Human,100,0,0,0,99,5,1,5,1,0,39,1,Ihlay Caris,Zoltan,70,0,26,0,0,3,1,3,0,0,39,1,Gumpo,Slug,100,28,0,0,0,0,1,0,1,56,39,1,Bjorn,Engi,100,0,0,21,0,11,2,11,2,0,33,0,
