38,3,CIVILIAN,Engi Homeworlds,68%,16,442,4,1713,"","The refugee ship thanks you for your assistance. As a gesture of good will (and seeing how effectively you dispatched the enemy ship), they offer up what supplies they can spare.","",109,6,12,12,22,4,94,10,4,4,0,2,2,0,1,1,0,4,3,0,SHOTGUN,LASER BURST 2,,,0,0,0,,,0,0,0,0,0,0,0,0,0,0,0,0,1,0,0,0,0,0,0,0,0,1,0,2,0,1,0,0,0,"WEAPON PREIGNITE","",James Pomeroy,Human,100,3,0,0,0,0,0,3,1,10,37,0,Chris Phillips,Lanius,100,0,3,0,0,3,0,9,0,0,37,0,Liu Jun,Human,100,0,0,15,9,0,0,0,1,0,37,0,Kirby,Rock,129,0,0,0,68,2,1,4,1,0,29,1,,,,,,,,,,,,,,,
39,3,CIVILIAN,Engi Homeworlds,78%,17,476,4,1809,"","The outpost hails you, Thank you! I don't know what we did to anger the Rebels, but they were ready to kill us. I'll show you our goods and patch up your hull.","System: teleporter, cloaking, battery, Augment: ION ARMOR, HACKING STUN, FLEET DISTRACTION, ",119,20,13,12,22,4,94,10,4,4,0,2,2,0,1,1,0,4,3,0,SHOTGUN,LASER BURST 2,,,0,0,0,,,0,0,0,0,0,0,0,0,0,0,0,0,1,0,0,0,0,0,0,0,0,1,0,2,0,1,0,0,0,"WEAPON PREIGNITE","",James Pomeroy,Human,100,4,0,0,0,0,0,3,1,12,38,0,Chris Phillips,Lanius,100,0,4,0,0,3,0,9,0,0,38,0,Liu Jun,Human,100,0,0,16,9,0,0,0,1,0,38,0,Kirby,Rock,137,0,0,0,76,2,1,4,1,0,30,1,,,,,,,,,,,,,,,
40,3,CIVILIAN,Engi Homeworlds,88%,17,501,4,1862,"","This was the site of a recent battle. Either a show of Mantis force, or the Engi here weren't disposed to go peacefully. You pick through the pieces.","",44,20,12,13,23,4,94,10,6,4,0,2,2,0,1,1,0,4,3,0,SHOTGUN,LASER BURST 2,,,0,0,0,,,0,0,0,0,0,0,0,0,0,0,0,0,1,0,0,0,0,0,0,0,0,1,0,2,0,1,0,0,0,"WEAPON PREIGNITE","",James Pomeroy,Human,100,4,0,0,0,0,0,3,1,12,39,0,Chris Phillips,Lanius,100,0,4,0,0,3,0,9,0,0,39,0,Liu Jun,Human,100,0,0,16,9,0,0,0,1,0,39,0,Kirby,Rock,145,0,0,0,76,2,1,4,1,0,31,1,,,,,,,,,,,,,,,
41,4,HOSTILE,Mantis Controlled Sector,0%,18,501,4,1907,"","You will have to be very cautious in this sector. The Rebels have full control and are no doubt looking for you.","",19,8,11,13,23,4,64,11,6,6,0,2,1,0,1,1,0,4,3,0,SHOTGUN,LASER BURST 2,,,0,0,0,,,0,0,0,0,0,0,0,0,0,0,0,0,1,0,0,0,0,0,0,0,0,1,0,2,0,1,0,0,0,"WEAPON PREIGNITE","",James Pomeroy,Human,100,9,0,0,0,0,0,3,1,22,41,0,Chris Phillips,Lanius,19,0,8,0,0,3,1,9,1,0,41,0,Liu Jun,Human,100,0,0,25,9,0,0,0,1,0,41,0,Kirby,Rock,47,0,0,0,78,3,1,5,1,0,33,1,,,,,,,,,,,,,,,
42,4,HOSTILE,Mantis Controlled Sector,6%,19,541,4,2012,"","The ship explodes, leaving behind a substantial collection of useful scrap material.","",59,8,13,14,23,4,45,11,6,2,0,2,1,0,1,0,0,4,3,0,SHOTGUN,LASER BURST 2,,,0,0,0,,,0,0,0,0,0,0,0,0,0,0,0,0,1,0,0,0,0,0,0,0,0,1,0,2,0,1,0,0,0,"WEAPON PREIGNITE","",James Pomeroy,Human,100,9,0,0,0,0,0,3,1,22,42,0,Chris Phillips,Lanius,27,0,8,0,0,3,1,9,1,0,42,0,Liu Jun,Human,100,0,0,25,9,0,0,0,1,0,42,0,Kirby,Rock,43,0,0,0,84,3,1,5,1,0,34,1,,,,,,,,,,,,,,,
43,4,HOSTILE,Mantis Controlled Sector,11%,20,571,4,2102,"","The station was either abandoned or stripped clean. It seems to have lain unused for quite some time. You find nothing useful.","",64,6,12,14,23,4,67,12,6,2,3,2,2,0,1,1,0,4,3,0,SHOTGUN,LASER BURST 2,,,0,0,0,,,0,0,0,0,0,0,0,0,0,0,0,0,1,0,0,0,0,0,0,0,0,1,1,2,0,1,0,0,0,"WEAPON PREIGNITE","",James Pomeroy,Human,70,9,0,0,0,0,0,3,1,22,43,0,Chris Phillips,Lanius,35,0,8,0,0,3,1,9,1,0,43,0,Liu Jun,Human,37,0,0,26,9,0,0,0,1,0,43,0,Kirby,Rock,51,0,0,0,88,3,1,5,1,0,35,1,,,,,,,,,,,,,,,
44,4,HOSTILE,Mantis Controlled Sector,16%,20,571,4,2117,"","","",29,6,11,16,20,4,88,12,6,6,0,2,2,0,1,1,0,4,3,0,SHOTGUN,LASER BURST 2,,,0,0,0,,,0,0,0,0,0,0,0,0,0,0,0,0,1,0,0,0,0,0,0,0,0,1,0,2,0,2,0,0,0,"WEAPON PREIGNITE","",James Pomeroy,Human,78,9,0,0,0,2,0,5,1,22,44,0,Chris Phillips,Lanius,43,0,8,0,0,3,1,9,1,0,44,0,Liu Jun,Human,37,0,0,26,9,2,0,2,1,0,44,0,Kirby,Rock,59,0,0,0,88,3,1,5,1,0,36,1,,,,,,,,,,,,,,,
45,4,HOSTILE,Mantis Controlled Sector,20%,20,571,4,2132,"","You feel naked without functioning sensors. You half expect a Rebel ship to appear from behind a cloud at any moment, but none come.","",29,6,10,16,20,4,88,12,6,6,0,2,2,0,1,1,0,4,3,0,SHOTGUN,LASER BURST 2,,,0,0,0,,,0,0,0,0,0,0,0,0,0,0,0,0,1,0,0,0,0,0,0,0,0,1,0,2,0,2,0,0,0,"WEAPON PREIGNITE","",James Pomeroy,Human,86,9,0,0,0,2,0,5,1,22,45,0,Chris Phillips,Lanius,51,0,8,0,0,3,1,9,1,0,45,0,Liu Jun,Human,45,0,0,26,9,2,0,2,1,0,45,0,Kirby,Rock,67,0,0,0,88,3,1,5,1,0,37,1,,,,,,,,,,,,,,,
46,4,HOSTILE,Mantis Controlled Sector,25%,21,611,4,2237,"","The ship explodes, leaving behind a substantial collection of useful scrap material.","",69,4,9,17,21,4,47,12,6,4,0,2,2,0,1,1,0,4,3,0,SHOTGUN,LASER BURST 2,,,0,0,0,,,0,0,0,0,0,0,0,0,0,0,0,0,1,1,0,0,0,0,0,0,0,1,0,2,2,2,2,0,0,"WEAPON PREIGNITE","",James Pomeroy,Human,64,15,0,0,0,3,0,6,1,34,46,1,Chris Phillips,Lanius,59,0,8,0,0,5,1,11,1,0,46,0,Liu Jun,Human,31,0,0,17,0,0,0,3,1,0,46,0,Kirby,Rock,89,0,0,0,82,4,0,9,1,0,38,1,,,,,,,,,,,,,,,
47,4,HOSTILE,Mantis Controlled Sector,35%,21,611,4,2252,"","You arrive at a small space station that is putting out wide-band broadcasts on black-market channels. You doubt they would turn away any business, regardless of allegiances.","System: medbay, cloaking, hacking, Augment: BATTERY BOOSTER, TELEPORT HEAL, DRONE RECOVERY, ",27,18,8,17,21,4,81,12,6,4,0,2,2,0,1,1,0,4,3,0,SHOTGUN,LASER BURST 2,,,0,0,0,,,0,0,0,0,0,0,0,0,0,0,0,0,1,1,0,0,0,0,0,0,0,1,0,2,0,2,0,0,0,"WEAPON PREIGNITE","",James Pomeroy,Human,72,15,0,0,0,3,0,6,1,34,47,1,Chris Phillips,Lanius,67,0,8,0,0,5,1,11,1,0,47,0,Liu Jun,Human,39,0,0,17,0,2,0,5,1,0,47,0,Kirby,Rock,97,0,0,0,82,6,0,11,1,0,39,1,,,,,,,,,,,,,,,
48,4,HOSTILE,Mantis Controlled Sector,45%,21,611,4,2267,"","There is a small planet nearby with scattered settlements. A small Rebel fleet is in orbit with many ships ferrying back and forth. It must be a more recently 'liberated' planet.","",27,18,7,17,21,4,81,12,6,6,0,2,2,0,1,1,0,4,3,0,SHOTGUN,LASER BURST 2,,,0,0,0,,,0,0,0,0,0,0,0,0,0,0,0,0,1,0,0,0,0,0,0,0,0,1,0,2,0,2,0,0,0,"WEAPON PREIGNITE","",James Pomeroy,Human,80,15,0,0,0,3,0,6,1,34,48,1,Chris Phillips,Lanius,75,0,8,0,0,5,1,11,1,0,48,0,Liu Jun,Human,47,0,0,17,0,2,0,5,1,0,48,0,Kirby,Rock,105,0,0,0,82,6,0,11,1,0,40,1,,,,,,,,,,,,,,,
49,4,HOSTILE,Mantis Controlled Sector,55%,22,648,4,2367,"Pulsar Star","The ship explodes, leaving behind a substantial collection of useful scrap material.","",64,16,8,17,23,4,60,12,6,6,0,2,2,0,1,0,0,4,3,0,SHOTGUN,LASER BURST 2,,,0,0,0,,,0,0,0,0,0,0,0,0,0,0,0,0,1,1,0,0,0,0,0,0,0,1,0,2,0,2,0,0,0,"WEAPON PREIGNITE","",James Pomeroy,Human,76,15,0,0,0,5,0,8,1,34,49,1,Chris Phillips,Lanius,41,0,8,0,0,5,1,11,1,0,49,0,Liu Jun,Human,94,0,0,7,0,0,0,5,1,0,49,0,Kirby,Rock,4,0,0,0,85,6,0,11,1,0,41,1,,,,,,,,,,,,,,,
50,4,HOSTILE,Mantis Controlled Sector,65%,22,648,4,2382,"Solar Flares","You arrive to find yourself extremely close to a star. You receive a message from a pirate ship, I'm glad you arrived; our ship is damaged and we were getting desperate... I hope you don't mind if we take yours. Hostiles detected on board our ship!","",64,16,7,17,23,4,44,12,6,0,0,2,2,0,1,1,0,4,3,0,SHOTGUN,LASER BURST 2,,,0,0,0,,,0,0,0,0,0,0,0,0,0,0,0,0,1,1,0,0,0,0,0,0,0,1,0,2,0,2,0,0,0,"WEAPON PREIGNITE","",James Pomeroy,Human,84,15,0,0,0,5,0,8,1,34,50,1,Chris Phillips,Lanius,49,0,8,0,0,5,1,11,1,0,50,0,Liu Jun,Human,100,0,0,7,0,0,0,5,1,0,50,0,Kirby,Rock,12,0,0,0,85,6,0,11,1,0,42,1,,,,,,,,,,,,,,,
51,4,HOSTILE,Mantis Controlled Sector,75%,22,648,4,2397,"","You receive generic advertisements from a nearby public ship-yard. It seems they are willing to work on any ship, not only those of Rebel hue.","Crew: Engi, Engi, Human, Weapon: BEAM HULL, BOMB FIRE, LASER CHARGEGUN 2, ",55,19,6,17,23,4,67,12,6,4,0,2,2,0,1,1,0,4,3,0,SHOTGUN,LASER BURST 2,,,0,0,0,,,0,0,0,0,0,0,0,0,0,0,0,0,1,1,0,0,0,0,0,0,0,1,0,2,0,2,0,0,0,"WEAPON PREIGNITE","",James Pomeroy,Human,92,15,0,0,0,5,0,8,1,34,51,1,Chris Phillips,Lanius,0,0,8,0,0,5,1,11,1,0,50,0,Liu Jun,Human,100,0,0,7,0,0,0,5,1,0,51,0,Kirby,Rock,20,0,0,0,85,6,0,11,1,0,43,1,,,,,,,,,,,,,,,
52,4,HOSTILE,Mantis Controlled Sector,84%,22,664,4,2436,"","","",71,19,5,17,23,4,67,12,6,4,0,2,2,0,1,1,0,4,3,0,SHOTGUN,LASER BURST 2,,,0,0,0,,,0,0,0,0,0,0,0,0,0,0,0,0,1,1,0,0,0,0,0,0,0,1,0,2,0,2,0,0,0,"WEAPON PREIGNITE","",James Pomeroy,Human,100,15,0,0,0,5,0,8,1,34,52,1,Chris Phillips,Lanius,100,0,5,0,0,2,0,11,1,0,51,0,Liu Jun,Human,100,0,0,7,0,0,0,5,1,0,52,0,Kirby,Rock,28,0,0,0,85,6,0,11,1,0,44,1,,,,,,,,,,,,,,,AUTO_BASIC,9,16,0,10,0,0,16,4,4,0,5,2,0,0,0,0,5,0,0,ION 2,LASER HEAVY 1,LASER BURST 3,0,0,0,,,,0,0,0,0,0,0,0,0,0,0,0,0,0,0,0,0,0,0,0,0,0,2,0,0,0,0,0,0,0,"",,,,,,,,,,,,,,,,,,,,,false,1,false,,0,0
53,4,HOSTILE,Mantis Controlled Sector,94%,23,704,4,2541,"Asteroid Field","The ship explodes, leaving behind a substantial collection of useful scrap material.","",111,17,6,18,23,4,88,12,6,6,0,2,2,0,1,1,0,4,3,0,SHOTGUN,LASER BURST 2,,,0,0,0,,,0,0,0,0,0,0,0,0,0,0,0,0,1,0,0,0,0,0,0,0,0,1,0,2,0,2,0,0,0,"WEAPON PREIGNITE","",James Pomeroy,Human,100,21,0,0,0,5,0,8,1,46,53,1,Chris Phillips,Lanius,100,0,11,0,0,2,0,11,1,0,52,0,Liu Jun,Human,93,0,0,16,0,0,0,5,1,0,53,0,Kirby,Rock,36,0,0,0,96,6,0,11,1,0,45,1,,,,,,,,,,,,,,,
54,4,HOSTILE,Mantis Controlled Sector,104%,23,704,4,2556,"","We understand... Please send help our way if you meet anyone trustworthy.","",111,17,5,18,23,4,89,12,6,6,0,2,2,0,1,1,0,4,3,0,SHOTGUN,LASER BURST 2,,,0,0,0,,,0,0,0,0,0,0,0,0,0,0,0,0,1,0,0,0,0,0,0,0,0,1,0,2,0,2,0,0,0,"WEAPON PREIGNITE","",James Pomeroy,Human,100,21,0,0,0,5,0,8,1,46,54,1,Chris Phillips,Lanius,100,0,11,0,0,2,0,11,1,0,53,0,Liu Jun,Human,100,0,0,16,0,0,0,5,1,0,54,0,Kirby,Rock,44,0,0,0,96,6,0,11,1,0,46,1,,,,,,,,,,,,,,,ROCK_FIGHT,13,16,0,10,3,100,16,4,4,0,4,2,0,1,1,0,5,0,0,MISSILES 2,LASER HEAVY 2,,0,0,0,,,,2,1,0,0,0,0,0,0,0,0,0,0,0,0,0,0,0,0,0,0,0,2,0,0,0,0,0,0,0,"ROCK ARMOR",Pipaluk,Rock,150,0,0,Kapalka,Rock,150,0,0,Hutz,Rock,150,0,0,,,,,,false,1,false,,0,2
55,4,HOSTILE,Mantis Controlled Sector,114%,23,726,4,2604,"","","",133,13,8,19,23,4,88,12,6,6,0,2,2,0,1,1,0,4,3,0,SHOTGUN,LASER BURST 2,,,0,0,0,,,0,0,0,0,0,0,0,0,0,0,0,0,1,0,0,0,0,0,0,0,0,1,0,2,0,2,0,0,0,"WEAPON PREIGNITE","",James Pomeroy,Human,100,24,0,0,0,5,0,8,1,52,55,1,Chris Phillips,Lanius,70,0,13,0,0,4,0,13,1,0,54,0,Liu Jun,Human,100,0,0,18,0,1,0,6,1,0,55,0,Kirby,Rock,52,0,0,0,109,6,0,11,1,0,47,1,,,,,,,,,,,,,,,REBEL_FAT_DLC,4,16,3,5,3,100,18,5,4,0,4,4,0,1,1,0,3,0,0,MISSILES 2,LASER HEAVY 1,,5,0,1,DEFENSE 2 ENEMY,REPAIR,ANTI DRONE,0,0,0,0,0,0,0,0,0,0,0,0,0,0,0,0,0,0,0,0,0,2,0,0,0,0,0,0,0,"",Kara,Human,100,0,0,Zerimar,Human,25,3,0,Sean O'Regan,Human,85,1,0,,,,,,true,4,false,1,0,2
56,5,