42,4,HOSTILE,Mantis Controlled Sector,22%,18,519,2,1949,"","With no fear of catching the disease, your Engi crewmember helps reassure and organize the infected humans. Calmed by its extensive knowledge of human physiology, the infected submit to the quarantine in the hopes that a cure can be found soon. The colony leaders offer a reward for helping to prevent an ugly incident.","",19,18,10,16,15,2,100,15,4,4,0,4,4,0,1,1,0,5,5,0,LASER BURST 2 A,LASER BURST 2 A,LASER HEAVY 1,3,0,0,BATTLE,DEFENSE 1,COMBAT 1,1,0,0,0,0,0,0,0,0,0,0,0,0,0,0,0,0,0,0,0,0,1,0,0,0,1,0,0,0,"DRONE RECOVERY, ENERGY SHIELD, FTL BOOSTER","",Yeoz,Engi,100,14,0,0,0,1,1,1,0,28,41,0,Kara,Engi,100,0,0,55,0,0,0,0,0,0,2,0,,,,,,,,,,,,,,,,,,,,,,,,,,,,,,,,,,,,,,,,,,,
43,4,HOSTILE,Mantis Controlled Sector,32%,18,555,2,2018,"","Debris from a forgotten battle still orbits the gas giant in this system. Some of it still might be usable.","",55,18,9,17,16,2,100,15,4,4,0,4,4,0,1,1,0,5,5,0,LASER BURST 2 A,LASER BURST 2 A,LASER HEAVY 1,3,0,0,BATTLE,DEFENSE 1,COMBAT 1,1,0,0,0,0,0,0,0,0,0,0,0,0,0,0,0,0,0,0,0,0,1,0,0,0,1,0,0,0,"DRONE RECOVERY, ENERGY SHIELD, FTL BOOSTER","",Yeoz,Engi,100,14,0,0,0,1,1,1,0,28,42,0,Kara,Engi,100,0,0,55,0,0,0,0,0,0,3,0,,,,,,,,,,,,,,,,,,,,,,,,,,,,,,,,,,,,,,,,,,,
44,4,HOSTILE,Mantis Controlled Sector,42%,18,576,2,2064,"","You pull up alongside the station and release the drone through the airlock. Within a short time the majority of the creatures are dead, with only a little collateral damage. They express their most sincere gratitude.","",46,18,12,16,20,2,100,16,4,4,0,4,4,0,1,1,0,5,5,0,LASER BURST 2 A,LASER BURST 2 A,LASER HEAVY 1,3,0,0,BATTLE,DEFENSE 1,COMBAT 1,1,0,0,0,0,0,0,0,0,0,0,0,0,0,0,0,0,0,0,0,0,1,0,0,0,1,0,0,0,"DRONE RECOVERY, ENERGY SHIELD, FTL BOOSTER","",Yeoz,Engi,100,14,0,0,0,1,1,1,0,28,43,0,Kara,Engi,100,0,0,55,0,0,0,0,0,0,4,0,,,,,,,,,,,,,,,,,,,,,,,,,,,,,,,,,,,,,,,,,,,
45,4,HOSTILE,Mantis Controlled Sector,52%,19,604,2,2151,"","The ship explodes, leaving behind a substantial collection of useful scrap material.","",74,18,14,17,20,2,100,16,4,4,0,4,4,0,1,1,0,5,5,0,LASER BURST 2 A,LASER BURST 2 A,LASER HEAVY 1,3,0,0,BATTLE,DEFENSE 1,COMBAT 1,1,0,0,0,0,0,0,0,0,0,0,0,0,0,0,0,0,0,0,0,0,1,0,0,0,1,0,0,0,"DRONE RECOVERY, ENERGY SHIELD, FTL BOOSTER","",Yeoz,Engi,100,19,0,0,0,1,1,1,0,38,44,1,Kara,Engi,100,0,5,55,0,0,0,0,0,0,5,0,,,,,,,,,,,,,,,,,,,,,,,,,,,,,,,,,,,,,,,,,,,
46,4,HOSTILE,Mantis Controlled Sector,62%,20,675,2,2303,"","Apparently the ship that was being assaulted was a science vessel. They thank you for saving them and offer a small reward.","",85,18,13,19,23,2,100,17,4,4,0,4,4,0,1,1,0,5,5,0,LASER BURST 2 A,LASER BURST 2 A,LASER HEAVY 1,4,2,0,BATTLE,DEFENSE 1,COMBAT 1,1,0,0,0,0,0,0,0,0,0,0,0,0,0,0,0,0,0,0,0,0,1,0,0,0,1,0,0,0,"DRONE RECOVERY, ENERGY SHIELD, FTL BOOSTER","",Yeoz,Engi,100,21,0,0,0,1,1,1,0,42,45,1,Kara,Engi,100,0,7,55,0,0,0,0,0,0,6,0,,,,,,,,,,,,,,,,,,,,,,,,,,,,,,,,,,,,,,,,,,,
47,4,HOSTILE,Mantis Controlled Sector,72%,21,705,3,2393,"","The ship explodes, leaving behind a substantial collection of useful scrap material.","",85,18,14,19,23,3,100,18,4,4,0,4,4,0,1,1,0,5,5,0,LASER BURST 2 A,LASER BURST 2 A,LASER HEAVY 1,4,2,0,BATTLE,DEFENSE 1,COMBAT 1,1,0,0,0,0,0,0,0,0,0,0,0,0,0,0,0,0,0,0,0,0,1,0,0,0,1,0,0,0,"DRONE RECOVERY, ENERGY SHIELD, FTL BOOSTER","BATTLE",Yeoz,Engi,100,27,0,0,0,1,1,1,0,54,46,1,Kara,Engi,100,0,13,55,0,0,0,0,0,0,7,0,Liam,Mantis,100,0,15,0,12,0,0,0,0,0,0,0,,,,,,,,,,,,,,,,,,,,,,,,,,,,,
48,4,HOSTILE,Mantis Controlled Sector,82%,22,749,3,2504,"","It seems the crew did not survive the assault. You take what you can from the remains of the ship.","",54,18,16,20,24,3,100,18,5,4,0,4,4,0,1,1,0,5,5,0,LASER BURST 2 A,LASER BURST 2 A,LASER HEAVY 1,4,2,0,BATTLE,DEFENSE 1,COMBAT 1,1,0,0,0,0,0,0,0,0,0,0,0,0,0,0,0,0,0,0,0,0,1,0,0,0,2,0,0,0,"DRONE RECOVERY, ENERGY SHIELD, FTL BOOSTER","BATTLE",Yeoz,Engi,100,28,0,0,0,1,1,1,0,56,47,1,Kara,Engi,100,0,14,55,0,0,0,0,0,0,8,0,Liam,Mantis,100,0,15,0,18,0,0,0,0,0,1,0,,,,,,,,,,,,,,,,,,,,,,,,,,,,,
49,4,HOSTILE,Mantis Controlled Sector,91%,23,765,3,2573,"","The ship appears to have been transporting prisoners. Unfortunately they were all killed in the battle. You salvage what you can.","",70,18,16,22,24,3,100,18,5,4,0,4,4,0,1,1,0,5,5,0,LASER BURST 2 A,LASER BURST 2 A,LASER HEAVY 1,4,0,0,BATTLE,DEFENSE 1,COMBAT 1,1,0,0,0,0,0,0,0,0,0,0,0,0,0,0,0,0,0,0,0,0,1,0,0,0,2,0,0,0,"DRONE RECOVERY, ENERGY SHIELD, FTL BOOSTER","BATTLE",Yeoz,Engi,100,30,0,0,0,1,1,1,0,61,48,2,Kara,Engi,100,0,17,55,0,0,0,0,0,0,9,1,Liam,Mantis,100,0,15,0,27,0,0,0,0,0,2,0,,,,,,,,,,,,,,,,,,,,,,,,,,,,,
50,5,CIVILIAN,Civilian Sector,0%,23,765,3,2588,"","Welcome to a new sector! Get to the exit beacon and jump to the next sector before the pursuing Rebels catch you!","",70,18,15,22,24,3,100,18,5,4,0,4,4,0,1,1,0,5,5,0,LASER BURST 2 A,LASER BURST 2 A,LASER HEAVY 1,4,0,0,BATTLE,DEFENSE 1,COMBAT 1,1,0,0,0,0,0,0,0,0,0,0,0,0,0,0,0,0,0,0,0,0,1,0,0,0,2,0,0,0,"DRONE RECOVERY, ENERGY SHIELD, FTL BOOSTER","BATTLE",Yeoz,Engi,100,30,0,0,0,1,1,1,0,61,49,2,Kara,Engi,100,0,17,55,0,0,0,0,0,0,10,1,Liam,Mantis,100,0,15,0,27,0,0,0,0,0,3,0,,,,,,,,,,,,,,,,,,,,,,,,,,,,,
51,5,CIVILIAN,Civilian Sector,0%,23,765,3,2603,"","Your search is hopeless. Your sensors can't pick up anything in the nebula.","",70,18,14,22,24,3,100,18,5,4,0,4,4,0,1,1,0,5,5,0,LASER BURST 2 A,LASER BURST 2 A,LASER HEAVY 1,4,0,0,BATTLE,DEFENSE 1,COMBAT 1,1,0,0,0,0,0,0,0,0,0,0,0,0,0,0,0,0,0,0,0,0,1,0,0,0,2,0,0,0,"DRONE RECOVERY, ENERGY SHIELD, FTL BOOSTER","BATTLE",Yeoz,Engi,100,30,0,0,0,1,1,1,0,61,50,2,Kara,Engi,100,0,17,55,0,0,0,0,0,0,11,1,Liam,Mantis,100,0,15,0,27,0,0,0,0,0,4,0,,,,,,,,,,,,,,,,,,,,,,,,,,,,,
52,5,CIVILIAN,Civilian Sector,0%,23,804,3,2676,"","You find two heavily damaged ships floating nearby, the remains of a battle. You begin to harvest some usable debris when you hear the sounds of someone beaming aboard followed by the shouts of a boarding party. They must have a Super Shield bypass unit; boarders are on board!","",89,18,15,22,26,3,99,18,5,2,0,4,2,0,1,0,0,5,5,0,LASER BURST 2 A,LASER BURST 2 A,LASER HEAVY 1,4,0,0,BATTLE,DEFENSE 1,COMBAT 1,1,0,0,0,0,0,0,0,0,0,0,0,0,0,0,0,0,0,0,0,0,2,0,0,0,2,0,0,0,"DRONE RECOVERY, ENERGY SHIELD, FTL BOOSTER","BATTLE",Yeoz,Engi,100,30,0,0,0,1,1,1,0,61,51,2,Kara,Engi,100,0,17,55,0,0,0,0,0,0,12,1,Liam,Mantis,100,0,15,0,27,0,0,0,0,0,5,0,,,,,,,,,,,,,,,,,,,,,,,,,,,,,
53,5,CIVILIAN,Civilian Sector,0%,24,851,3,2792,"","Searching the remains, you find that the cargo was military-grade Drone Schematics! You bring them aboard to install in your ship.","",136,18,14,21,26,3,77,18,5,4,0,4,3,0,1,1,0,5,5,0,LASER BURST 2 A,LASER BURST 2 A,LASER HEAVY 1,4,2,0,BATTLE,DEFENSE 1,COMBAT 1,1,1,0,0,0,0,0,0,0,0,0,0,0,0,0,0,0,0,0,0,0,2,0,0,0,2,0,0,0,"DRONE RECOVERY, ENERGY SHIELD, FTL BOOSTER","BATTLE, COMBAT 1",Yeoz,Engi,100,30,0,0,0,1,1,1,0,69,52,2,Kara,Engi,100,0,25,55,0,0,0,0,0,0,13,1,Liam,Mantis,100,0,15,0,39,0,0,0,0,0,6,0,,,,,,,,,,,,,,,,,,,,,,,,,,,,,
54,5,CIVILIAN,Civilian Sector,0%,24,851,3,2807,"","Your pilot carefully explores the wrecks, but the storm has taken its toll. Any crew are long-since dead and the floating debris has been scorched beyond repair.","",31,18,13,21,26,3,83,18,5,0,0,4,3,0,1,1,0,5,5,0,LASER BURST 2 A,LASER BURST 2 A,LASER HEAVY 1,6,0,0,DEFENSE 1,COMBAT 1,COMBAT 1,1,0,0,0,0,0,0,0,0,0,0,0,0,0,0,0,0,0,0,0,0,2,0,0,0,2,0,0,0,"DRONE RECOVERY, ENERGY SHIELD, FTL BOOSTER","BATTLE, BATTLE",Yeoz,Engi,100,30,0,0,0,1,1,1,0,69,53,2,Kara,Engi,100,0,25,55,0,0,0,0,0,0,14,1,Liam,Mantis,100,0,15,0,39,0,0,0,0,0,7,0,,,,,,,,,,,,,,,,,,,,,,,,,,,,,
55,5,CIVILIAN,Civilian Sector,0%,25,945,3,2993,"","The outpost hails you, The pompous bastards expected free service just because they defeated the Federation. Take this for the help.","",125,18,17,19,28,3,78,18,5,4,0,4,2,0,1,0,0,5,5,0,LASER BURST 2 A,LASER BURST 2 A,LASER HEAVY 1,6,2,0,DEFENSE 1,COMBAT 1,COMBAT 1,1,1,0,0,0,0,0,0,0,0,0,0,0,0,0,0,0,0,0,0,0,2,0,0,0,2,0,0,0,"DRONE RECOVERY, ENERGY SHIELD, FTL BOOSTER","BATTLE, BATTLE",Yeoz,Engi,100,30,0,0,0,1,1,1,0,71,54,2,Kara,Engi,94,0,27,55,0,0,0,0,0,0,15,1,Liam,Mantis,92,0,15,0,47,0,0,0,0,0,8,0,,,,,,,,,,,,,,,,,,,,,,,,,,,,,
56,5,CIVILIAN,Civilian Sector,10%,25,945,3,3008,"","Thank you for your business, no refunds!","",15,23,16,20,28,3,89,20,5,4,0,5,2,0,1,1,0,5,5,0,LASER BURST 2 A,LASER BURST 2 A,LASER HEAVY 1,6,0,0,DEFENSE 1,COMBAT 1,COMBAT 1,1,0,0,0,0,0,0,0,0,0,0,0,0,0,0,0,0,0,0,0,0,2,0,0,0,2,0,0,0,"DRONE RECOVERY, ENERGY SHIELD, FTL BOOSTER","BATTLE, BATTLE",Yeoz,Engi,100,30,0,0,0,1,1,1,0,71,55,2,Kara,Engi,100,0,27,55,0,0,0,0,0,0,16,1,Liam,Mantis,100,0,15,0,47,0,2,0,2,0,9,0,,,,,,,,,,,,,,,,,,,,,,,,,,,,,
57,5,CIVILIAN,Civilian Sector,20%,26,978,3,3102,"","The ship explodes, leaving behind a substantial collection of useful scrap material.","",48,23,17,20,29,3,99,20,5,4,0,5,5,0,1,1,0,5,5,0,LASER BURST 2 A,LASER BURST 2 A,LASER HEAVY 1,6,0,0,DEFENSE 1,COMBAT 1,COMBAT 1,1,0,0,0,0,0,0,0,0,0,0,0,0,0,0,0,0,0,0,0,0,2,0,0,0,2,0,0,0,"DRONE RECOVERY, ENERGY SHIELD, FTL BOOSTER","BATTLE, BATTLE",Yeoz,Engi,100,30,0,0,0,1,1,1,0,74,56,2,Kara,Engi,100,0,30,55,0,0,0,0,0,0,17,2,Liam,Mantis,100,0,15,0,56,0,2,0,2,0,10,0,,,,,,,,,,,,,,,,,,,,,,,,,,,,,
58,5,CIVILIAN,Civilian Sector,30%,27,1025,3,3218,"","The civilian ship wisely made a fast retreat while you distracted the hostile ship.","",95,23,19,20,29,3,100,20,5,4,0,5,4,0,1,1,0,5,5,0,LASER BURST 2 A,LASER BURST 2 A,LASER HEAVY 1,6,0,0,DEFENSE 1,COMBAT 1,COMBAT 1,1,0,0,0,0,0,0,0,0,0,0,0,0,0,0,0,0,0,0,0,0,2,0,0,0,2,0,0,0,"DRONE RECOVERY, ENERGY SHIELD, FTL BOOSTER","BATTLE, BATTLE",Yeoz,Engi,100,30,0,0,0,1,1,1,0,77,57,2,Kara,Engi,100,0,30,55,0,0,0,0,0,0,18,2,Liam,Mantis,100,0,15,0,63,0,2,0,2,0,11,0,,,,,,,,,,,,,,,,,,,,,,,,,,,,,
59,5,CIVILIAN,Civilian Sector,40%,27,1025,3,3233,"","","",95,23,18,21,29,3,100,20,5,4,0,5,5,0,1,1,0,5,5,0,LASER BURST 2 A,LASER BURST 2 A,LASER HEAVY 1,6,0,0,DEFENSE 1,COMBAT 1,COMBAT 1,1,0,0,0,0,0,0,0,0,0,0,0,0,0,0,0,0,0,0,0,0,2,0,0,0,2,0,0,0,"DRONE RECOVERY, ENERGY SHIELD, FTL BOOSTER","BATTLE, BATTLE",Yeoz,Engi,100,30,0,0,0,1,1,1,0,77,58,2,Kara,Engi,100,0,30,55,0,0,0,0,0,0,19,2,Liam,Mantis,100,0,15,0,63,0,2,0,2,0,12,0,,,,,,,,,,,,,,,,,,,,,,,,,,,,,
60,5,CIVILIAN,Civilian Sector,50%,27,1025,3,3248,"","There is only one other ship at this beacon, and it is showing heavy damage. You receive a message on your console: Greetings traveler. We were crippled by a band of pirates and are now forced to sell our remaining valuable equipment to acquire the necessary supplies to get home.","Drone: COMBAT 1, ANTI DRONE, REPAIR, Crew: Engi, Rock, Rock, Augment: DRONE RECOVERY, WEAPON PREIGNITE, FIRE EXTINGUISHERS, ",95,23,17,21,29,3,100,20,5,4,0,5,5,0,1,1,0,5,5,0,LASER BURST 2 A,LASER BURST 2 A,LASER HEAVY 1,6,0,0,DEFENSE 1,COMBAT 1,COMBAT 1,1,0,0,0,0,0,0,0,0,0,0,0,0,0,0,0,0,0,0,0,0,2,0,0,0,2,0,0,0,"DRONE RECOVERY, ENERGY SHIELD, FTL BOOSTER","BATTLE, BATTLE",Yeoz,Engi,100,30,0,0,0,1,1,1,0,77,59,2,Kara,Engi,100,0,30,55,0,0,0,0,0,0,20,2,Liam,Mantis,100,0,15,0,63,0,2,0,2,0,13,0,,,,,,,,,,,,,,,,,,,,,,,,,,,,,
61,5,CIVILIAN,Civilian Sector,60%,27,1048,3,3297,"","","",57,23,18,21,29,3,100,20,5,4,0,5,4,0,1,1,0,5,5,0,LASER BURST 2 A,LASER BURST 2 A,LASER HEAVY 1,6,2,0,DEFENSE 1,COMBAT 1,COMBAT 1,1,0,0,0,0,0,0,0,0,0,0,0,0,0,0,0,0,0,0,0,0,2,0,0,0,2,0,0,0,"DRONE RECOVERY, ENERGY SHIELD, WEAPON PREIGNITE","",Yeoz,Engi,100,30,0,0,0,1,1,1,0,77,60,2,Kara,Engi,100,0,30,55,0,0,0,0,0,0,21,2,Liam,Mantis,100,0,15,0,69,0,2,0,2,0,14,1,,,,,,,,,,,,,,,,,,,,,,,,,,,,,FED_SCOUT_P,2,16,0,10,2,99,20,5,0,5,3,3,0,1,1,0,7,0,0,MISSILES 3,LASER HEAVY 2,ION STUN,0,0,0,,,,0,0,0,0,0,0,0,0,0,0,0,0,0,0,0,0,0,0,0,0,0,2,0,0,0,1,1,0,0,"",Matt,Mantis,69,0,0,Jorlack,Human,10,0,0,,,,,,,,,,,true,2,false,1,0,1
62,5,CIVILIAN,Civilian Sector,69%,28,1081,3,3392,"","Thank the heavens you showed up! We don't have much to offer as a reward, but our engineer should be proficient enough to patch your ship up a bit after that nasty fight.","",90,30,17,21,29,3,81,20,5,4,0,5,4,0,1,1,0,5,5,0,LASER BURST 2 A,LASER BURST 2 A,LASER HEAVY 1,6,2,0,DEFENSE 1,COMBAT 1,COMBAT 1,1,0,0,0,0,0,0,0,0,0,0,0,0,0,0,0,0,0,0,0,0,2,0,0,0,2,0,0,0,"DRONE RECOVERY, ENERGY SHIELD, WEAPON PREIGNITE","",Yeoz,Engi,100,30,0,0,0,1,1,1,0,81,61,2,Kara,Engi,100,0,30,55,0,0,0,0,0,0,22,2,Liam,Mantis,100,0,15,0,81,0,2,0,2,0,15,1,,,,,,,,,,,,,,,,,,,,,,,,,,,,,
63,5,CIVILIAN,Civilian Sector,79%,28,1081,4,3407,"","A transmission from the nearby planet indicates an outpost below which offers supplies to travelers. You send down an away party to check it out.","Drone: COMBAT BEAM, BATTLE, DEFENSE 1, Crew: Human, Engi, Engi, Augment: DRONE RECOVERY, ZOLTAN BYPASS, FLEET DISTRACTION, ",40,30,16,22,29,4,64,20,5,4,0,5,4,0,1,1,0,5,5,0,LASER BURST 2 A,LASER BURST 2 A,LASER HEAVY 1,6,0,0,DEFENSE 1,COMBAT 1,COMBAT 1,1,0,0,0,0,0,0,0,0,0,0,0,0,0,0,0,0,0,0,0,0,2,0,0,0,2,0,0,0,"DRONE RECOVERY, ENERGY SHIELD, WEAPON PREIGNITE","",Yeoz,Engi,100,30,0,0,0,1,1,1,0,81,62,2,Kara,Engi,100,0,30,55,0,0,1,0,1,0,23,2,Liam,Mantis,100,0,15,0,81,0,2,0,2,0,16,1,Nekose,Engi,100,0,0,55,0,0,8,0,0,0,0,0,,,,,,,,,,,,,,,
64,5,CIVILIAN,Civilian Sector,89%,29,1127,4,3521,"","The ship explodes, leaving behind a substantial collection of useful scrap material.","",86,30,16,21,30,4,77,20,5,4,0,5,4,0,1,1,0,5,5,0,LASER BURST 2 A,LASER BURST 2 A,LASER HEAVY 1,6,2,0,DEFENSE 1,COMBAT 1,COMBAT 1,1,0,0,0,0,0,0,0,0,0,0,0,0,0,0,0,0,0,0,0,0,2,0,0,0,2,0,0,0,"DRONE RECOVERY, ENERGY SHIELD, WEAPON PREIGNITE","",Yeoz,Engi,100,30,0,0,0,1,1,1,0,82,63,2,Kara,Engi,100,0,30,55,0,0,1,0,1,0,24,2,Liam,Mantis,100,0,15,0,88,0,2,0,2,0,17,1,Nekose,Engi,100,0,0,55,0,0,8,0,0,0,1,0,,,,,,,,,,,,,,,
65,6,HOSTILE,Rebel Controlled Sector,0%,29,1127,4,3536,"","Once the Federation forces were scattered, the Rebels came down hard on the locals here. Between the 'tax collectors' and military bases, the Rebel presence in this sector is high.","",86,30,15,22,30,4,77,20,5,4,0,5,4,0,1,1,0,5,5,0,LASER BURST 2 A,LASER BURST 2 A,LASER HEAVY 1,6,0,0,DEFENSE 1,COMBAT 1,COMBAT 1,1,0,0,0,0,0,0,0,0,0,0,0,0,0,0,0,0,0,0,0,0,2,0,0,0,2,0,0,0,"DRONE RECOVERY, ENERGY SHIELD, WEAPON PREIGNITE","",Yeoz,Engi,100,30,0,0,0,1,1,1,0,82,64,2,Kara,Engi,100,0,30,55,0,0,1,0,1,0,25,2,Liam,Mantis,100,0,15,0,88,0,2,0,2,0,18,1,Nekose,Engi,100,0,0,55,0,0,8,0,0,0,2,0,,,,,,,,,,,,,,,
66,6,HOSTILE,Rebel Controlled Sector,0%,29,1127,4,3551,"","You receive generic advertisements from a nearby public ship-yard. It seems they are willing to work on any ship, not only those of Rebel hue.","Weapon: BOMB 1, LASER CHARGEGUN 2, MISSILE CHARGEGUN, Drone: DRONE SHIELD, COMBAT BEAM, BATTLE, ",86,30,14,22,30,4,78,20,5,4,0,5,4,0,1,1,0,5,5,0,LASER BURST 2 A,LASER BURST 2 A,LASER HEAVY 1,6,0,0,DEFENSE 1,COMBAT 1,COMBAT 1,1,0,0,0,0,0,0,0,0,0,0,0,0,0,0,0,0,0,0,0,0,2,0,0,0,2,0,0,0,"DRONE RECOVERY, ENERGY SHIELD, WEAPON PREIGNITE","",Yeoz,Engi,100,30,0,0,0,1,1,1,0,82,65,2,Kara,Engi,100,0,30,55,0,0,1,0,1,0,26,2,Liam,Mantis,100,0,15,0,88,0,2,0,2,0,19,1,Nekose,Engi,100,0,0,55,0,0,8,0,0,0,3,0,,,,,,,,,,,,,,,
67,6,HOSTILE,Rebel Controlled Sector,5%,30,1156,4,3639,"","The ship breaks apart and you feel relief in the knowledge that you will hopefully still be one step ahead of the fleet.","",80,30,16,22,30,4,90,21,5,4,0,5,5,0,1,1,0,5,5,0,LASER BURST 2 A,LASER BURST 2 A,LASER HEAVY 1,6,2,0,DEFENSE 1,COMBAT 1,COMBAT 1,1,0,0,0,0,0,0,0,0,0,0,0,0,0,0,0,0,0,0,0,0,2,0,0,0,2,0,0,0,"DRONE RECOVERY, ENERGY SHIELD, WEAPON PREIGNITE","",Yeoz,Engi,100,30,0,0,0,1,1,1,0,83,66,2,Kara,Engi,100,0,30,55,0,0,1,0,1,0,27,2,Liam,Mantis,100,0,15,0,97,0,2,0,2,0,20,1,Nekose,Engi,100,0,0,55,0,0,8,0,0,0,4,0,,,,,,,,,,,,,,,
68,6,HOSTILE,Rebel Controlled Sector,15%,31,1195,4,3743,"","The ship explodes, leaving behind a substantial collection of useful scrap material.","",39,30,16,23,30,4,100,21,5,4,0,5,5,0,1,1,0,5,5,0,LASER BURST 2 A,LASER BURST 2 A,LASER HEAVY 1,7,2,0,DEFENSE 1,COMBAT 1,COMBAT 1,1,0,0,0,0,0,0,0,0,0,0,0,0,0,0,0,0,0,0,0,0,2,0,0,0,2,0,0,0,"DRONE RECOVERY, ENERGY SHIELD, WEAPON PREIGNITE","",Yeoz,Engi,100,30,0,0,0,1,1,1,0,84,67,2,Kara,Engi,100,0,30,55,0,0,1,0,1,0,28,2,Liam,Mantis,100,0,15,0,106,0,2,0,2,0,21,1,Nekose,Engi,100,0,0,55,0,0,8,0,0,0,5,0,,,,,,,,,,,,,,,
69,6,HOSTILE,Rebel Controlled Sector,24%,31,1195,4,3758,"","The drone keeps the ship stable enough to allow them to escape the asteroid field. They message you with map coordinates, You're that Federation ship the Rebels are after, aren't you? I can't offer much but I heard there was a Federation loyalist base nearby. Maybe they can help you? Added a quest marker to your map!","",39,30,15,23,30,4,100,21,5,4,0,5,5,0,1,1,0,5,5,0,LASER BURST 2 A,LASER BURST 2 A,LASER HEAVY 1,7,0,0,DEFENSE 1,COMBAT 1,COMBAT 1,1,0,0,0,0,0,0,0,0,0,0,0,0,0,0,0,0,0,0,0,0,2,0,0,0,2,0,0,0,"DRONE RECOVERY, ENERGY SHIELD, WEAPON PREIGNITE","",Yeoz,Engi,100,30,0,0,0,1,1,1,0,84,68,2,Kara,Engi,100,0,30,55,0,0,1,0,1,0,29,2,Liam,Mantis,100,0,15,0,106,0,2,0,2,0,22,1,Nekose,Engi,100,0,0,55,0,0,8,0,0,0,6,0,,,,,,,,,,,,,,,
70,6,HOSTILE,Rebel Controlled Sector,34%,31,1224,4,3816,"","","",68,30,20,21,38,4,100,21,5,4,0,5,5,0,1,1,0,5,5,0,LASER BURST 2 A,LASER BURST 2 A,LASER HEAVY 1,7,2,0,DEFENSE 1,COMBAT 1,COMBAT 1,1,0,0,0,0,0,0,0,0,0,0,0,0,0,0,0,0,0,0,0,0,2,0,0,0,2,0,0,0,"DRONE RECOVERY, ENERGY SHIELD, WEAPON PREIGNITE","",Yeoz,Engi,100,30,0,0,0,1,1,1,0,85,69,2,Kara,Engi,100,0,30,55,0,0,1,0,1,0,30,2,Liam,Mantis,100,0,15,0,112,0,2,0,2,0,23,1,Nekose,Engi,100,0,0,55,0,0,8,0,0,0,7,0,,,,,,,,,,,,,,,REBEL_FAT,5,16,3,10,4,96,20,5,0,5,4,2,2,1,1,0,4,0,0,SHOTGUN,LASER BURST 3,,5,0,0,DRONE SHIELD,ANTI DRONE,REPAIR,1,1,0,0,0,0,0,0,0,0,0,0,0,0,0,0,0,0,0,0,0,1,0,0,0,1,0,0,0,"",Zerimar,Human,92,0,0,Alison,Human,99,0,0,Tai Yi,Human,74,0,0,Kapalka,Human,29,1,0,true,5,false,2,0,3
71,6,HOSTILE,Rebel Controlled Sector,39%,31,1254,5,3876,"","Within the ship graveyard you find one ship that seems relatively untouched. On board you find an unconscious passenger and take him back to the ship. Once awake they offer to join your crew in thanks.","",98,30,22,22,39,5,99,21,5,0,0,5,5,0,1,0,0,5,5,0,LASER BURST 2 A,LASER BURST 2 A,LASER HEAVY 1,7,0,0,DEFENSE 1,COMBAT 1,COMBAT 1,1,0,0,0,0,0,0,0,0,0,0,0,0,0,0,0,0,0,0,0,0,2,0,0,0,2,0,0,0,"DRONE RECOVERY, ENERGY SHIELD, WEAPON PREIGNITE","",Yeoz,Engi,100,30,0,0,0,1,1,1,0,85,70,2,Kara,Engi,100,0,30,55,0,0,1,0,1,0,31,2,Liam,Mantis,100,0,15,0,112,0,2,0,2,0,24,1,Nekose,Engi,100,0,0,55,0,0,8,0,0,0,8,0,Turing,Human,100,26,0,0,0,0,0,0,0,0,0,0,
72,6,HOSTILE,Rebel Controlled Sector,44%,32,1279,5,3959,"","The ship breaks apart and you feel relief in the knowledge that you will hopefully still be one step ahead of the fleet.","",28,30,21,22,40,5,56,22,6,4,0,5,5,0,1,0,0,5,5,0,LASER BURST 2 A,LASER BURST 2 A,LASER HEAVY 1,7,2,0,DEFENSE 1,COMBAT 1,COMBAT 1,1,0,0,0,0,0,0,0,0,0,0,0,0,0,0,0,0,0,0,0,0,2,0,0,0,2,0,0,0,"DRONE RECOVERY, ENERGY SHIELD, WEAPON PREIGNITE","",Yeoz,Engi,100,30,0,0,0,1,1,1,0,85,71,2,Kara,Engi,100,0,30,55,0,0,1,0,1,0,32,2,Liam,Mantis,100,0,15,0,119,0,2,0,2,0,25,1,Nekose,Engi,100,0,0,56,0,0,8,0,0,0,9,0,Turing,Human,100,26,0,0,0,0,0,0,0,1,1,0,
73,6,HOSTILE,Rebel Controlled Sector,49%,32,1342,5,4068,"","","",91,30,20,23,44,5,31,22,6,6,0,5,5,0,1,0,0,5,5,0,LASER BURST 2 A,LASER BURST 2 A,LASER HEAVY 1,7,2,0,DEFENSE 1,COMBAT 1,COMBAT 1,1,0,0,0,0,0,0,0,0,0,0,0,0,0,0,0,0,0,0,0,0,2,0,0,0,2,0,0,0,"DRONE RECOVERY, ENERGY SHIELD, WEAPON PREIGNITE","COMBAT 1",Yeoz,Engi,100,30,0,0,0,1,1,1,0,85,72,2,Kara,Engi,100,0,30,55,0,0,1,0,1,0,33,2,Liam,Mantis,100,0,15,0,128,0,2,0,2,0,26,1,Nekose,Engi,100,0,0,56,0,0,8,0,0,0,10,0,Turing,Human,100,26,0,0,0,0,0,0,0,1,2,0,ZOLTAN_BOMBER_P_DLC,2,16,2,8,4,85,27,7,0,7,3,1,2,1,0,1,5,0,0,ION 2,MISSILES 2,LASER BURST 1,0,0,0,,,,0,0,0,0,0,0,0,0,0,0,0,0,1,1,0,0,0,0,1,0,1,1,1,0,0,1,0,0,0,"ENERGY SHIELD",Zas,Engi,30,0,0,Gracie,Rock,120,0,0,Stelly,Mantis,5,0,0,Arries,Zoltan,10,0,0,true,2,false,1,0,2
74,6,HOSTILE,Rebel Controlled Sector,59%,32,1390,5,4155,"","After a quick search you discover the hidden Federation space-dock. They offer you some supplies in addition to fully repairing your ship.","",139,30,20,24,45,5,25,22,6,6,0,5,5,0,1,0,0,5,5,0,LASER BURST 2 A,LASER BURST 2 A,LASER HEAVY 1,7,0,0,DEFENSE 1,COMBAT 1,COMBAT 1,1,0,0,0,0,0,0,0,0,0,0,0,0,0,0,0,0,0,0,0,0,2,0,0,0,2,0,0,0,"DRONE RECOVERY, ENERGY SHIELD, WEAPON PREIGNITE","COMBAT 1",Yeoz,Engi,100,30,0,0,0,1,1,1,0,85,73,2,Kara,Engi,100,0,30,55,0,0,1,0,1,0,34,2,Liam,Mantis,100,0,15,0,128,0,2,0,2,0,27,1,Nekose,Engi,100,0,0,56,0,0,8,0,0,0,11,0,Turing,Human,100,26,0,0,0,0,0,0,0,1,3,0,
75,6,HOSTILE,Rebel Controlled Sector,69%,32,1390,5,4170,"","There are no other ships near this beacon, however you detect a small communication relay. You tap into it without a problem; there is no encryption. Most of the chatter revolves around troop and fleet movements, not particularly interesting.","",9,30,19,24,45,5,27,24,6,6,0,5,5,0,2,1,0,5,5,0,LASER BURST 2 A,LASER BURST 2 A,LASER HEAVY 1,7,0,0,DEFENSE 1,COMBAT 1,COMBAT 1,2,0,0,0,0,0,0,0,0,0,0,0,0,0,0,0,0,0,0,0,0,2,0,0,0,2,0,0,0,"DRONE RECOVERY, ENERGY SHIELD, WEAPON PREIGNITE","COMBAT 1",Yeoz,Engi,100,30,0,0,0,1,1,1,0,85,74,2,Kara,Engi,100,0,30,55,0,0,1,0,1,0,35,2,Liam,Mantis,100,0,15,0,128,0,2,0,2,0,28,1,Nekose,Engi,100,0,0,56,0,0,8,0,0,0,12,0,Turing,Human,100,26,0,0,0,0,0,0,0,1,4,0,
76,6,HOSTILE,Rebel Controlled Sector,79%,32,1390,5,4185,"Solar Flares","You arrive to find yourself extremely close to a star. You receive a message from a pirate ship, I'm glad you arrived; our ship is damaged and we were getting desperate... I hope you don't mind if we take yours. Hostiles detected on board our ship! They must have a Super Shield bypass unit; boarders are on board!","",9,30,18,24,45,5,35,24,6,6,0,5,5,0,2,1,0,5,5,0,LASER BURST 2 A,LASER BURST 2 A,LASER HEAVY 1,7,0,0,DEFENSE 1,COMBAT 1,COMBAT 1,2,1,0,0,0,0,0,0,0,0,0,0,0,0,0,0,0,0,0,0,0,2,0,0,0,2,0,0,0,"DRONE RECOVERY, ENERGY SHIELD, WEAPON PREIGNITE","COMBAT 1",Yeoz,Engi,100,30,0,0,0,1,1,1,0,85,75,2,Kara,Engi,100,0,30,55,0,0,1,0,1,0,36,2,Liam,Mantis,100,0,15,0,128,0,2,0,2,0,29,1,Nekose,Engi,100,0,0,56,0,0,8,0,0,0,13,0,Turing,Human,100,26,0,0,0,0,0,0,0,1,5,0,
77,6,HOSTILE,Rebel Controlled Sector,88%,32,1390,5,4200,"","Scans reveal a number of asteroids with useful compositions. You extract some fuel.","",9,30,20,24,45,5,10,24,6,6,0,5,5,0,2,1,0,5,5,0,LASER BURST 2 A,LASER BURST 2 A,LASER HEAVY 1,7,0,0,DEFENSE 1,COMBAT 1,COMBAT 1,2,1,0,0,0,0,0,0,0,0,0,0,0,0,0,0,0,0,0,0,0,2,0,0,0,2,0,0,0,"DRONE RECOVERY, ENERGY SHIELD, WEAPON PREIGNITE","COMBAT 1",Yeoz,Engi,92,30,0,0,0,1,1,1,0,85,76,2,Kara,Engi,93,0,30,55,0,0,1,0,1,0,37,2,Liam,Mantis,94,0,15,0,128,0,2,0,2,0,30,1,Nekose,Engi,97,0,0,56,0,0,8,0,0,0,14,0,Turing,Human,100,26,0,0,0,0,0,0,0,1,6,0,
78,7,CIVILIAN,Engi Controlled Sector,0%,32,1390,5,4215,"","You have arrived in Engi space. The fall of the Federation has brought tough times for these robotic lifeforms, but they're usually willing to help.","",9,30,19,24,45,5,32,24,6,6,0,5,5,0,2,1,0,5,5,0,LASER BURST 2 A,LASER BURST 2 A,LASER HEAVY 1,7,0,0,DEFENSE 1,COMBAT 1,COMBAT 1,2,1,0,0,0,0,0,0,0,0,0,0,0,0,0,0,0,0,0,0,0,2,0,0,0,2,0,0,0,"DRONE RECOVERY, ENERGY SHIELD, WEAPON PREIGNITE","COMBAT 1",Yeoz,Engi,100,30,0,0,0,1,1,1,0,85,77,2,Kara,Engi,100,0,30,55,0,0,1,0,1,0,38,2,Liam,Mantis,100,0,15,0,128,0,4,0,4,0,31,1,Nekose,Engi,100,0,0,56,0,0,8,0,0,0,15,0,Turing,Human,100,26,0,0,0,0,0,0,0,1,7,0,
79,7,CIVILIAN,Engi Controlled Sector,0%,33,1440,5,4335,"Asteroid Field","The ship explodes, leaving behind a substantial collection of useful scrap material.","",59,30,19,23,45,5,71,24,6,6,0,5,5,0,2,1,0,5,5,0,LASER BURST 2 A,LASER BURST 2 A,LASER HEAVY 1,7,2,0,DEFENSE 1,COMBAT 1,COMBAT 1,2,1,0,0,0,0,0,0,0,0,0,0,0,0,0,0,0,0,0,0,0,2,0,0,0,2,0,0,0,"DRONE RECOVERY, ENERGY SHIELD, WEAPON PREIGNITE","COMBAT 1",Yeoz,Engi,100,30,0,0,0,1,1,1,0,85,78,2,Kara,Engi,100,0,30,55,0,0,1,0,1,0,39,2,Liam,Mantis,100,0,15,0,130,0,4,0,4,0,32,2,Nekose,Engi,100,0,0,56,0,0,8,0,0,0,16,0,Turing,Human,100,26,0,0,0,0,0,0,0,4,8,0,
80,7,CIVILIAN,Engi Controlled Sector,8%,34,1492,5,4458,"","The ship explodes, leaving behind a substantial collection of useful scrap material.","",111,30,18,24,46,5,100,24,6,6,0,5,5,0,2,1,0,5,5,0,LASER BURST 2 A,LASER BURST 2 A,LASER HEAVY 1,7,2,0,DEFENSE 1,COMBAT 1,COMBAT 1,2,1,0,0,0,0,0,0,0,0,0,0,0,0,0,0,0,0,0,0,0,2,0,0,0,2,0,0,0,"DRONE RECOVERY, ENERGY SHIELD, WEAPON PREIGNITE","COMBAT 1",Yeoz,Engi,100,30,0,0,0,1,1,1,0,85,79,2,Kara,Engi,100,0,30,55,0,0,1,0,1,0,40,2,Liam,Mantis,100,0,15,0,130,0,4,0,4,0,33,2,Nekose,Engi,100,0,0,57,0,0,8,0,0,0,17,0,Turing,Human,100,26,0,0,0,0,0,0,0,4,9,0,
81,7,CIVILIAN,Engi Controlled Sector,18%,34,1492,5,4473,"","The Engi can do remarkable things with just a pile of scrap. The Engi hive at this beacon are selling equipment for just that.","System: sensors, battery, clonebay, Drone: BOARDER ION, COMBAT 1, DEFENSE 2, ",91,30,17,25,46,5,100,24,6,6,0,5,5,0,2,1,0,5,5,0,LASER BURST 2 A,LASER BURST 2 A,LASER HEAVY 1,7,0,0,COMBAT 1,COMBAT 1,DEFENSE 2,2,1,0,0,0,0,0,0,0,0,0,0,0,0,0,0,0,0,0,0,0,2,0,0,0,2,0,0,0,"DRONE RECOVERY, ENERGY SHIELD, WEAPON PREIGNITE","",Yeoz,Engi,100,30,0,0,0,1,1,1,0,85,80,2,Kara,Engi,100,0,30,55,0,0,1,0,1,0,41,2,Liam,Mantis,100,0,15,0,130,0,4,0,4,0,34,2,Nekose,Engi,100,0,0,57,0,0,8,0,0,0,18,0,Turing,Human,100,26,0,0,0,0,0,0,0,4,10,0,
82,7,CIVILIAN,Engi Controlled Sector,28%,34,1492,5,4488,"","A message arrives: Your scrap, ours. Our weapons for you. You're about to raise the shields when you realize it's just an Engi trader looking for a trade.","System: sensors, cloaking, battery, Weapon: ION CHARGEGUN, LASER BURST 3, BEAM HULL, Drone: DEFENSE 1, COMBAT 1, DRONE SHIELD, Crew: Human, Engi, Zoltan, ",66,30,16,25,46,5,100,24,6,6,0,5,5,0,2,1,0,5,4,0,LASER BURST 2 A,LASER BURST 2 A,ION CHARGEGUN,7,0,0,COMBAT 1,COMBAT 1,DEFENSE 2,2,1,0,0,0,0,0,0,0,0,0,0,0,0,0,0,0,0,0,0,0,2,0,0,0,2,0,0,0,"DRONE RECOVERY, ENERGY SHIELD, WEAPON PREIGNITE","",Yeoz,Engi,100,30,0,0,0,1,1,1,0,85,81,2,Kara,Engi,100,0,30,55,0,0,1,0,1,0,42,2,Liam,Mantis,100,0,15,0,130,0,4,0,4,0,35,2,Nekose,Engi,100,0,0,57,0,0,8,0,0,0,19,0,Turing,Human,100,26,0,0,0,0,0,0,0,4,11,0,
