72,6,CIVILIAN,Zoltan Controlled Sector,0%,24,1069,6,3404,"","You're far from Federation home space here in Zoltan territory, and it's not clear whether the authorities will have any goodwill remaining. Still, you have to push forward.","",34,21,9,3,31,6,56,18,4,4,0,4,3,0,1,1,0,8,8,0,LASER BURST 5,ION 4,LASER HEAVY 1,,3,0,0,DEFENSE 1,COMBAT 1,1,0,0,1,0,0,1,1,0,0,0,0,0,0,0,0,0,0,0,0,0,3,0,1,0,1,0,1,0,"AUTO COOLDOWN, ION ARMOR","",GM Faux,Crystal,125,11,0,9,0,4,9,4,6,22,72,1,Nikola,Crystal,125,0,0,0,0,11,16,11,13,0,72,2,Stelly,Crystal,125,0,2,2,10,6,16,6,8,0,72,2,Ferry,Mantis,98,4,0,0,42,1,16,1,29,8,68,2,Hutz,Rock,150,0,0,17,0,2,5,2,1,0,40,0,Joel,Engi,100,0,9,0,0,5,0,5,0,0,28,0,
73,6,CIVILIAN,Zoltan Controlled Sector,5%,25,1116,6,3519,"","The ship explodes, leaving behind a substantial collection of useful scrap material.","",51,21,8,4,33,6,93,19,4,4,0,4,4,0,1,1,0,8,8,0,LASER BURST 5,ION 4,LASER HEAVY 1,,3,0,0,DEFENSE 1,COMBAT 1,1,1,0,1,0,0,1,1,0,0,0,0,0,0,0,0,0,0,0,0,0,3,0,1,0,1,0,1,0,"AUTO COOLDOWN, ION ARMOR","",GM Faux,Crystal,125,12,0,9,0,4,9,4,6,24,73,1,Nikola,Crystal,121,0,0,0,0,11,16,11,14,0,73,2,Stelly,Crystal,125,0,2,4,10,6,16,6,8,0,73,2,Ferry,Mantis,100,4,0,0,42,1,16,1,30,8,69,2,Hutz,Rock,119,0,0,17,0,2,5,2,1,0,41,0,Joel,Engi,100,0,10,0,0,5,0,5,0,0,29,0,
74,6,CIVILIAN,Zoltan Controlled Sector,15%,26,1167,6,3641,"","The ship explodes, leaving behind a substantial collection of useful scrap material.","",72,14,7,3,35,6,95,20,4,4,0,4,3,0,1,1,0,8,8,0,LASER BURST 5,ION 4,LASER HEAVY 1,,3,0,0,DEFENSE 1,COMBAT 1,1,1,0,1,0,0,1,1,0,0,0,0,0,0,0,0,0,0,0,0,0,3,0,1,0,1,0,1,0,"AUTO COOLDOWN, ION ARMOR","",GM Faux,Crystal,125,23,0,9,0,4,9,4,6,46,74,2,Nikola,Crystal,125,0,0,0,0,12,16,12,14,0,74,2,Stelly,Crystal,125,0,2,25,10,6,16,6,8,0,74,2,Ferry,Mantis,100,4,0,3,44,1,16,1,30,8,70,2,Hutz,Rock,119,0,0,17,0,4,5,4,1,0,42,0,Joel,Engi,100,0,11,0,0,8,0,8,0,0,30,0,
75,6,CIVILIAN,Zoltan Controlled Sector,25%,26,1167,6,3656,"","There are some mineral-rich asteroids here that the Zoltan have left idle, but you've none of the necessary equipment to mine them.","",32,14,6,3,35,6,97,20,5,4,0,4,3,0,1,1,0,8,8,0,LASER BURST 5,ION 4,LASER HEAVY 1,,3,0,0,DEFENSE 1,COMBAT 1,1,1,0,1,0,0,1,1,0,0,0,0,0,0,0,0,0,0,0,0,0,3,0,1,0,1,0,1,0,"AUTO COOLDOWN, ION ARMOR","",GM Faux,Crystal,125,23,0,9,0,4,9,4,6,46,75,2,Nikola,Crystal,125,0,0,0,0,12,16,12,14,0,75,2,Stelly,Crystal,125,0,2,25,10,6,16,6,8,0,75,2,Ferry,Mantis,100,4,0,3,44,1,16,1,30,8,71,2,Hutz,Rock,150,0,0,17,0,4,5,4,1,0,43,0,Joel,Engi,100,0,11,0,0,8,0,8,0,0,31,0,
76,6,CIVILIAN,Zoltan Controlled Sector,35%,26,1167,6,3671,"","As you wait for the FTL drive to charge, you half expect to be ambushed at any moment. However, no attack comes...","",32,14,5,3,35,6,97,20,5,4,0,4,3,0,1,1,0,8,8,0,LASER BURST 5,ION 4,LASER HEAVY 1,,3,0,0,DEFENSE 1,COMBAT 1,1,1,0,1,0,0,1,1,0,0,0,0,0,0,0,0,0,0,0,0,0,3,0,1,0,1,0,1,0,"AUTO COOLDOWN, ION ARMOR","",GM Faux,Crystal,125,23,0,9,0,4,9,4,6,46,76,2,Nikola,Crystal,125,0,0,0,0,12,16,12,14,0,76,2,Stelly,Crystal,125,0,2,25,10,6,16,6,8,0,76,2,Ferry,Mantis,100,4,0,3,44,1,16,1,30,8,72,2,Hutz,Rock,150,0,0,17,0,4,5,4,1,0,44,0,Joel,Engi,100,0,11,0,0,8,0,8,0,0,32,0,
77,6,CIVILIAN,Zoltan Controlled Sector,40%,26,1167,6,3686,"","You cycle through wide-band comm channels as soon as you arrive. Nothing but static.","",32,14,4,3,35,6,97,20,5,4,0,4,3,0,1,1,0,8,8,0,LASER BURST 5,ION 4,LASER HEAVY 1,,3,0,0,DEFENSE 1,COMBAT 1,1,1,0,1,0,0,1,1,0,0,0,0,0,0,0,0,0,0,0,0,0,3,0,1,0,1,0,1,0,"AUTO COOLDOWN, ION ARMOR","",GM Faux,Crystal,125,23,0,9,0,4,9,4,6,46,77,2,Nikola,Crystal,125,0,0,0,0,12,16,12,14,0,77,2,Stelly,Crystal,125,0,2,25,10,6,16,6,8,0,77,2,Ferry,Mantis,100,4,0,3,44,1,16,1,30,8,73,2,Hutz,Rock,150,0,0,17,0,4,5,4,1,0,45,0,Joel,Engi,100,0,11,0,0,8,0,8,0,0,33,0,
78,6,CIVILIAN,Zoltan Controlled Sector,44%,26,1197,6,3746,"","Most of the debris is hardly even usable as scrap. However, you eventually find an intact weapon that can be mounted on your ship.","",62,14,3,3,35,6,96,20,5,4,0,4,2,0,1,0,0,8,4,0,LASER BURST 5,ION 4,LASER HEAVY 1,BOMB HEAL,3,0,0,DEFENSE 1,COMBAT 1,1,0,0,1,0,0,1,0,0,0,0,0,0,0,0,0,0,0,0,0,0,3,0,1,0,1,0,1,0,"AUTO COOLDOWN, ION ARMOR","",GM Faux,Crystal,125,23,0,9,0,4,9,4,6,46,78,2,Nikola,Crystal,125,0,0,0,0,12,16,12,14,0,78,2,Stelly,Crystal,125,0,2,25,10,6,16,6,8,0,78,2,Ferry,Mantis,100,4,0,3,44,1,16,1,30,8,74,2,Hutz,Rock,150,0,0,17,0,4,5,4,1,0,46,0,Joel,Engi,100,0,11,0,0,8,0,8,0,0,34,0,
79,6,CIVILIAN,Zoltan Controlled Sector,49%,27,1233,6,3845,"","There are no more life-signs remaining on the ship. You strip it of useful materials.","",98,14,2,4,36,6,100,20,5,4,0,4,4,0,1,1,0,8,8,0,LASER BURST 5,ION 4,LASER HEAVY 1,BOMB HEAL,3,0,0,DEFENSE 1,COMBAT 1,1,1,0,1,1,0,1,1,0,0,0,0,0,0,0,0,0,0,0,0,0,3,0,1,0,1,0,1,0,"AUTO COOLDOWN, ION ARMOR","",Joel,Engi,100,0,14,0,0,8,0,8,0,0,35,0,GM Faux,Crystal,125,26,0,9,0,4,9,4,6,52,79,2,Nikola,Crystal,54,0,0,0,0,12,16,12,14,0,79,2,Stelly,Crystal,63,0,2,25,10,6,16,6,10,0,79,2,Ferry,Mantis,55,4,0,3,44,1,16,1,31,8,75,2,Hutz,Rock,94,0,0,17,0,4,6,4,2,0,47,0,REBEL_FAT_P_DLC,12,16,2,10,4,100,22,7,6,0,4,3,1,1,1,0,4,0,4,LASER CHARGEGUN 2,LASER HEAVY 1,,,5,0,1,DEFENSE 2 ENEMY,DEFENSE 1,,0,0,0,0,0,0,0,0,0,0,0,0,1,0,1,0,0,0,0,0,0,1,0,0,0,0,0,0,0,"",Julian Rafn,Rock,0,0,0,Hassifa,Slug,0,0,0,Markand,Rock,0,0,0,Justin,Human,0,0,0,false,2,false,5,0,2
80,6,CIVILIAN,Zoltan Controlled Sector,59%,27,1233,6,3860,"","As you approach, a kaleidoscope of colors fills the viewscreen and one of your crew begins to age rapidly in reverse, eventually disappearing into nothingness. Let's hope they've transcended physical existence, and not just been forced out of it.","",98,14,1,4,36,6,100,20,5,4,0,4,4,0,1,1,0,8,8,0,LASER BURST 5,ION 4,LASER HEAVY 1,BOMB HEAL,3,0,0,DEFENSE 1,COMBAT 1,1,1,0,1,1,0,1,1,0,0,0,0,0,0,0,0,0,0,0,0,0,3,0,1,0,1,0,1,0,"AUTO COOLDOWN, ION ARMOR","",GM Faux,Crystal,125,26,0,9,0,4,9,4,6,52,80,2,Nikola,Crystal,125,0,0,0,0,12,16,12,14,0,80,2,Stelly,Crystal,125,0,2,25,10,6,16,6,10,0,80,2,Ferry,Mantis,0,4,0,3,44,1,16,1,31,8,76,2,Hutz,Rock,150,0,0,17,0,4,6,4,2,0,48,0,Joel,Engi,100,0,14,0,0,8,0,8,0,0,36,0,
81,6,CIVILIAN,Zoltan Controlled Sector,64%,27,1233,6,3875,"","The Zoltan are fascinated by other species, and have set up something of an alien knick-knack shop here. Why not take a look?","Drone: DEFENSE 2, DEFENSE 1, SHIP REPAIR, Weapon: LASER HEAVY 2, MISSILES BREACH, BOMB STUN, System: clonebay, mind, hacking, Augment: BACKUP DNA, SHIELD RECHARGE, ION ARMOR, ",53,14,0,4,36,5,100,20,5,4,0,4,4,0,1,1,0,8,8,0,LASER BURST 5,ION 4,LASER HEAVY 1,BOMB HEAL,3,0,0,DEFENSE 1,COMBAT 1,1,1,0,1,1,0,1,1,0,0,0,0,0,0,0,0,0,0,0,0,0,3,0,1,0,1,0,1,0,"AUTO COOLDOWN, ION ARMOR, SHIELD RECHARGE","",GM Faux,Crystal,125,26,0,9,0,4,9,4,6,52,81,2,Nikola,Crystal,125,0,0,0,0,12,16,12,14,0,81,2,Stelly,Crystal,125,0,2,25,10,6,16,6,10,0,81,2,Hutz,Rock,150,0,0,17,0,4,6,4,2,0,49,0,Joel,Engi,100,0,14,0,0,8,0,8,0,0,37,0,,,,,,,,,,,,,,,
82,6,CIVILIAN,Zoltan Controlled Sector,74%,27,1233,6,3890,"","We understand... Please send help our way if you meet anyone trustworthy.","",20,22,2,4,36,5,100,20,5,4,0,4,4,0,1,1,0,8,8,0,LASER BURST 5,ION 4,LASER HEAVY 1,BOMB HEAL,3,0,0,DEFENSE 1,COMBAT 1,1,1,0,1,1,0,1,1,0,0,0,0,0,0,0,0,0,0,0,0,0,3,0,1,0,1,0,1,0,"AUTO COOLDOWN, ION ARMOR, SHIELD RECHARGE","",GM Faux,Crystal,125,26,0,9,0,4,9,4,6,52,82,2,Nikola,Crystal,125,0,0,0,0,12,16,12,14,0,82,2,Stelly,Crystal,125,0,2,25,10,6,16,6,10,0,82,2,Hutz,Rock,150,0,0,17,0,4,6,4,2,0,50,0,Joel,Engi,100,0,14,0,0,8,0,8,0,0,38,0,,,,,,,,,,,,,,,FED_BOMBER,14,16,0,10,4,100,17,6,6,0,3,1,0,2,1,0,5,0,0,LASER BURST 2 A,LASER BURST 2 A,BEAM 1,,0,0,0,,,,0,0,0,0,0,0,0,0,0,0,0,0,0,0,0,0,0,0,0,0,0,3,0,0,0,2,0,0,0,"",Kirby,Human,100,0,0,Giles,Human,100,0,0,Thomas Bloch,Human,100,0,0,Artyom,Human,100,0,0,false,2,false,1,0,4
83,6,CIVILIAN,Zoltan Controlled Sector,84%,28,1286,6,4014,"","The ship explodes, leaving behind a substantial collection of useful scrap material.","",73,15,2,2,37,5,100,20,5,4,1,4,4,0,1,1,0,8,8,0,LASER BURST 5,ION 4,LASER HEAVY 1,BOMB HEAL,3,0,1,DEFENSE 1,COMBAT 1,1,0,0,1,0,0,1,1,0,0,0,0,0,0,0,0,0,0,0,0,0,3,0,1,1,1,0,1,0,"AUTO COOLDOWN, ION ARMOR, SHIELD RECHARGE","",GM Faux,Crystal,125,26,12,9,0,4,9,4,6,52,83,2,Nikola,Crystal,97,0,0,0,0,13,16,13,14,0,83,2,Stelly,Crystal,110,0,2,46,10,6,16,6,10,0,83,2,Hutz,Rock,150,0,0,17,8,5,6,5,2,0,51,0,Joel,Engi,100,12,14,0,0,8,0,8,0,24,39,0,,,,,,,,,,,,,,,
84,6,CIVILIAN,Zoltan Controlled Sector,89%,29,1337,6,4136,"","The ship explodes, leaving behind a substantial collection of useful scrap material.","",64,15,3,1,39,5,62,20,6,6,0,4,3,0,1,0,0,8,8,0,LASER BURST 5,ION 4,LASER HEAVY 1,BOMB HEAL,3,0,0,DEFENSE 1,COMBAT 1,1,0,0,1,0,0,1,1,0,0,0,0,0,0,0,0,0,0,0,0,0,3,0,1,0,1,0,1,0,"AUTO COOLDOWN, ION ARMOR, SHIELD RECHARGE","",GM Faux,Crystal,125,26,12,9,0,5,9,5,6,52,84,2,Nikola,Crystal,97,0,0,0,0,14,16,14,14,0,84,2,Stelly,Crystal,110,0,2,61,10,7,16,7,10,0,84,3,Hutz,Rock,150,0,0,17,26,5,6,5,2,0,52,0,Joel,Engi,100,12,14,0,0,9,0,9,0,24,40,0,,,,,,,,,,,,,,,
85,6,CIVILIAN,Zoltan Controlled Sector,99%,29,1337,6,4151,"","This Long-Range Beacon is almost hidden within a nebula. When the FTL Drive is charged you can jump to the next Sector.","",64,15,2,1,39,5,57,20,6,6,0,4,3,0,1,0,0,8,8,0,LASER BURST 5,ION 4,LASER HEAVY 1,BOMB HEAL,3,0,0,DEFENSE 1,COMBAT 1,1,1,0,1,0,0,1,1,0,0,0,0,0,0,0,0,0,0,0,0,0,3,0,1,0,1,0,1,0,"AUTO COOLDOWN, ION ARMOR, SHIELD RECHARGE","",GM Faux,Crystal,125,26,12,9,0,5,9,5,6,52,85,2,Nikola,Crystal,116,0,0,0,0,14,16,14,14,0,85,2,Stelly,Crystal,118,0,2,61,10,7,16,7,10,0,85,3,Hutz,Rock,150,0,0,17,26,5,6,5,2,0,53,0,Joel,Engi,100,12,14,0,0,9,0,9,0,24,41,0,,,,,,,,,,,,,,,
86,7,HOSTILE,Pirate Controlled Sector,0%,29,1337,6,4166,"","A few Federation-friendly planets still exist in this sector, but they are constantly under attack by pirate raids. This is a dangerous sector, so be careful.","",64,15,1,1,39,5,56,20,6,6,0,4,3,0,1,0,0,8,8,0,LASER BURST 5,ION 4,LASER HEAVY 1,BOMB HEAL,3,0,0,DEFENSE 1,COMBAT 1,1,1,0,1,0,0,1,1,0,0,0,0,0,0,0,0,0,0,0,0,0,3,0,1,0,1,0,1,0,"AUTO COOLDOWN, ION ARMOR, SHIELD RECHARGE","",GM Faux,Crystal,125,26,12,9,0,5,9,5,6,52,86,2,Nikola,Crystal,125,0,0,0,0,14,16,14,14,0,86,2,Stelly,Crystal,125,0,2,61,10,7,16,7,10,0,86,3,Hutz,Rock,150,0,0,17,26,5,6,5,2,0,54,0,Joel,Engi,100,12,14,0,0,9,0,9,0,24,42,0,,,,,,,,,,,,,,,
87,7,HOSTILE,Pirate Controlled Sector,0%,29,1364,6,4221,"","Take this bit of scrap as a down-payment. We'll use your jump signatures to follow you. You're really helping us out here. Added a quest marker to your map!","",56,15,0,1,39,5,57,21,6,6,0,4,3,0,1,1,0,8,8,0,LASER BURST 5,ION 4,LASER HEAVY 1,BOMB HEAL,3,0,0,DEFENSE 1,COMBAT 1,1,1,0,1,0,0,1,1,0,0,0,0,0,0,0,0,0,0,0,0,0,3,0,1,0,1,0,1,0,"AUTO COOLDOWN, ION ARMOR, SHIELD RECHARGE","",GM Faux,Crystal,125,26,12,9,0,5,9,5,6,52,87,2,Nikola,Crystal,125,0,0,0,0,14,16,14,14,0,87,2,Stelly,Crystal,125,0,2,61,10,7,16,7,10,0,87,3,Hutz,Rock,150,0,0,17,26,5,6,5,2,0,55,0,Joel,Engi,100,12,14,0,0,9,0,9,0,24,43,0,,,,,,,,,,,,,,,ROCK_FIGHT,16,16,0,10,4,100,21,7,6,0,4,2,0,1,1,0,8,0,0,LASER BURST 5,MISSILES BREACH,BOMB 1,,0,0,0,,,,1,1,0,0,0,0,0,0,0,0,0,0,0,0,0,0,0,0,0,0,0,2,0,0,0,1,0,0,0,"ROCK ARMOR",Markel,Rock,150,0,0,Zerimar,Rock,150,0,0,Kusy,Rock,150,0,0,Henrik Aasted,Rock,150,0,0,false,3,false,2,0,2
88,7,HOSTILE,Pirate Controlled Sector,0%,29,1364,6,4236,"","A few civilian ships are within scanning range, yet none respond to your calls.","",56,15,0,1,39,5,58,21,6,6,0,4,3,0,1,1,0,8,8,0,LASER BURST 5,ION 4,LASER HEAVY 1,BOMB HEAL,3,0,0,DEFENSE 1,COMBAT 1,1,1,0,1,0,0,1,1,0,0,0,0,0,0,0,0,0,0,0,0,0,3,0,1,0,1,0,1,0,"AUTO COOLDOWN, ION ARMOR, SHIELD RECHARGE","",GM Faux,Crystal,125,26,12,9,0,5,9,5,6,52,87,2,Nikola,Crystal,125,0,0,0,0,14,16,14,14,0,87,2,Stelly,Crystal,125,0,2,61,10,7,16,7,10,0,87,3,Hutz,Rock,150,0,0,17,26,5,6,5,2,0,55,0,Joel,Engi,100,12,14,0,0,9,0,9,0,24,43,0,,,,,,,,,,,,,,,
89,7,HOSTILE,Pirate Controlled Sector,0%,30,1436,6,4389,"","With the crew dead you are free to scrap the ship.","",128,14,4,0,39,5,100,21,6,6,0,4,4,0,1,1,0,8,8,0,LASER BURST 5,ION 4,LASER HEAVY 1,BOMB HEAL,3,0,0,DEFENSE 1,COMBAT 1,1,0,0,1,1,0,1,1,0,0,0,0,0,0,0,0,0,0,0,0,0,3,0,1,0,1,0,1,0,"AUTO COOLDOWN, ION ARMOR, SHIELD RECHARGE","",Joel,Engi,100,17,14,0,0,9,0,9,0,34,43,1,GM Faux,Crystal,43,26,15,9,0,5,9,5,6,52,87,3,Nikola,Crystal,69,0,0,0,0,15,16,15,17,0,87,2,Stelly,Crystal,50,0,2,77,10,7,16,7,11,0,87,3,Hutz,Rock,74,0,0,17,48,5,6,5,2,0,55,0,,,,,,,,,,,,,,,REBEL_FAT,15,16,2,10,0,100,23,8,8,0,4,4,0,1,1,0,5,0,0,LASER BURST 3,LASER CHARGEGUN 2,,,5,0,0,DEFENSE 2 ENEMY,ANTI DRONE,REPAIR,0,0,0,0,0,0,0,0,0,0,0,0,0,0,0,0,0,0,0,0,0,1,0,0,0,2,0,0,0,"",,,,,,,,,,,,,,,,,,,,,false,3,true,300,0,3
90,7,HOSTILE,Pirate Controlled Sector,6%,31,1496,6,4524,"","With the pirate ship disabled, your engines come online again. You salvage what you can from their ship.","",73,12,6,0,39,5,50,22,7,6,1,4,3,0,1,1,0,8,8,0,LASER BURST 5,ION 4,LASER HEAVY 1,BOMB HEAL,3,0,0,DEFENSE 1,COMBAT 1,1,1,0,1,1,0,1,1,0,0,0,0,0,0,0,0,0,0,0,0,0,3,0,1,1,1,0,1,0,"AUTO COOLDOWN, ION ARMOR, SHIELD RECHARGE","",Hutz,Rock,150,0,0,17,48,5,6,5,2,0,56,0,Joel,Engi,100,17,14,0,0,9,0,9,0,34,44,1,GM Faux,Crystal,114,26,15,9,0,5,11,5,7,52,88,3,Nikola,Crystal,35,0,0,0,0,15,16,15,18,0,88,2,Stelly,Crystal,29,0,2,77,10,7,16,7,14,0,88,3,,,,,,,,,,,,,,,MANTIS_BOMBER_P,14,16,0,14,0,100,27,7,1,0,4,4,0,1,1,0,8,0,5,ION CHAINGUN,LASER BURST 5,LASER BURST 1,,0,0,0,,,,1,1,0,2,2,0,0,0,0,0,0,0,0,0,0,0,0,0,0,0,0,1,0,0,0,1,0,0,0,"",,,,,,,,,,,,,,,,,,,,,false,3,false,2,1,3
91,7,HOSTILE,Pirate Controlled Sector,16%,31,1551,6,4622,"","They appear to be filled with military supplies! You take everything you can use and jettison the rest.","",128,12,6,0,41,5,97,22,7,6,0,4,4,0,1,1,0,8,8,0,LASER BURST 5,ION 4,LASER HEAVY 1,BOMB HEAL,3,0,0,DEFENSE 1,COMBAT 1,1,1,0,1,1,0,1,1,0,0,0,0,0,0,0,0,0,0,0,0,0,3,0,1,0,1,0,1,0,"AUTO COOLDOWN, ION ARMOR, SHIELD RECHARGE","",GM Faux,Crystal,125,26,15,9,0,5,11,5,7,52,89,3,Nikola,Crystal,125,0,0,0,0,15,16,15,18,0,89,2,Stelly,Crystal,125,0,2,77,10,7,16,7,14,0,89,3,Hutz,Rock,150,0,0,17,48,6,6,6,2,0,57,0,Joel,Engi,100,17,14,0,0,10,0,10,0,34,45,1,,,,,,,,,,,,,,,
92,7,HOSTILE,Pirate Controlled Sector,26%,31,1551,6,4637,"","You arrive in the nebula and immediately receive a message from an unknown source, Prepare to be boarded! With the static from the nebula, there's no way to tell where they came from, but you hear shots fired on board the ship.","",128,12,5,0,41,5,98,22,7,6,0,4,4,0,1,1,0,8,8,0,LASER BURST 5,ION 4,LASER HEAVY 1,BOMB HEAL,3,0,0,DEFENSE 1,COMBAT 1,1,1,0,1,1,0,1,1,0,0,0,0,0,0,0,0,0,0,0,0,0,3,0,1,0,1,0,1,0,"AUTO COOLDOWN, ION ARMOR, SHIELD RECHARGE","",GM Faux,Crystal,125,26,15,9,0,5,11,5,7,52,90,3,Nikola,Crystal,125,0,0,0,0,15,16,15,18,0,90,2,Stelly,Crystal,125,0,2,77,10,7,16,7,14,0,90,3,Hutz,Rock,150,0,0,17,48,6,6,6,2,0,58,0,Joel,Engi,100,17,14,0,0,10,0,10,0,34,46,1,,,,,,,,,,,,,,,
93,7,HOSTILE,Pirate Controlled Sector,30%,31,1551,6,4652,"","The ship you were escorting thanks you, I don't think we could have made it without your help. Let my friends patch up some of your hull and show you their wares.","Augment: LIFE SCANNER, O2 MASKS, SCRAP COLLECTOR, Crew: Mantis, Human, Human, Weapon: BEAM FIRE, MISSILES BURST, LASER BURST 2 A, ",90,21,6,2,41,5,100,22,7,6,0,4,4,0,1,1,0,8,8,0,LASER BURST 5,ION 4,LASER HEAVY 1,BOMB HEAL,3,0,0,DEFENSE 1,COMBAT 1,1,1,0,1,1,0,1,1,0,0,0,0,0,0,0,0,0,0,0,0,0,3,0,1,0,1,0,1,0,"AUTO COOLDOWN, ION ARMOR, SHIELD RECHARGE","",GM Faux,Crystal,114,26,15,9,0,5,11,5,7,52,91,3,Nikola,Crystal,125,0,0,0,0,15,16,15,20,0,91,2,Stelly,Crystal,125,0,2,77,10,7,16,7,14,0,91,3,Hutz,Rock,150,0,0,17,48,6,6,6,2,0,59,0,Joel,Engi,100,17,14,0,0,10,0,10,0,34,47,1,,,,,,,,,,,,,,,
94,7,HOSTILE,Pirate Controlled Sector,40%,32,1609,6,4784,"Asteroid Field","The ship explodes, leaving behind a substantial collection of useful scrap material.","",148,21,7,2,41,5,100,22,7,6,0,4,4,0,1,1,0,8,8,0,LASER BURST 5,ION 4,LASER HEAVY 1,BOMB HEAL,3,0,0,DEFENSE 1,COMBAT 1,1,0,0,1,0,0,1,1,0,0,0,0,0,0,0,0,0,0,0,0,0,3,0,1,0,1,0,1,0,"AUTO COOLDOWN, ION ARMOR, SHIELD RECHARGE","",GM Faux,Crystal,125,26,26,9,0,5,11,5,7,52,92,3,Nikola,Crystal,125,0,0,0,43,15,16,15,20,0,92,2,Stelly,Crystal,125,0,2,99,10,7,16,7,14,0,92,3,Hutz,Rock,150,0,0,17,48,7,6,7,2,0,60,0,Joel,Engi,100,28,14,0,0,10,0,10,0,56,48,1,,,,,,,,,,,,,,,
95,7,HOSTILE,Pirate Controlled Sector,50%,32,1609,6,4799,"","Great! I uploaded their location to your star map. I'm running out of options, so I have no choice but to trust you'll do what you have agreed to do. Upon examining your map, you realize you just won't have time and need to get to the Federation base! You leave the quest for another day.","",148,21,6,7,41,5,100,22,7,6,0,4,4,0,1,1,0,8,8,0,LASER BURST 5,ION 4,LASER HEAVY 1,BOMB HEAL,3,0,0,DEFENSE 1,COMBAT 1,1,0,0,1,0,0,1,1,0,0,0,0,0,0,0,0,0,0,0,0,0,3,0,1,0,1,0,1,0,"AUTO COOLDOWN, ION ARMOR, SHIELD RECHARGE","",GM Faux,Crystal,125,26,26,9,0,5,11,5,7,52,93,3,Nikola,Crystal,125,0,0,0,43,15,16,15,20,0,93,2,Stelly,Crystal,125,0,2,99,10,7,16,7,14,0,93,3,Hutz,Rock,150,0,0,17,48,7,6,7,2,0,61,0,Joel,Engi,100,28,14,0,0,10,0,10,0,56,49,1,,,,,,,,,,,,,,,
96,7,HOSTILE,Pirate Controlled Sector,60%,32,1609,6,4814,"","You detect a hub of activity nearby. A large corporation has set up a trade depot and has a number of well armed ships patrolling. This appears to be a relatively safe place to get repairs.","System: clonebay, mind, hacking, Augment: AUTO COOLDOWN, ION ARMOR, FTL BOOSTER, Weapon: LASER CHAINGUN, BEAM 2, LASER BURST 3, ",15,21,5,7,41,5,100,23,8,6,0,4,4,0,1,1,0,8,8,0,LASER BURST 5,ION 4,LASER HEAVY 1,,3,0,0,DEFENSE 1,COMBAT 1,1,0,0,1,0,0,1,1,0,0,0,0,0,0,0,0,0,0,0,0,0,3,0,1,0,1,0,1,0,"AUTO COOLDOWN, AUTO COOLDOWN, SHIELD RECHARGE","",GM Faux,Crystal,125,26,26,9,0,5,11,5,7,52,94,3,Nikola,Crystal,125,0,0,0,43,15,16,15,20,0,94,2,Stelly,Crystal,125,0,2,99,10,7,16,7,14,0,94,3,Hutz,Rock,150,0,0,17,48,7,6,7,2,0,62,0,Joel,Engi,100,28,14,0,0,10,0,10,0,56,50,1,,,,,,,,,,,,,,,
97,7,HOSTILE,Pirate Controlled Sector,70%,32,1609,6,4829,"","You let their team on board and after a short time they finish their work.","",3,21,4,7,41,5,100,23,8,6,0,4,4,0,1,1,0,8,8,0,LASER BURST 5,ION 4,LASER HEAVY 1,,3,0,0,DEFENSE 1,COMBAT 1,1,0,0,1,0,0,1,1,0,0,0,0,0,0,0,0,0,0,0,0,0,3,0,1,0,2,0,1,0,"AUTO COOLDOWN, AUTO COOLDOWN, SHIELD RECHARGE","",GM Faux,Crystal,125,26,26,9,0,5,11,5,7,52,95,3,Nikola,Crystal,125,0,0,0,43,15,16,15,20,0,95,2,Stelly,Crystal,125,0,2,99,10,7,16,7,14,0,95,3,Hutz,Rock,150,0,0,17,48,7,6,7,2,0,63,0,Joel,Engi,100,28,14,0,0,10,0,10,0,56,51,1,,,,,,,,,,,,,,,
98,7,HOSTILE,Pirate Controlled Sector,80%,33,1673,6,4970,"","The station was either abandoned or stripped clean. It seems to have lain unused for quite some time. You find nothing useful.","",67,21,3,6,41,5,93,23,8,6,0,4,4,0,1,1,0,8,8,0,LASER BURST 5,ION 4,LASER HEAVY 1,,3,0,2,DEFENSE 1,COMBAT 1,1,1,0,1,0,0,1,1,0,0,0,0,0,0,0,0,0,0,0,0,0,3,0,1,0,2,0,1,0,"AUTO COOLDOWN, AUTO COOLDOWN, SHIELD RECHARGE","",GM Faux,Crystal,90,26,30,9,0,5,11,5,7,52,96,4,Nikola,Crystal,125,0,0,0,68,15,16,15,20,0,96,3,Stelly,Crystal,125,0,2,103,10,7,16,7,14,0,96,3,Hutz,Rock,150,0,2,17,48,7,6,7,2,0,64,0,Joel,Engi,88,30,14,0,0,10,0,10,0,65,52,2,,,,,,,,,,,,,,,
99,8,HOSTILE,The Last Stand,121%,33,1673,6,4985,"Federation Fleet","Tully responds, It's settled. The Rebels will be here in a matter of moments. We will do what we can to hold off their warships but you must succeed in destroying this flagship. Your current outpost can provide some repairs and fuel, and the other repair stations can provide aid as well. Good luck.","",7,30,12,6,41,5,94,23,8,8,0,4,4,0,2,1,0,8,8,0,LASER BURST 5,ION 4,LASER HEAVY 1,,3,0,0,DEFENSE 1,COMBAT 1,2,1,0,1,0,0,1,1,0,0,0,0,0,0,0,0,0,0,0,0,0,3,0,1,0,2,0,1,0,"AUTO COOLDOWN, AUTO COOLDOWN, SHIELD RECHARGE","",GM Faux,Crystal,125,26,30,9,0,6,11,6,7,52,97,4,Nikola,Crystal,125,0,0,0,68,15,16,15,20,0,97,3,Stelly,Crystal,125,0,2,103,10,7,16,7,14,0,97,3,Hutz,Rock,150,0,2,17,48,8,6,8,2,0,65,0,Joel,Engi,100,30,14,0,0,11,0,11,0,65,53,2,,,,,,,,,,,,,,,
100,8,HOSTILE,The Last Stand,121%,33,1710,6,5055,"","A trade station was abandoned nearby. Some Federation engineers repurposed their shipyard to perform military repairs. They offer to help fix your ship.","",44,30,16,11,45,5,94,23,8,8,0,4,4,0,2,1,0,8,8,0,LASER BURST 5,ION 4,LASER HEAVY 1,,3,0,0,DEFENSE 1,COMBAT 1,2,1,0,1,0,0,1,1,0,0,0,0,0,0,0,0,0,0,0,0,0,3,0,1,0,2,0,1,0,"AUTO COOLDOWN, AUTO COOLDOWN, SHIELD RECHARGE","",GM Faux,Crystal,125,26,30,9,0,6,11,6,7,52,98,4,Nikola,Crystal,125,0,0,0,68,15,16,15,20,0,98,3,Stelly,Crystal,125,0,2,103,10,7,16,7,14,0,98,3,Hutz,Rock,150,0,2,17,48,8,6,8,2,0,66,0,Joel,Engi,100,30,14,0,0,11,0,11,0,65,54,2,,,,,,,,,,,,,,,
101,8,HOSTILE,The Last Stand,121%,34,1792,6,5223,"","With the crew dead, you are able to take the fuel out of storage. You also take all the scrap you can manage.","",126,29,19,10,45,5,64,23,8,8,0,4,2,0,2,1,0,8,8,0,LASER BURST 5,ION 4,LASER HEAVY 1,,3,2,0,DEFENSE 1,COMBAT 1,2,0,0,1,1,0,1,1,0,0,0,0,0,0,0,0,0,0,0,0,0,3,0,1,0,2,0,1,0,"AUTO COOLDOWN, AUTO COOLDOWN, SHIELD RECHARGE","",Joel,Engi,51,30,14,0,0,12,0,12,0,66,55,2,GM Faux,Crystal,125,26,30,9,0,6,12,6,7,52,99,4,Nikola,Crystal,71,0,0,0,68,15,16,15,22,0,99,3,Stelly,Crystal,66,0,2,103,10,7,16,7,15,0,99,3,Hutz,Rock,79,0,2,17,48,8,9,8,4,0,67,1,,,,,,,,,,,,,,,REBEL_SKINNY_DLC,13,16,0,9,1,100,24,8,8,0,4,4,0,2,2,0,8,0,5,LASER HEAVY 2,MISSILES BREACH,LASER HEAVY 1,LASER BURST 1,0,0,0,,,,0,0,0,1,1,0,0,0,0,0,0,0,1,0,1,0,0,0,0,0,0,3,0,0,0,0,0,0,0,"",Liu Jun,Human,0,0,0,,,,,,,,,,,,,,,,false,3,false,2,1,3
102,8,HOSTILE,The Last Stand,121%,34,1792,6,5238,"","You arrive near the Federation Base to find the bulk of their fleet skirmishing with Rebel forces. You hang back near the far side of the moon to avoid the conflict. There's not much you can do to help in that battle, and your mission holds the key to turn the tide of the war. You prepare to face the Flagship.","",16,29,18,10,45,5,78,25,8,8,0,5,3,0,2,1,0,8,8,0,LASER BURST 5,ION 4,LASER HEAVY 1,,3,0,0,DEFENSE 1,COMBAT 1,2,1,0,1,1,0,1,1,0,0,0,0,0,0,0,0,0,0,0,0,0,3,0,1,0,2,0,1,0,"AUTO COOLDOWN, AUTO COOLDOWN, SHIELD RECHARGE","",GM Faux,Crystal,125,26,30,9,0,6,12,6,7,52,100,4,Nikola,Crystal,125,0,0,0,68,15,16,15,22,0,100,3,Stelly,Crystal,125,0,2,103,10,7,16,7,15,0,100,3,Hutz,Rock,150,0,2,17,48,8,9,8,4,0,68,1,Joel,Engi,100,30,14,0,0,12,0,12,0,66,56,2,,,,,,,,,,,,,,,
103,8,HOSTILE,The Last Stand,121%,34,1792,6,5253,"","A ship engineer has set up a small shop here.","Augment: AUTO COOLDOWN, BACKUP DNA, LIFE SCANNER, Crew: Human, Rock, Human, System: clonebay, mind, hacking, Drone: DEFENSE 2, DEFENSE 1, ANTI DRONE, ",19,30,17,10,45,5,78,25,8,8,0,5,3,0,2,1,0,8,8,0,LASER BURST 5,ION 4,LASER HEAVY 1,,3,0,0,DEFENSE 1,,2,1,0,1,1,0,1,1,0,0,0,0,0,0,0,0,0,0,0,0,0,3,0,1,0,2,0,1,0,"AUTO COOLDOWN, AUTO COOLDOWN, AUTO COOLDOWN","",GM Faux,Crystal,125,26,30,9,0,6,12,6,7,52,101,4,Nikola,Crystal,125,0,0,0,68,15,16,15,22,0,101,3,Stelly,Crystal,125,0,2,103,10,7,16,7,15,0,101,3,Hutz,Rock,150,0,2,17,48,8,9,8,4,0,69,1,Joel,Engi,100,30,14,0,0,12,0,12,0,66,57,2,,,,,,,,,,,,,,,
104,8,HOSTILE,The Last Stand,121%,34,1792,6,5268,"","","",19,30,16,10,45,5,78,25,8,8,0,5,3,0,2,1,0,8,8,0,LASER BURST 5,ION 4,LASER HEAVY 1,,3,0,0,DEFENSE 1,,2,1,0,1,1,0,1,1,0,0,0,0,0,0,0,0,0,0,0,0,0,3,0,1,0,2,0,1,0,"AUTO COOLDOWN, AUTO COOLDOWN, AUTO COOLDOWN","",GM Faux,Crystal,125,26,30,9,0,6,12,6,7,52,102,4,Nikola,Crystal,125,0,0,0,68,15,16,15,22,0,102,3,Stelly,Crystal,125,0,2,103,10,7,16,7,15,0,102,3,Hutz,Rock,150,0,2,17,48,8,9,8,4,0,70,1,Joel,Engi,100,30,14,0,0,12,0,12,0,66,58,2,,,,,,,,,,,,,,,
105,8,HOSTILE,The Last Stand,121%,34,1792,6,5283,"","","",19,30,16,10,45,5,86,25,8,8,0,5,3,0,2,1,0,8,8,0,LASER BURST 5,ION 4,LASER HEAVY 1,,3,0,0,DEFENSE 1,,2,1,0,1,1,0,1,1,0,0,0,0,0,0,0,0,0,0,0,0,0,3,0,1,0,2,0,1,0,"AUTO COOLDOWN, AUTO COOLDOWN, AUTO COOLDOWN","",GM Faux,Crystal,125,26,30,9,0,6,12,6,7,52,102,4,Nikola,Crystal,125,0,0,0,68,15,16,15,22,0,102,3,Stelly,Crystal,125,0,2,103,10,7,16,7,15,0,102,3,Hutz,Rock,150,0,2,17,48,8,9,8,4,0,70,1,Joel,Engi,100,30,14,0,0,12,0,12,0,66,58,2,,,,,,,,,,,,,,,
106,8,HOSTILE,The Last Stand,121%,34,1792,6,5298,"","","",19,30,16,10,45,5,86,25,8,8,0,5,3,0,2,1,0,8,8,0,LASER BURST 5,ION 4,LASER HEAVY 1,,3,0,0,DEFENSE 1,,2,1,0,1,1,0,1,1,0,0,0,0,0,0,0,0,0,0,0,0,0,3,0,1,0,2,0,1,0,"AUTO COOLDOWN, AUTO COOLDOWN, AUTO COOLDOWN","",GM Faux,Crystal,125,26,30,9,0,6,12,6,7,52,102,4,Nikola,Crystal,125,0,0,0,68,15,16,15,22,0,102,3,Stelly,Crystal,125,0,2,103,10,7,16,7,15,0,102,3,Hutz,Rock,150,0,2,17,48,8,9,8,4,0,70,1,Joel,Engi,100,30,14,0,0,12,0,12,0,66,58,2,,,,,,,,,,,,,,,
107,8,HOSTILE,The Last Stand,121%,34,1812,6,5343,"","","",9,28,17,10,45,5,100,25,8,8,0,5,4,0,2,1,0,8,8,0,LASER BURST 5,ION 4,LASER HEAVY 1,,3,2,0,DEFENSE 1,,2,0,0,1,1,0,2,1,0,0,0,0,0,0,0,0,0,0,0,0,0,3,0,1,0,2,0,1,0,"AUTO COOLDOWN, AUTO COOLDOWN, AUTO COOLDOWN","",GM Faux,Crystal,125,26,30,9,0,7,12,7,7,52,102,4,Nikola,Crystal,125,0,0,0,98,15,16,15,22,0,102,3,Stelly,Crystal,125,0,2,105,10,7,16,7,15,0,102,3,Hutz,Rock,150,0,2,17,48,11,9,11,4,0,70,1,Joel,Engi,100,30,14,0,0,12,0,12,0,70,58,2,,,,,,,,,,,,,,,
108,8,HOSTILE,The Last Stand,121%,34,1812,6,5358,"","","",9,28,17,10,45,5,100,25,8,8,0,5,4,0,2,1,0,8,8,0,LASER BURST 5,ION 4,LASER HEAVY 1,,3,2,0,DEFENSE 1,,2,0,0,1,1,0,2,1,0,0,0,0,0,0,0,0,0,0,0,0,0,3,0,1,0,2,0,1,0,"AUTO COOLDOWN, AUTO COOLDOWN, AUTO COOLDOWN","",GM Faux,Crystal,125,26,30,9,0,7,12,7,7,52,102,4,Nikola,Crystal,125,0,0,0,98,15,16,15,22,0,102,3,Stelly,Crystal,125,0,2,105,10,7,16,7,15,0,102,3,Hutz,Rock,150,0,2,17,48,11,9,11,4,0,70,1,Joel,Engi,100,30,14,0,0,12,0,12,0,70,58,2,,,,,,,,,,,,,,,
