65,5,CIVILIAN,Engi Homeworlds,64%,26,962,8,3198,"","The ship explodes, leaving behind a substantial collection of useful scrap material.","",70,20,11,11,38,7,83,10,6,0,0,3,1,0,1,1,0,8,8,0,LASER BURST 5,LASER BURST 5,,,3,0,0,ANTI DRONE,DEFENSE 1,0,0,0,0,0,0,0,0,0,0,0,0,1,0,0,0,0,0,0,0,0,1,0,1,0,1,0,2,0,"ENERGY SHIELD, SHIELD RECHARGE, SHIELD RECHARGE","",Giles,Zoltan,70,0,0,0,0,0,0,3,2,12,64,0,Emily,Zoltan,70,0,27,0,0,0,0,3,1,0,64,2,Valeriya,Zoltan,32,0,0,0,78,4,1,5,2,0,64,1,Kirby,Zoltan,67,0,0,56,0,2,1,2,1,0,64,1,Alison,Rock,77,30,0,0,0,1,0,1,1,77,51,2,Grozoly,Mantis,100,0,6,0,65,1,0,1,0,0,11,0,Virus,Engi,100,30,30,110,130,36,16,1,0,0,4,0,,,,,,,,,,,,,,,,,,,,,,,,,,,,,,,,,,,,,,,,,,,
66,5,CIVILIAN,Engi Homeworlds,74%,26,962,8,3213,"","You try to communicate in every possible way you can but they just stand there, silently judging you with their large, expressionless eyes. You prepare to leave.","",20,20,10,11,38,7,83,12,6,2,0,3,1,0,1,1,0,8,8,0,LASER BURST 5,LASER BURST 5,,,3,0,0,ANTI DRONE,DEFENSE 1,0,0,0,0,0,0,0,0,0,0,0,0,1,0,0,0,0,0,0,0,0,1,0,1,0,1,0,2,0,"ENERGY SHIELD, SHIELD RECHARGE, SHIELD RECHARGE","",Giles,Zoltan,70,0,0,0,0,0,0,3,2,12,65,0,Emily,Zoltan,70,0,27,0,0,0,0,3,1,0,65,2,Valeriya,Zoltan,40,0,0,0,78,4,1,5,2,0,65,1,Kirby,Zoltan,70,0,0,56,0,2,1,2,1,0,65,1,Alison,Rock,85,30,0,0,0,1,0,1,1,77,52,2,Grozoly,Mantis,100,0,6,0,65,1,0,1,0,0,12,0,Virus,Engi,100,30,30,110,130,36,16,1,0,0,5,0,,,,,,,,,,,,,,,,,,,,,,,,,,,,,,,,,,,,,,,,,,,
67,6,HOSTILE,Abandoned Sector,0%,26,962,8,3228,"","This sector was the site of many major battles between the Federation and Rebel fleets. Strangely, there's very little evidence of those battles remaining...","",20,20,9,11,38,7,83,12,6,2,0,3,1,0,1,1,0,8,8,0,LASER BURST 5,LASER BURST 5,,,3,0,0,ANTI DRONE,DEFENSE 1,0,0,0,0,0,0,0,0,0,0,0,0,1,0,0,0,0,0,0,0,0,1,0,1,0,1,0,2,0,"ENERGY SHIELD, SHIELD RECHARGE, SHIELD RECHARGE","",Giles,Zoltan,70,0,0,0,0,0,0,3,2,12,66,0,Emily,Zoltan,70,0,27,0,0,0,0,3,1,0,66,2,Valeriya,Zoltan,48,0,0,0,78,4,1,5,2,0,66,1,Kirby,Zoltan,70,0,0,56,0,2,1,2,1,0,66,1,Alison,Rock,93,30,0,0,0,1,0,1,1,77,53,2,Grozoly,Mantis,100,0,6,0,65,1,0,1,0,0,13,0,Virus,Engi,100,30,30,110,130,36,16,1,0,0,6,0,,,,,,,,,,,,,,,,,,,,,,,,,,,,,,,,,,,,,,,,,,,
68,6,HOSTILE,Abandoned Sector,0%,27,1049,8,3404,"","The Mantis hiss and click, angry at being saved, and angry at themselves for needing to be saved. They part ways with some scrap metal that is no longer attached to their hull and a few missiles they can no longer use.","",107,16,11,10,44,7,88,12,6,2,0,3,3,0,1,1,0,8,4,0,LASER BURST 5,LASER BURST 5,,,3,2,0,ANTI DRONE,DEFENSE 1,0,0,0,0,0,0,0,0,0,0,0,0,1,0,0,0,0,0,0,0,0,1,0,1,0,1,0,2,0,"ENERGY SHIELD, SHIELD RECHARGE, SHIELD RECHARGE","",Giles,Zoltan,70,0,0,0,0,0,0,3,2,12,67,0,Emily,Zoltan,70,0,27,0,0,0,0,3,1,0,67,2,Valeriya,Zoltan,56,0,0,0,78,4,1,5,2,0,67,1,Kirby,Zoltan,70,0,0,61,0,2,1,2,1,0,67,1,Alison,Rock,101,30,0,0,0,1,0,1,1,78,54,2,Grozoly,Mantis,100,0,9,0,65,1,0,1,0,0,14,0,Virus,Engi,55,30,30,110,130,36,16,4,0,0,7,0,,,,,,,,,,,,,,,,,,,,,,,,,,,,,,,,,,,,,,,,,,,
69,6,HOSTILE,Abandoned Sector,0%,27,1049,8,3419,"","When you get to the beacon you quickly try to locate the source of the distress call. As you are looking, the signal blinks out. It is then that you notice the small fleet of scavenger ships absorbing debris from a large battle nearby. You can't help but wonder where the distress signal came from, but you decide not to risk pressuring the fleet.","",22,16,10,10,44,7,89,14,6,2,0,3,3,0,1,1,0,8,4,0,LASER BURST 5,LASER BURST 5,,,3,0,0,ANTI DRONE,DEFENSE 1,0,0,0,0,0,0,0,0,0,0,0,0,2,0,0,0,0,0,0,0,0,1,0,1,0,1,0,2,0,"ENERGY SHIELD, SHIELD RECHARGE, SHIELD RECHARGE","",Giles,Zoltan,70,0,0,0,0,0,0,3,2,12,68,0,Emily,Zoltan,70,0,27,0,0,0,0,3,1,0,68,2,Valeriya,Zoltan,70,0,0,0,78,4,1,5,2,0,68,1,Kirby,Zoltan,70,0,0,61,0,2,1,2,1,0,68,1,Alison,Rock,117,30,0,0,0,1,0,1,1,78,55,2,Grozoly,Mantis,100,0,9,0,65,1,0,1,0,0,15,0,Virus,Engi,71,30,30,110,130,36,16,4,0,0,8,0,,,,,,,,,,,,,,,,,,,,,,,,,,,,,,,,,,,,,,,,,,,
70,6,HOSTILE,Abandoned Sector,0%,27,1049,8,3434,"","An image of some weak and hungry humans comes onto your screen. Those metal bastards think they can just absorb half of our engines and leave us here to die? I hope you understand the need to take your ship by force. They must have a Super Shield bypass unit; boarders are on board!","",22,16,9,10,44,7,89,14,6,2,0,3,3,0,1,1,0,8,8,0,LASER BURST 5,LASER BURST 5,,,3,0,0,ANTI DRONE,DEFENSE 1,0,0,0,0,0,0,0,0,0,0,0,0,2,0,0,0,0,0,0,0,0,1,0,1,0,1,0,2,0,"ENERGY SHIELD, SHIELD RECHARGE, SHIELD RECHARGE","",Giles,Zoltan,70,0,0,0,0,0,0,3,2,12,69,0,Emily,Zoltan,70,0,27,0,0,0,0,3,1,0,69,2,Valeriya,Zoltan,70,0,0,0,78,4,1,5,2,0,69,1,Kirby,Zoltan,70,0,0,61,0,2,1,2,1,0,69,1,Alison,Rock,133,30,0,0,0,1,0,1,1,78,56,2,Grozoly,Mantis,100,0,9,0,65,1,0,1,0,0,16,0,Virus,Engi,87,30,30,110,130,36,16,4,0,0,9,0,,,,,,,,,,,,,,,,,,,,,,,,,,,,,,,,,,,,,,,,,,,
71,6,HOSTILE,Abandoned Sector,2%,27,1085,8,3503,"","You try your best to convey the notion that the approaching Rebel fleet has countless automated ships scouting for them. They thank you for the tip and prepare to jump in the direction you came. That will hopefully delay the fleet. You scrap what remains of the Rebel station.","",58,16,8,11,46,7,38,14,6,2,0,3,3,0,1,1,0,8,4,0,LASER BURST 5,LASER BURST 5,,,3,0,0,ANTI DRONE,DEFENSE 1,0,0,0,0,0,0,0,0,0,0,0,0,2,1,0,0,0,0,0,0,0,1,0,1,0,1,0,2,0,"ENERGY SHIELD, SHIELD RECHARGE, SHIELD RECHARGE","",Giles,Zoltan,70,0,0,0,0,0,0,3,2,12,70,0,Emily,Zoltan,70,0,27,0,0,0,0,3,1,0,70,2,Valeriya,Zoltan,19,0,0,0,78,4,1,5,2,0,70,1,Kirby,Zoltan,70,0,0,61,0,2,1,2,1,0,70,1,Alison,Rock,54,30,0,0,0,1,0,1,1,78,57,2,Grozoly,Mantis,46,0,9,0,65,1,2,1,2,0,17,0,Virus,Engi,22,30,30,110,130,36,16,4,2,0,10,0,,,,,,,,,,,,,,,,,,,,,,,,,,,,,,,,,,,,,,,,,,,
72,6,HOSTILE,Abandoned Sector,2%,28,1149,8,3644,"","The ship explodes, revealing their cargo of unprocessed metal. You collect a significant amount of scrap.","",122,15,10,9,48,7,82,14,6,2,0,3,1,0,1,0,0,8,8,0,LASER BURST 5,LASER BURST 5,,,3,1,0,ANTI DRONE,DEFENSE 1,0,0,0,0,0,0,0,0,0,0,0,0,2,1,0,0,0,0,0,0,0,1,0,1,0,1,0,2,0,"ENERGY SHIELD, SHIELD RECHARGE, SHIELD RECHARGE","",Giles,Zoltan,21,0,0,0,0,0,0,3,2,12,71,0,Emily,Zoltan,70,0,27,0,0,0,0,3,1,0,71,2,Valeriya,Zoltan,70,0,0,0,52,0,0,5,2,0,71,1,Kirby,Zoltan,27,0,0,63,0,2,1,2,1,0,71,1,Alison,Rock,60,30,0,0,0,1,0,1,1,80,58,2,Grozoly,Mantis,0,0,10,0,65,1,2,1,2,0,18,0,Virus,Engi,31,30,30,110,130,36,16,5,2,0,11,0,,,,,,,,,,,,,,,,,,,,,,,,,,,,,,,,,,,,,,,,,,,
73,6,HOSTILE,Abandoned Sector,12%,28,1149,8,3659,"","You thank them for the information and prepare to jump.","",77,15,9,9,48,7,89,14,6,2,0,3,1,0,1,1,0,8,8,0,LASER BURST 5,LASER BURST 5,,,3,0,0,ANTI DRONE,DEFENSE 1,0,0,0,0,0,0,0,0,0,0,0,0,3,2,0,0,0,0,0,0,0,1,0,1,0,1,0,2,0,"ENERGY SHIELD, SHIELD RECHARGE, SHIELD RECHARGE","",Giles,Zoltan,46,0,0,0,0,0,0,3,2,12,72,0,Emily,Zoltan,70,0,27,0,0,0,0,3,1,0,72,2,Valeriya,Zoltan,70,0,0,0,52,0,0,5,2,0,72,1,Kirby,Zoltan,52,0,0,63,0,2,1,2,1,0,72,1,Alison,Rock,85,30,0,0,0,1,0,1,1,80,59,2,Grozoly,Mantis,100,0,7,0,52,0,1,1,2,0,19,0,Virus,Engi,56,30,30,110,130,36,16,5,2,0,12,0,,,,,,,,,,,,,,,,,,,,,,,,,,,,,,,,,,,,,,,,,,,
74,6,HOSTILE,Abandoned Sector,22%,28,1149,8,3674,"","You arrive at an empty space station, no doubt abandoned due to the Lanius threat. Life signatures are detected at the ship depot and you spot a few crude signs stating Everything Must Go!","System: medbay, teleporter, cloaking, Crew: Lanius, Lanius, Lanius, Drone: COMBAT 1, DEFENSE 2, DRONE SHIELD, Augment: ION ARMOR, AUTO COOLDOWN, BACKUP DNA, ",50,20,12,9,48,7,89,14,6,2,0,3,1,0,1,1,0,8,8,0,LASER BURST 5,LASER BURST 5,,,3,0,0,ANTI DRONE,DEFENSE 1,0,0,0,0,0,0,0,0,0,0,0,0,3,2,0,0,0,0,0,0,0,1,0,1,0,1,0,2,0,"ENERGY SHIELD, SHIELD RECHARGE, SHIELD RECHARGE","",Giles,Zoltan,70,0,0,0,0,0,0,3,2,12,73,0,Emily,Zoltan,70,0,27,0,0,0,0,3,1,0,73,2,Valeriya,Zoltan,70,0,0,0,52,0,0,5,2,0,73,1,Kirby,Zoltan,70,0,0,63,0,2,1,2,1,0,73,1,Alison,Rock,110,30,0,0,0,1,0,1,1,80,60,2,Grozoly,Mantis,100,0,7,0,52,0,1,1,2,0,20,0,Virus,Engi,81,30,30,110,130,36,16,5,2,0,13,0,,,,,,,,,,,,,,,,,,,,,,,,,,,,,,,,,,,,,,,,,,,
75,6,HOSTILE,Abandoned Sector,32%,28,1149,8,3689,"","You question a local settlement and they describe a fleet of metal ships wordlessly collecting all of the abandoned metal and debris in the area. When they approached important satellites, the settlements fired a few ASB warning shots. The Lanius moved on despite clearly having the firepower to overwhelm the settlements.","",50,20,11,9,48,7,89,14,6,2,0,3,1,0,1,1,0,8,8,0,LASER BURST 5,LASER BURST 5,,,3,0,0,ANTI DRONE,DEFENSE 1,0,0,0,0,0,0,0,0,0,0,0,0,3,2,0,0,0,0,0,0,0,1,0,1,0,1,0,2,0,"ENERGY SHIELD, SHIELD RECHARGE, SHIELD RECHARGE","",Giles,Zoltan,70,0,0,0,0,0,0,3,2,12,74,0,Emily,Zoltan,70,0,27,0,0,0,0,3,1,0,74,2,Valeriya,Zoltan,70,0,0,0,52,0,0,5,2,0,74,1,Kirby,Zoltan,70,0,0,63,0,2,1,2,1,0,74,1,Alison,Rock,135,30,0,0,0,1,0,1,1,80,61,2,Grozoly,Mantis,100,0,7,0,52,0,1,1,2,0,21,0,Virus,Engi,100,30,30,110,130,36,16,5,2,0,14,0,,,,,,,,,,,,,,,,,,,,,,,,,,,,,,,,,,,,,,,,,,,
76,6,HOSTILE,Abandoned Sector,41%,29,1192,8,3798,"","The ship explodes, leaving behind a substantial collection of useful scrap material.","",93,20,10,9,50,7,87,14,6,2,0,3,1,0,1,1,0,8,8,0,LASER BURST 5,LASER BURST 5,BOMB 1,,3,0,0,ANTI DRONE,DEFENSE 1,0,0,0,0,0,0,0,0,0,0,0,0,3,2,0,0,0,0,0,0,0,1,0,1,0,1,0,2,0,"ENERGY SHIELD, SHIELD RECHARGE, SHIELD RECHARGE","",Giles,Zoltan,29,0,0,0,0,0,0,3,2,12,75,0,Emily,Zoltan,28,0,27,0,0,0,1,3,2,0,75,2,Valeriya,Zoltan,70,0,0,0,52,0,0,5,2,0,75,1,Kirby,Zoltan,70,0,0,65,0,2,2,2,2,0,75,1,Alison,Rock,150,30,0,0,0,1,0,1,1,80,62,2,Grozoly,Mantis,100,0,7,0,52,0,1,1,2,0,22,0,Virus,Engi,100,30,30,110,130,36,16,5,2,0,15,0,,,,,,,,,,,,,,,,,,,,,,,,,,,,,,,,,,,,,,,,,,,
77,6,HOSTILE,Abandoned Sector,51%,29,1192,8,3813,"","The charts indicate this was the location of a small skirmish over a military facility on a nearby moon. Oddly, scans pick up no signs of debris from either the battle or the station. Yet another area sucked dry by the Lanius.","",93,20,9,9,50,7,87,14,6,2,0,3,1,0,1,1,0,8,8,0,LASER BURST 5,LASER BURST 5,BOMB 1,,3,0,0,ANTI DRONE,DEFENSE 1,0,0,0,0,0,0,0,0,0,0,0,0,3,2,0,0,0,0,0,0,0,1,0,1,0,1,0,2,0,"ENERGY SHIELD, SHIELD RECHARGE, SHIELD RECHARGE","",Giles,Zoltan,54,0,0,0,0,0,0,3,2,12,76,0,Emily,Zoltan,53,0,27,0,0,0,1,3,2,0,76,2,Valeriya,Zoltan,70,0,0,0,52,0,0,5,2,0,76,1,Kirby,Zoltan,70,0,0,65,0,2,2,2,2,0,76,1,Alison,Rock,150,30,0,0,0,1,0,1,1,80,63,2,Grozoly,Mantis,100,0,7,0,52,0,1,1,2,0,23,0,Virus,Engi,100,30,30,110,130,36,16,5,2,0,16,0,,,,,,,,,,,,,,,,,,,,,,,,,,,,,,,,,,,,,,,,,,,
78,6,HOSTILE,Abandoned Sector,61%,30,1244,8,3936,"Asteroid Field","The ship explodes, leaving behind a collection of useful scrap material.","",145,15,9,8,51,7,72,14,6,2,0,3,0,1,1,1,0,8,8,0,LASER BURST 5,LASER BURST 5,BOMB 1,,3,0,0,ANTI DRONE,DEFENSE 1,0,0,0,0,0,0,0,0,0,0,0,0,3,1,1,0,0,0,0,0,0,1,0,1,0,1,0,2,1,"ENERGY SHIELD, SHIELD RECHARGE, SHIELD RECHARGE","",Giles,Zoltan,70,0,0,7,0,0,0,3,2,12,77,0,Emily,Zoltan,65,0,27,0,0,0,1,3,2,0,77,2,Valeriya,Zoltan,70,0,0,0,52,0,0,5,2,0,77,1,Kirby,Zoltan,70,0,0,72,2,2,2,2,2,0,77,1,Alison,Rock,0,30,0,0,0,1,0,1,1,82,64,2,Grozoly,Mantis,100,0,6,0,39,0,0,1,2,0,24,0,Virus,Engi,32,30,30,110,130,36,16,6,2,0,17,0,,,,,,,,,,,,,,,,,,,,,,,,,,,,,,,,,,,,,,,,,,,
79,6,HOSTILE,Abandoned Sector,71%,30,1244,8,3951,"","You receive a message from a nearby station, The end is upon us! The metal demons have come to absorb your very being! But it's not too late to prepare for the worst! It appears that was an advertisement for a space dock. You scan their products.","System: teleporter, cloaking, mind, Weapon: LASER BURST 5, BEAM LONG, BEAM FIRE, ",17,15,8,8,51,7,94,14,6,2,0,3,1,0,1,1,0,8,8,0,LASER BURST 5,LASER BURST 5,,,3,0,0,ANTI DRONE,DEFENSE 1,0,0,0,0,0,0,1,0,0,0,0,0,3,2,0,0,0,0,0,0,0,1,0,1,0,1,0,2,0,"ENERGY SHIELD, SHIELD RECHARGE, SHIELD RECHARGE","",Giles,Zoltan,70,0,0,7,0,1,0,4,2,12,78,0,Emily,Zoltan,70,0,27,0,0,1,1,4,2,0,78,2,Valeriya,Zoltan,70,0,0,0,52,0,0,5,2,0,78,1,Kirby,Zoltan,70,0,0,72,2,2,2,2,2,0,78,1,Alison,Rock,150,27,0,0,0,1,0,2,1,82,65,2,Grozoly,Mantis,100,0,6,0,39,0,0,1,2,0,25,0,Virus,Engi,57,30,30,110,130,36,16,6,2,0,18,0,,,,,,,,,,,,,,,,,,,,,,,,,,,,,,,,,,,,,,,,,,,
80,6,HOSTILE,Abandoned Sector,81%,30,1308,8,4062,"","You stumble across a badly damaged Lanius craft. It jumps away as soon as it sees you. Looking around the area, you discover a number of destroyed Rebel automated ships. It must have been quite the fight. You scrap what remains.","",81,15,7,9,52,7,94,14,6,2,0,3,1,0,1,1,0,8,8,0,LASER BURST 5,LASER BURST 5,,,3,0,0,ANTI DRONE,DEFENSE 1,0,0,0,0,0,0,1,0,0,0,0,0,3,2,0,0,0,0,0,0,0,1,0,1,0,1,0,2,0,"ENERGY SHIELD, SHIELD RECHARGE, SHIELD RECHARGE","",Giles,Zoltan,70,0,0,7,0,1,0,4,2,12,79,0,Emily,Zoltan,70,0,27,0,0,1,1,4,2,0,79,2,Valeriya,Zoltan,70,0,0,0,52,0,0,5,2,0,79,1,Kirby,Zoltan,70,0,0,72,2,2,2,2,2,0,79,1,Alison,Rock,150,27,0,0,0,1,0,2,1,82,66,2,Grozoly,Mantis,100,0,6,0,39,0,0,1,2,0,26,0,Virus,Engi,82,30,30,110,130,36,16,6,2,0,19,0,,,,,,,,,,,,,,,,,,,,,,,,,,,,,,,,,,,,,,,,,,,
81,6,HOSTILE,Abandoned Sector,91%,30,1332,9,4113,"","None of your attempts to communicate seem to work: they just stare at you silently. As you prepare to leave, one of the creatures canters forward and forcefully nudges you away from the ship. He seems to want you to follow him. Eventually, they guide you to an old Engi ship's crash site. Inside you are able to find and reactivate an Engi!","",105,15,9,10,52,8,94,14,6,2,0,3,1,0,1,1,0,8,8,0,LASER BURST 5,LASER BURST 5,LASER BURST 2 A,,3,0,0,ANTI DRONE,DEFENSE 1,0,0,0,0,0,0,1,0,0,0,0,0,3,2,0,0,0,0,0,0,0,1,0,1,0,1,0,2,0,"ENERGY SHIELD, SHIELD RECHARGE, SHIELD RECHARGE","",Giles,Zoltan,70,0,0,7,0,1,0,4,2,12,80,0,Emily,Zoltan,70,0,27,0,0,1,1,4,2,0,80,2,Valeriya,Zoltan,70,0,0,0,52,0,0,5,2,0,80,1,Kirby,Zoltan,70,0,0,72,2,2,2,2,2,0,80,1,Alison,Rock,150,27,0,0,0,1,0,2,1,82,67,2,Grozoly,Mantis,100,0,6,0,39,0,0,1,2,0,27,0,Virus,Engi,100,30,30,110,130,36,16,6,2,0,20,0,Ferry,Engi,100,0,0,55,0,0,8,0,0,0,0,0,,,,,,,,,,,,,,,,,,,,,,,,,,,,,
82,7,HOSTILE,Mantis Controlled Sector,0%,30,1332,9,4128,"","You've entered a poorly charted area of space that's known to be home to the Mantis. Ensure your hull plating is up to scratch and that you have enough fuel in the tank to make it through.","",20,15,8,10,52,8,96,17,6,2,0,3,3,0,1,1,0,8,8,0,LASER BURST 5,LASER BURST 5,LASER BURST 2 A,,3,0,0,ANTI DRONE,DEFENSE 1,0,0,0,0,0,0,1,1,0,0,0,0,3,2,0,0,0,0,0,0,0,1,0,1,0,1,0,2,0,"ENERGY SHIELD, SHIELD RECHARGE, SHIELD RECHARGE","",Giles,Zoltan,70,0,0,7,0,1,0,4,2,12,81,0,Emily,Zoltan,70,0,27,0,0,1,1,4,2,0,81,2,Valeriya,Zoltan,70,0,0,0,52,0,0,5,2,0,81,1,Kirby,Zoltan,70,0,0,72,2,2,2,2,2,0,81,1,Alison,Rock,150,27,0,0,0,1,0,2,1,82,68,2,Grozoly,Mantis,100,0,6,0,39,0,0,1,2,0,28,0,Virus,Engi,100,30,30,110,130,36,16,6,2,0,21,0,Ferry,Engi,100,0,0,55,0,0,8,0,0,0,1,0,,,,,,,,,,,,,,,,,,,,,,,,,,,,,
83,7,HOSTILE,Mantis Controlled Sector,0%,31,1379,9,4244,"","The ship explodes, leaving behind a substantial collection of useful scrap material.","",67,14,7,11,54,8,100,17,6,2,0,3,3,0,1,1,0,8,8,0,LASER BURST 5,LASER BURST 5,LASER BURST 2 A,,3,0,1,ANTI DRONE,DEFENSE 1,0,0,0,0,0,0,1,1,0,0,0,0,3,1,0,0,0,0,0,0,0,1,0,1,0,1,0,2,0,"ENERGY SHIELD, SHIELD RECHARGE, SHIELD RECHARGE","",Giles,Zoltan,70,0,0,7,0,1,0,4,2,12,82,0,Emily,Zoltan,11,0,27,0,0,4,1,7,2,0,82,2,Valeriya,Zoltan,16,0,0,0,52,0,0,5,2,0,82,1,Kirby,Zoltan,70,0,0,81,2,2,2,2,2,0,82,1,Alison,Rock,150,29,0,0,0,1,0,2,1,86,69,2,Grozoly,Mantis,24,0,7,0,39,0,0,1,2,0,29,0,Virus,Engi,100,30,30,110,130,36,16,6,2,0,22,0,Ferry,Engi,8,0,0,55,0,3,8,3,0,0,2,0,,,,,,,,,,,,,,,,,,,,,,,,,,,,,
84,7,HOSTILE,Mantis Controlled Sector,0%,31,1379,9,4259,"","There aren't so many parts of Mantis space that aren't dotted by the wrecks of battles past, but this is one of them. You take a deep breath and prepare to move on.","",37,14,6,11,54,8,100,17,6,2,0,4,4,0,1,1,0,8,8,0,LASER BURST 5,LASER BURST 5,LASER BURST 2 A,,3,0,0,ANTI DRONE,DEFENSE 1,0,0,0,0,0,0,1,1,0,0,0,0,3,1,0,0,0,0,0,0,0,1,0,1,0,1,0,2,0,"ENERGY SHIELD, SHIELD RECHARGE, SHIELD RECHARGE","",Giles,Zoltan,70,0,0,7,0,1,0,4,2,12,83,0,Emily,Zoltan,36,0,27,0,0,4,1,7,2,0,83,2,Valeriya,Zoltan,41,0,0,0,52,0,0,5,2,0,83,1,Kirby,Zoltan,70,0,0,81,2,2,2,2,2,0,83,1,Alison,Rock,150,29,0,0,0,1,0,2,1,86,70,2,Grozoly,Mantis,49,0,7,0,39,0,0,1,2,0,30,0,Virus,Engi,100,30,30,110,130,36,16,6,2,0,23,0,Ferry,Engi,33,0,0,55,0,4,8,4,0,0,3,0,,,,,,,,,,,,,,,,,,,,,,,,,,,,,
85,7,HOSTILE,Mantis Controlled Sector,6%,32,1433,9,4385,"","The ship explodes, leaving behind a substantial collection of useful scrap material.","",91,14,8,11,56,8,100,17,6,2,0,4,4,0,1,1,0,8,8,0,LASER BURST 5,LASER BURST 5,LASER BURST 2 A,,3,0,0,ANTI DRONE,DEFENSE 1,0,0,0,0,0,0,1,1,0,0,0,0,3,1,0,0,0,0,0,0,0,1,0,1,0,1,0,2,0,"ENERGY SHIELD, SHIELD RECHARGE, SHIELD RECHARGE","",Giles,Zoltan,70,0,0,7,0,1,0,4,2,12,84,0,Emily,Zoltan,61,0,27,0,0,4,1,7,2,0,84,2,Valeriya,Zoltan,66,0,0,0,52,0,0,5,2,0,84,1,Kirby,Zoltan,70,0,0,82,2,2,2,2,2,0,84,1,Alison,Rock,150,30,0,0,0,1,0,2,1,89,71,2,Grozoly,Mantis,74,0,9,0,39,0,0,1,2,0,31,0,Virus,Engi,100,30,30,110,130,36,16,6,2,0,24,0,Ferry,Engi,58,0,0,55,0,4,8,4,0,0,4,0,,,,,,,,,,,,,,,,,,,,,,,,,,,,,
86,7,HOSTILE,Mantis Controlled Sector,16%,32,1501,9,4502,"","With most of the fire under control, the scientists are able to help secure the station. They offer you their sincere gratitude and a generous reward.","",159,14,7,11,56,8,100,17,6,2,0,4,4,0,1,1,0,8,8,0,LASER BURST 5,LASER BURST 5,LASER BURST 2 A,,3,0,0,ANTI DRONE,DEFENSE 1,0,0,0,0,0,0,1,1,0,0,0,0,3,1,0,0,0,0,0,0,0,1,0,1,0,1,0,2,0,"ENERGY SHIELD, SHIELD RECHARGE, SHIELD RECHARGE","BATTERY BOOSTER, BATTERY BOOSTER",Giles,Zoltan,70,0,0,7,0,1,0,4,2,12,85,0,Emily,Zoltan,70,0,27,0,0,4,1,7,2,0,85,2,Valeriya,Zoltan,70,0,0,0,52,0,0,5,2,0,85,1,Kirby,Zoltan,70,0,0,82,2,2,2,2,2,0,85,1,Alison,Rock,150,30,0,0,0,1,0,2,1,89,72,2,Grozoly,Mantis,99,0,9,0,39,0,0,1,2,0,32,0,Virus,Engi,100,30,30,110,130,36,16,6,2,0,25,0,Ferry,Engi,83,0,0,55,0,4,8,4,0,0,5,0,,,,,,,,,,,,,,,,,,,,,,,,,,,,,
87,7,HOSTILE,Mantis Controlled Sector,26%,32,1501,9,4517,"","Identifying a Mantis trading post ahead, you signal them so that your approach won't be taken as a threat. The leader hails you: You have scrap? Quickly, come dock before the warriors see you.","Augment: AUTO COOLDOWN, DEFENSE SCRAMBLER, FTL JUMPER, Weapon: LASER HEAVY 1, LASER BURST 2 A, BOMB FIRE, ",184,14,6,11,56,8,100,17,6,2,0,4,4,0,1,1,0,8,8,0,LASER BURST 5,LASER BURST 5,,,3,0,0,ANTI DRONE,DEFENSE 1,0,0,0,0,0,0,1,1,0,0,0,0,3,1,0,0,0,0,0,0,0,1,0,1,0,1,0,2,0,"ENERGY SHIELD, SHIELD RECHARGE, SHIELD RECHARGE","",Giles,Zoltan,70,0,0,7,0,1,0,4,2,12,86,0,Emily,Zoltan,70,0,27,0,0,4,1,7,2,0,86,2,Valeriya,Zoltan,70,0,0,0,52,0,0,5,2,0,86,1,Kirby,Zoltan,70,0,0,82,2,2,2,2,2,0,86,1,Alison,Rock,150,30,0,0,0,1,0,2,1,89,73,2,Grozoly,Mantis,100,0,9,0,39,0,0,1,2,0,33,0,Virus,Engi,100,30,30,110,130,36,16,6,2,0,26,0,Ferry,Engi,100,0,0,55,0,4,8,4,0,0,6,0,,,,,,,,,,,,,,,,,,,,,,,,,,,,,
88,7,HOSTILE,Mantis Controlled Sector,36%,32,1529,9,4574,"","Take this bit of scrap as a down-payment. We'll use your jump signatures to follow you. You're really helping us out here. Added a quest marker to your map!","",64,21,5,11,56,8,100,17,7,2,0,5,5,0,1,1,0,8,8,0,LASER BURST 5,LASER BURST 5,,,3,0,0,ANTI DRONE,DEFENSE 1,0,0,0,0,0,0,1,1,0,0,0,0,3,0,0,0,0,0,0,0,0,1,0,1,0,1,0,2,0,"ENERGY SHIELD, SHIELD RECHARGE, SHIELD RECHARGE","",Giles,Zoltan,70,0,0,7,0,1,0,4,2,12,87,0,Emily,Zoltan,70,0,27,0,0,4,1,7,2,0,87,2,Valeriya,Zoltan,70,0,0,0,52,0,0,5,2,0,87,1,Kirby,Zoltan,70,0,0,82,2,2,2,2,2,0,87,1,Alison,Rock,150,30,0,0,0,1,0,2,1,89,74,2,Grozoly,Mantis,100,0,9,0,39,0,0,1,2,0,34,0,Virus,Engi,100,30,30,110,130,36,16,6,2,0,27,0,Ferry,Engi,100,0,0,55,0,4,8,4,0,0,7,0,,,,,,,,,,,,,,,,,,,,,,,,,,,,,FED_BOMBER,15,16,0,10,5,100,22,6,6,0,4,1,0,1,1,0,8,0,0,MISSILES 3,LASER BURST 2 A,MISSILES 2,ION STUN,0,0,0,2,1,0,0,0,0,0,0,0,0,0,0,0,0,0,0,0,0,0,0,0,3,0,0,0,0,0,0,0,"",Ihlay Caris,Human,100,0,0,Lagardi,Human,100,0,0,Ohm,Human,100,0,0,Tee Lek,Human,100,0,0,Sophia,Human,100,0,0,false,3,false,2,0,5
89,7,HOSTILE,Mantis Controlled Sector,46%,33,1593,9,4715,"","Their ship breaks apart and you move in to scrap the remains.","",128,21,6,10,58,8,100,17,7,2,0,5,5,0,1,1,0,8,8,0,LASER BURST 5,LASER BURST 5,,,3,0,0,ANTI DRONE,DEFENSE 1,0,0,0,0,0,0,1,1,0,0,0,0,3,0,0,0,0,0,0,0,0,1,0,1,0,1,0,2,0,"ENERGY SHIELD, SHIELD RECHARGE, SHIELD RECHARGE","",Giles,Zoltan,3,0,0,7,0,1,0,4,2,12,88,0,Emily,Zoltan,70,0,27,0,0,4,1,7,2,0,88,2,Valeriya,Zoltan,70,0,0,0,52,0,0,5,2,0,88,1,Kirby,Zoltan,14,0,0,82,2,2,2,2,2,0,88,1,Alison,Rock,150,30,0,0,0,1,0,2,1,92,75,2,Grozoly,Mantis,44,0,12,0,39,0,0,1,2,0,35,0,Virus,Engi,100,30,30,110,130,36,16,6,2,0,28,0,Ferry,Engi,55,0,0,55,0,4,8,4,0,0,8,0,,,,,,,,,,,,,,,,,,,,,,,,,,,,,
90,7,HOSTILE,Mantis Controlled Sector,56%,33,1593,9,4730,"","You arrive and the ship you were escorting jumps in behind you. Thanks for the help. We work at a nearby fusion power plant, we could try to improve your reactor's output as a form of compensation.","",28,21,5,10,58,8,100,18,8,2,0,5,5,0,1,1,0,8,8,0,LASER BURST 5,LASER BURST 5,,,3,0,0,ANTI DRONE,DEFENSE 1,0,0,0,0,0,0,1,1,0,0,0,0,3,0,0,0,0,0,0,0,0,1,0,1,0,1,0,2,0,"ENERGY SHIELD, SHIELD RECHARGE, SHIELD RECHARGE","",Giles,Zoltan,28,0,0,7,0,1,0,4,2,12,89,0,Emily,Zoltan,70,0,27,0,0,4,1,7,2,0,89,2,Valeriya,Zoltan,70,0,0,0,52,0,0,5,2,0,89,1,Kirby,Zoltan,39,0,0,82,2,2,2,2,2,0,89,1,Alison,Rock,150,30,0,0,0,1,0,2,1,92,76,2,Grozoly,Mantis,69,0,12,0,39,0,0,1,2,0,36,0,Virus,Engi,100,30,30,110,130,36,16,6,2,0,29,0,Ferry,Engi,80,0,0,55,0,4,8,4,0,0,9,0,,,,,,,,,,,,,,,,,,,,,,,,,,,,,
91,7,HOSTILE,Mantis Controlled Sector,66%,34,1635,9,4838,"","The ship explodes, leaving behind a substantial collection of useful scrap material.","",70,16,6,10,59,8,100,18,8,4,0,5,4,0,1,1,0,8,8,0,LASER BURST 5,LASER BURST 5,,,3,0,0,ANTI DRONE,DEFENSE 1,0,0,0,0,0,0,1,1,0,0,0,0,3,0,0,0,0,0,0,0,0,1,0,1,0,1,0,2,0,"ENERGY SHIELD, SHIELD RECHARGE, SHIELD RECHARGE","",Giles,Zoltan,53,0,0,7,0,1,0,4,2,12,90,0,Emily,Zoltan,70,0,27,0,0,4,1,7,2,0,90,2,Valeriya,Zoltan,70,0,0,0,52,0,0,5,2,0,90,1,Kirby,Zoltan,64,0,0,91,2,2,2,2,2,0,90,1,Alison,Rock,150,30,0,0,0,1,0,2,1,100,77,2,Grozoly,Mantis,94,0,20,0,39,0,0,1,2,0,37,1,Virus,Engi,100,30,30,110,130,36,16,6,2,0,30,0,Ferry,Engi,100,0,0,55,0,6,8,6,0,0,10,0,,,,,,,,,,,,,,,,,,,,,,,,,,,,,
92,7,HOSTILE,Mantis Controlled Sector,75%,34,1664,10,4896,"","None of your attempts to communicate seem to work: they just stare at you silently. As you prepare to leave, one of the creatures canters forward and forcefully nudges you away from the ship. He seems to want you to follow him. Eventually, they guide you to an old Engi ship's crash site. Inside you are able to find and reactivate an Engi!","",99,16,6,10,61,9,100,18,8,4,0,5,4,0,1,1,0,8,8,0,LASER BURST 5,LASER BURST 5,,,3,0,0,ANTI DRONE,DEFENSE 1,0,0,0,0,0,0,1,1,0,0,0,0,3,0,0,0,0,0,0,0,0,1,0,1,0,1,0,2,0,"ENERGY SHIELD, SHIELD RECHARGE, SHIELD RECHARGE","",Giles,Zoltan,70,0,0,7,0,1,0,4,2,12,91,0,Emily,Zoltan,70,0,27,0,0,4,1,7,2,0,91,2,Valeriya,Zoltan,70,0,0,0,52,0,0,5,2,0,91,1,Kirby,Zoltan,70,0,0,91,2,2,2,2,2,0,91,1,Alison,Rock,150,30,0,0,0,1,0,2,1,100,78,2,Grozoly,Mantis,100,0,20,0,39,0,0,1,2,0,38,1,Virus,Engi,100,30,30,110,130,36,16,6,2,0,31,0,Ferry,Engi,100,0,0,55,0,6,8,6,0,0,11,0,Ohm,Engi,100,0,0,0,0,0,16,0,0,0,0,0,,,,,,,,,,,,,,,
93,8,HOSTILE,The Last Stand,121%,34,1664,10,4911,"Federation Fleet","Tully responds, It's settled. The Rebels will be here in a matter of moments. We will do what we can to hold off their warships but you must succeed in destroying this flagship. Your current outpost can provide some repairs and fuel, and the other repair stations can provide aid as well. Good luck.","",99,26,15,10,61,8,100,18,8,4,0,5,4,0,1,1,0,8,8,0,LASER BURST 5,LASER BURST 5,,,3,0,0,ANTI DRONE,DEFENSE 1,0,0,0,0,0,0,1,1,0,0,0,0,3,0,0,0,0,0,0,0,0,1,0,1,0,1,0,2,0,"ENERGY SHIELD, SHIELD RECHARGE, SHIELD RECHARGE","",Giles,Zoltan,70,0,0,7,0,1,0,4,2,12,92,0,Emily,Zoltan,70,0,27,0,0,4,1,7,2,0,92,2,Valeriya,Zoltan,70,0,0,0,52,0,0,5,2,0,92,1,Kirby,Zoltan,70,0,0,91,2,2,2,2,2,0,92,1,Alison,Rock,150,30,0,0,0,1,0,2,1,100,79,2,Grozoly,Mantis,100,0,20,0,39,0,0,1,2,0,39,1,Virus,Engi,100,30,30,110,130,36,16,6,2,0,32,0,Ohm,Engi,100,0,0,0,0,0,16,0,0,0,1,0,,,,,,,,,,,,,,,,,,,,,,,,,,,,,
94,8,HOSTILE,The Last Stand,121%,35,1786,10,5139,"","The outpost hails you, The pompous bastards expected free service just because they defeated the Federation. Take this for the help.","",221,25,17,9,62,8,48,18,8,4,0,5,5,0,1,0,0,8,8,0,LASER BURST 5,LASER BURST 5,,,3,0,0,ANTI DRONE,DEFENSE 1,0,0,0,0,0,0,1,1,0,0,0,0,3,0,0,0,0,0,0,0,0,1,0,1,0,1,0,2,0,"ENERGY SHIELD, SHIELD RECHARGE, SHIELD RECHARGE","",Giles,Zoltan,70,0,0,7,0,1,0,4,2,12,93,0,Emily,Zoltan,47,0,27,0,0,4,1,7,2,0,93,2,Valeriya,Zoltan,38,0,0,0,52,0,1,5,3,0,93,1,Kirby,Zoltan,70,0,0,99,2,2,2,2,2,0,93,1,Alison,Rock,150,30,0,0,0,1,0,2,1,103,80,2,Grozoly,Mantis,68,0,21,0,39,0,0,1,2,0,40,1,Virus,Engi,100,30,30,110,130,36,16,7,2,0,33,0,Ohm,Engi,34,0,0,0,0,0,16,0,0,0,2,0,,,,,,,,,,,,,,,,,,,,,,,,,,,,,
95,8,HOSTILE,The Last Stand,121%,35,1830,10,5220,"","There is a a mobile ship construction platform stationed at this beacon. After a brief exchange they give you clearance to receive emergency repairs and military supplies.","",265,30,21,14,66,8,42,18,8,4,0,5,5,0,1,0,0,8,8,0,LASER BURST 5,LASER BURST 5,,,3,0,0,ANTI DRONE,DEFENSE 1,0,0,0,0,0,0,1,1,0,0,0,0,3,0,0,0,0,0,0,0,0,1,0,1,0,1,0,2,0,"ENERGY SHIELD, SHIELD RECHARGE, SHIELD RECHARGE","",Giles,Zoltan,70,0,0,7,0,1,0,4,2,12,94,0,Emily,Zoltan,70,0,27,0,0,4,1,7,2,0,94,2,Valeriya,Zoltan,63,0,0,0,52,0,1,5,3,0,94,1,Kirby,Zoltan,70,0,0,99,2,2,2,2,2,0,94,1,Alison,Rock,150,30,0,0,0,1,0,2,1,103,81,2,Grozoly,Mantis,93,0,21,0,39,0,0,1,2,0,41,1,Virus,Engi,100,30,30,110,130,36,16,7,2,0,34,0,Ohm,Engi,59,0,0,0,0,0,16,0,0,0,3,0,,,,,,,,,,,,,,,,,,,,,,,,,,,,,
