29,2,CIVILIAN,Zoltan Controlled Sector,87%,13,292,5,1263,"","The Zoltan are fascinated by other species, and have set up something of an alien knick-knack shop here. Why not take a look?","Weapon: BEAM LONG, LASER BURST 5, ION 4, Drone: ANTI DRONE, BATTLE, COMBAT FIRE, Crew: Mantis, Zoltan, Slug, ",48,23,16,8,15,5,76,5,2,0,0,2,1,0,1,1,0,4,0,0,LASER BURST 5,,,,3,0,0,COMBAT BEAM,,0,0,0,0,0,0,0,0,0,0,0,0,1,0,0,0,0,0,0,0,0,1,0,1,0,1,0,2,0,"ENERGY SHIELD, SHIELD RECHARGE","",Giles,Zoltan,70,6,0,0,3,1,0,1,0,12,28,0,Emily,Zoltan,40,0,12,0,0,3,0,3,0,0,28,0,Valeriya,Zoltan,70,0,0,0,36,1,0,2,1,0,28,0,Kirby,Zoltan,70,0,0,18,0,2,0,2,0,0,28,0,Alison,Rock,150,4,0,0,0,0,0,0,1,14,15,0,,,,,,,,,,,,,,,,,,,,,,,,,,,,,,,,,,,,,,,,,,,,,,,,,,,,,,,,,,,,,,,,,,,,,,,
30,2,CIVILIAN,Zoltan Controlled Sector,97%,13,292,5,1278,"","Thank you for your business.","",1,23,16,8,15,5,83,6,2,0,0,3,2,0,1,1,0,4,3,0,LASER BURST 5,,,,3,0,0,ANTI DRONE,,0,0,0,0,0,0,0,0,0,0,0,0,1,0,0,0,0,0,0,0,0,1,0,1,0,1,0,2,0,"ENERGY SHIELD, SHIELD RECHARGE","",Giles,Zoltan,70,6,0,0,3,1,0,1,0,12,29,0,Emily,Zoltan,48,0,12,0,0,3,0,3,0,0,29,0,Valeriya,Zoltan,70,0,0,0,36,1,0,2,1,0,29,0,Kirby,Zoltan,70,0,0,18,0,2,0,2,0,0,29,0,Alison,Rock,150,4,0,0,0,0,0,0,1,14,16,0,,,,,,,,,,,,,,,,,,,,,,,,,,,,,,,,,,,,,,,,,,,,,,,,,,,,,,,,,,,,,,,,,,,,,,,
31,3,CIVILIAN,Zoltan Controlled Sector,0%,13,292,5,1293,"","The Zoltan patrol their borders but let you pass when you ID as Federation. Let's hope they won't be so courteous to the Rebels.","",1,23,15,8,15,5,84,6,2,0,0,3,2,0,1,1,0,4,3,0,LASER BURST 5,,,,3,0,0,ANTI DRONE,,0,0,0,0,0,0,0,0,0,0,0,0,1,0,0,0,0,0,0,0,0,1,0,1,0,1,0,2,0,"ENERGY SHIELD, SHIELD RECHARGE","",Giles,Zoltan,70,6,0,0,3,1,0,1,0,12,30,0,Emily,Zoltan,56,0,12,0,0,3,0,3,0,0,30,0,Valeriya,Zoltan,70,0,0,0,36,1,0,2,1,0,30,0,Kirby,Zoltan,70,0,0,18,0,2,0,2,0,0,30,0,Alison,Rock,150,4,0,0,0,0,0,0,1,14,17,0,,,,,,,,,,,,,,,,,,,,,,,,,,,,,,,,,,,,,,,,,,,,,,,,,,,,,,,,,,,,,,,,,,,,,,,
32,3,CIVILIAN,Zoltan Controlled Sector,1%,14,317,5,1376,"","The ship explodes, leaving behind a substantial collection of useful scrap material.","",26,23,14,9,16,5,100,6,2,0,0,3,2,0,1,1,0,4,3,0,LASER BURST 5,,,,3,0,0,ANTI DRONE,,0,0,0,0,0,0,0,0,0,0,0,0,1,0,0,0,0,0,0,0,0,1,0,1,0,1,0,2,0,"ENERGY SHIELD, SHIELD RECHARGE","",Giles,Zoltan,70,6,0,0,3,1,0,1,0,12,31,0,Emily,Zoltan,64,0,16,0,0,3,0,3,0,0,31,1,Valeriya,Zoltan,70,0,0,0,41,1,0,2,1,0,31,0,Kirby,Zoltan,70,0,0,19,0,2,0,2,0,0,31,0,Alison,Rock,150,8,0,0,0,0,0,0,1,22,18,0,,,,,,,,,,,,,,,,,,,,,,,,,,,,,,,,,,,,,,,,,,,,,,,,,,,,,,,,,,,,,,,,,,,,,,,
33,3,CIVILIAN,Zoltan Controlled Sector,6%,14,317,5,1391,"","With the sensors down, you spend a good deal of time staring out the window. It is, you must admit, rather beautiful here.","",26,23,13,9,16,5,100,6,2,0,0,3,2,0,1,1,0,4,3,0,LASER BURST 5,,,,3,0,0,ANTI DRONE,,0,0,0,0,0,0,0,0,0,0,0,0,1,0,0,0,0,0,0,0,0,1,0,1,0,1,0,2,0,"ENERGY SHIELD, SHIELD RECHARGE","",Giles,Zoltan,70,6,0,0,3,1,0,1,0,12,32,0,Emily,Zoltan,70,0,16,0,0,3,0,3,0,0,32,1,Valeriya,Zoltan,70,0,0,0,41,1,0,2,1,0,32,0,Kirby,Zoltan,70,0,0,19,0,2,0,2,0,0,32,0,Alison,Rock,150,8,0,0,0,0,0,0,1,22,19,0,,,,,,,,,,,,,,,,,,,,,,,,,,,,,,,,,,,,,,,,,,,,,,,,,,,,,,,,,,,,,,,,,,,,,,,
34,3,CIVILIAN,Zoltan Controlled Sector,11%,14,352,5,1458,"","With most of the fire under control, the scientists are able to help secure the station. They offer you their sincere gratitude and a generous reward.","",61,23,12,9,16,5,100,6,2,0,0,3,2,0,1,1,0,4,3,0,LASER BURST 5,,,,3,0,0,ANTI DRONE,,0,0,0,0,0,0,0,0,0,0,0,0,1,0,0,0,0,0,0,0,0,1,0,1,0,1,0,2,0,"ENERGY SHIELD, O2 MASKS, SHIELD RECHARGE","",Giles,Zoltan,70,6,0,0,3,1,0,1,0,12,33,0,Emily,Zoltan,70,0,16,0,0,3,0,3,0,0,33,1,Valeriya,Zoltan,70,0,0,0,41,1,0,2,1,0,33,0,Kirby,Zoltan,70,0,0,19,0,2,0,2,0,0,33,0,Alison,Rock,150,8,0,0,0,0,0,0,1,22,20,0,,,,,,,,,,,,,,,,,,,,,,,,,,,,,,,,,,,,,,,,,,,,,,,,,,,,,,,,,,,,,,,,,,,,,,,
35,3,CIVILIAN,Zoltan Controlled Sector,21%,14,352,5,1473,"","You have to admit - Zoltan space is a beautiful and peaceful place indeed. However, re-engaging the FTL and finishing your mission is your priority, not sight-seeing.","",61,23,11,9,16,5,100,6,2,0,0,3,2,0,1,1,0,4,3,0,LASER BURST 5,,,,3,0,0,ANTI DRONE,,0,0,0,0,0,0,0,0,0,0,0,0,1,0,0,0,0,0,0,0,0,1,0,1,0,1,0,2,0,"ENERGY SHIELD, O2 MASKS, SHIELD RECHARGE","",Giles,Zoltan,70,6,0,0,3,1,0,1,0,12,34,0,Emily,Zoltan,70,0,16,0,0,3,0,3,0,0,34,1,Valeriya,Zoltan,70,0,0,0,41,1,0,2,1,0,34,0,Kirby,Zoltan,70,0,0,19,0,2,0,2,0,0,34,0,Alison,Rock,150,8,0,0,0,0,0,0,1,22,21,0,,,,,,,,,,,,,,,,,,,,,,,,,,,,,,,,,,,,,,,,,,,,,,,,,,,,,,,,,,,,,,,,,,,,,,,
36,3,CIVILIAN,Zoltan Controlled Sector,31%,14,352,5,1488,"","A human ship hails: My friends! Please, there is nothing I don't have, and there is nothing worth wanting that I can't get. Why not take a look around my shop?","Augment: SCRAP COLLECTOR, BATTERY BOOSTER, CLOAK FIRE, Drone: BOARDER, REPAIR, BOARDER ION, ",61,23,10,9,16,5,100,6,2,0,0,3,2,0,1,1,0,4,3,0,LASER BURST 5,,,,3,0,0,ANTI DRONE,,0,0,0,0,0,0,0,0,0,0,0,0,1,0,0,0,0,0,0,0,0,1,0,1,0,1,0,2,0,"ENERGY SHIELD, O2 MASKS, SHIELD RECHARGE","",Giles,Zoltan,70,6,0,0,3,1,0,1,0,12,35,0,Emily,Zoltan,70,0,16,0,0,3,0,3,0,0,35,1,Valeriya,Zoltan,70,0,0,0,41,1,0,2,1,0,35,0,Kirby,Zoltan,70,0,0,19,0,2,0,2,0,0,35,0,Alison,Rock,150,8,0,0,0,0,0,0,1,22,22,0,,,,,,,,,,,,,,,,,,,,,,,,,,,,,,,,,,,,,,,,,,,,,,,,,,,,,,,,,,,,,,,,,,,,,,,
37,3,CIVILIAN,Zoltan Controlled Sector,41%,15,381,5,1577,"","The ship explodes, leaving behind a substantial collection of useful scrap material.","",115,23,12,10,16,5,100,6,2,0,0,3,2,0,1,1,0,4,3,0,LASER BURST 5,,,,3,0,0,ANTI DRONE,,0,0,0,0,0,0,0,0,0,0,0,0,1,0,0,0,0,0,0,0,0,1,0,1,0,1,0,2,0,"ENERGY SHIELD, SHIELD RECHARGE","",Giles,Zoltan,70,6,0,0,3,1,0,1,0,12,36,0,Emily,Zoltan,70,0,19,0,0,3,0,3,0,0,36,1,Valeriya,Zoltan,70,0,0,0,45,1,0,2,1,0,36,0,Kirby,Zoltan,70,0,0,19,0,2,0,2,0,0,36,0,Alison,Rock,150,11,0,0,0,0,0,0,1,28,23,0,,,,,,,,,,,,,,,,,,,,,,,,,,,,,,,,,,,,,,,,,,,,,,,,,,,,,,,,,,,,,,,,,,,,,,,
38,3,CIVILIAN,Zoltan Controlled Sector,50%,16,403,5,1655,"Pulsar Star","The ship explodes, leaving behind a substantial collection of useful scrap material.","",137,23,12,9,17,5,100,6,2,0,0,3,1,0,1,1,0,4,3,0,LASER BURST 5,,,,3,1,0,ANTI DRONE,,0,0,0,0,0,0,0,0,0,0,0,0,1,0,0,0,0,0,0,0,0,1,0,1,0,1,0,2,0,"ENERGY SHIELD, SHIELD RECHARGE","",Giles,Zoltan,70,6,0,0,3,1,0,1,0,12,37,0,Emily,Zoltan,70,0,19,0,0,3,0,3,0,0,37,1,Valeriya,Zoltan,70,0,0,0,48,1,0,2,1,0,37,0,Kirby,Zoltan,70,0,0,20,0,2,0,2,0,0,37,0,Alison,Rock,150,11,0,0,0,0,0,0,1,28,24,0,,,,,,,,,,,,,,,,,,,,,,,,,,,,,,,,,,,,,,,,,,,,,,,,,,,,,,,,,,,,,,,,,,,,,,,
39,3,CIVILIAN,Zoltan Controlled Sector,60%,17,445,5,1763,"","Thank you for rescuing us! They held us hostage to ambush unsuspecting passersby. Please, take this.","",179,23,12,9,21,5,85,6,2,0,0,3,2,0,1,1,0,4,3,0,LASER BURST 5,BOMB 1,,,3,0,0,ANTI DRONE,DEFENSE 1,0,0,0,0,0,0,0,0,0,0,0,0,1,0,0,0,0,0,0,0,0,1,0,1,0,1,0,2,0,"ENERGY SHIELD, SHIELD RECHARGE","",Giles,Zoltan,39,6,0,0,3,1,0,1,0,12,38,0,Emily,Zoltan,55,0,20,0,0,3,1,3,1,0,38,1,Valeriya,Zoltan,38,0,0,0,51,1,1,2,2,0,38,0,Kirby,Zoltan,55,0,0,20,0,2,0,2,0,0,38,0,Alison,Rock,150,12,0,0,0,0,0,0,1,30,25,0,,,,,,,,,,,,,,,,,,,,,,,,,,,,,,,,,,,,,,,,,,,,,,,,,,,,,,,,,,,,,,,,,,,,,,,
40,3,CIVILIAN,Zoltan Controlled Sector,70%,17,445,5,1778,"","A Mantis crew here has hunkered down in the abdomen of a long-dead space-whale - the only way, presumably, for them to operate their black-market trade without detection. Worth a look?","System: medbay, mind, hacking, Crew: Rock, Slug, Human, Augment: CLOAK FIRE, DEFENSE SCRAMBLER, SHIELD RECHARGE, ",134,23,11,9,21,5,85,6,2,0,0,3,2,0,1,1,0,4,3,0,LASER BURST 5,BOMB 1,,,3,0,0,ANTI DRONE,DEFENSE 1,0,0,0,0,0,0,0,0,0,0,0,0,1,0,0,0,0,0,0,0,0,1,0,1,0,1,0,2,0,"ENERGY SHIELD, SHIELD RECHARGE, SHIELD RECHARGE","",Giles,Zoltan,47,6,0,0,3,1,0,1,0,12,39,0,Emily,Zoltan,63,0,20,0,0,3,1,3,1,0,39,1,Valeriya,Zoltan,46,0,0,0,51,1,1,2,2,0,39,0,Kirby,Zoltan,63,0,0,20,0,2,0,2,0,0,39,0,Alison,Rock,150,12,0,0,0,0,0,0,1,30,26,0,,,,,,,,,,,,,,,,,,,,,,,,,,,,,,,,,,,,,,,,,,,,,,,,,,,,,,,,,,,,,,,,,,,,,,,
41,3,CIVILIAN,Zoltan Controlled Sector,80%,17,445,5,1793,"","Being back in space terrifies him. He goes mad and nearly blows a hole in the side of your ship with a makeshift explosive in an attempt to escape this metal prison. He dies in the explosion.","",4,18,10,9,21,5,87,8,5,0,0,3,2,0,1,1,0,4,3,0,LASER BURST 5,BOMB 1,,,3,0,1,ANTI DRONE,DEFENSE 1,0,0,0,0,0,0,0,0,0,0,0,0,1,0,0,0,0,0,0,0,0,1,0,1,0,1,0,2,0,"ENERGY SHIELD, SHIELD RECHARGE, SHIELD RECHARGE","",Giles,Zoltan,55,6,0,0,3,1,0,1,0,12,40,0,Emily,Zoltan,70,0,20,0,0,3,1,3,1,0,40,1,Valeriya,Zoltan,54,0,0,0,51,1,1,2,2,0,40,0,Kirby,Zoltan,70,0,0,20,0,2,0,2,0,0,40,0,Alison,Rock,150,12,0,0,0,0,0,0,1,30,27,0,,,,,,,,,,,,,,,,,,,,,,,,,,,,,,,,,,,,,,,,,,,,,,,,,,,,,,,,,,,,,,,,,,,,,,,
42,3,CIVILIAN,Zoltan Controlled Sector,90%,18,489,5,1904,"","The outpost hails you after the scout was destroyed, Thanks for the help. We've been harassed non-stop by those scouts. Take this on the house.","",48,18,11,8,24,5,90,8,5,2,0,3,1,0,1,1,0,4,3,0,LASER BURST 5,BOMB 1,,,3,1,0,ANTI DRONE,DEFENSE 1,0,0,0,0,0,0,0,0,0,0,0,0,1,0,0,0,0,0,0,0,0,1,0,1,0,1,0,2,0,"ENERGY SHIELD, SHIELD RECHARGE, SHIELD RECHARGE","DEFENSE 1",Giles,Zoltan,63,6,0,0,3,2,0,2,0,12,41,0,Emily,Zoltan,70,0,24,0,0,3,1,3,1,0,41,1,Valeriya,Zoltan,62,0,0,0,54,1,1,2,2,0,41,0,Kirby,Zoltan,70,0,0,20,0,2,0,2,0,0,41,0,Alison,Rock,150,16,0,0,0,0,0,0,1,38,28,1,,,,,,,,,,,,,,,,,,,,,,,,,,,,,,,,,,,,,,,,,,,,,,,,,,,,,,,,,,,,,,,,,,,,,,,
43,4,HOSTILE,Mantis Controlled Sector,0%,18,489,5,1919,"","You've entered a poorly charted area of space that's known to be home to the Mantis. Ensure your hull plating is up to scratch and that you have enough fuel in the tank to make it through.","",48,18,10,8,24,5,88,8,5,2,0,3,1,0,1,1,0,4,3,0,LASER BURST 5,BOMB 1,,,3,0,0,ANTI DRONE,DEFENSE 1,0,0,0,0,0,0,0,0,0,0,0,0,1,0,0,0,0,0,0,0,0,1,0,1,0,1,0,2,0,"ENERGY SHIELD, SHIELD RECHARGE, SHIELD RECHARGE","DEFENSE 1",Giles,Zoltan,70,6,0,0,3,2,0,2,0,12,42,0,Emily,Zoltan,70,0,24,0,0,3,1,3,1,0,42,1,Valeriya,Zoltan,70,0,0,0,54,1,1,2,2,0,42,0,Kirby,Zoltan,70,0,0,20,0,2,0,2,0,0,42,0,Alison,Rock,150,16,0,0,0,0,0,0,1,38,29,1,,,,,,,,,,,,,,,,,,,,,,,,,,,,,,,,,,,,,,,,,,,,,,,,,,,,,,,,,,,,,,,,,,,,,,,
44,4,HOSTILE,Mantis Controlled Sector,0%,18,522,5,1983,"","Not much remains in this abandoned system; however, scans reveal a nearby mining platform with some salvageable materials.","",81,18,9,9,26,5,88,8,5,2,0,3,1,0,1,1,0,4,3,0,LASER BURST 5,BOMB 1,,,3,0,0,ANTI DRONE,DEFENSE 1,0,0,0,0,0,0,0,0,0,0,0,0,1,0,0,0,0,0,0,0,0,1,0,1,0,1,0,2,0,"ENERGY SHIELD, SHIELD RECHARGE, SHIELD RECHARGE","DEFENSE 1, REPAIR",Giles,Zoltan,70,6,0,0,3,2,0,2,0,12,43,0,Emily,Zoltan,70,0,24,0,0,3,1,3,1,0,43,1,Valeriya,Zoltan,70,0,0,0,54,1,1,2,2,0,43,0,Kirby,Zoltan,70,0,0,20,0,2,0,2,0,0,43,0,Alison,Rock,150,16,0,0,0,0,0,0,1,38,30,1,,,,,,,,,,,,,,,,,,,,,,,,,,,,,,,,,,,,,,,,,,,,,,,,,,,,,,,,,,,,,,,,,,,,,,,
45,4,HOSTILE,Mantis Controlled Sector,1%,18,522,5,1998,"","Uncertain about what you'll discover at this beacon, you scan the surroundings. You detect several warnings on wide-band channels discouraging any violence in protected trade-space. Perhaps you can find some wares nearby.","System: teleporter, mind, hacking, Weapon: LASER HULL 1, SHOTGUN, ION 2, Crew: Mantis, Engi, Mantis, Drone: BOARDER ION, SHIP REPAIR, ANTI DRONE, ",78,18,8,9,26,5,88,8,5,2,0,3,1,0,1,1,0,4,3,0,LASER BURST 5,SHOTGUN,,,3,0,0,ANTI DRONE,DEFENSE 1,0,0,0,0,0,0,0,0,0,0,0,0,1,0,0,0,0,0,0,0,0,1,0,1,0,1,0,2,0,"ENERGY SHIELD, SHIELD RECHARGE, SHIELD RECHARGE","",Giles,Zoltan,70,6,0,0,3,2,0,2,0,12,44,0,Emily,Zoltan,70,0,24,0,0,3,1,3,1,0,44,1,Valeriya,Zoltan,70,0,0,0,54,1,1,2,2,0,44,0,Kirby,Zoltan,70,0,0,20,0,2,0,2,0,0,44,0,Alison,Rock,150,16,0,0,0,0,0,0,1,38,31,1,,,,,,,,,,,,,,,,,,,,,,,,,,,,,,,,,,,,,,,,,,,,,,,,,,,,,,,,,,,,,,,,,,,,,,,
46,4,HOSTILE,Mantis Controlled Sector,11%,19,578,5,2127,"","","",84,18,10,10,26,5,100,8,5,2,0,3,1,0,1,1,0,5,3,0,LASER BURST 5,SHOTGUN,LASER BURST 5,,3,0,0,ANTI DRONE,DEFENSE 1,0,0,0,0,0,0,0,0,0,0,0,0,1,1,0,0,0,0,0,0,0,1,0,1,0,1,0,2,0,"ENERGY SHIELD, SHIELD RECHARGE, SHIELD RECHARGE","",Giles,Zoltan,70,3,0,0,0,0,0,2,1,12,45,0,Emily,Zoltan,70,0,30,0,0,3,1,3,1,0,45,2,Valeriya,Zoltan,29,0,0,0,61,1,1,2,2,0,45,0,Kirby,Zoltan,43,0,0,28,0,2,0,2,0,0,45,0,Alison,Rock,150,24,0,0,0,0,0,0,1,54,32,1,,,,,,,,,,,,,,,,,,,,,,,,,,,,,,,,,,,,,,,,,,,,,,,,,,,,,,,,,,,,,,,,,,,,,,,
47,4,HOSTILE,Mantis Controlled Sector,21%,19,578,5,2142,"","A nearby Mantis mining operation is clearly using heavy Engi slave labor. You briefly consider the possibility of emancipating the slaves, but the Mantis presence is too formidable. You decide to lay low.","",84,18,9,10,26,5,100,8,5,2,0,3,1,0,1,1,0,5,3,0,LASER BURST 5,LASER BURST 5,SHOTGUN,,3,0,0,ANTI DRONE,DEFENSE 1,0,0,0,0,0,0,0,0,0,0,0,0,1,1,0,0,0,0,0,0,0,1,0,1,0,1,0,2,0,"ENERGY SHIELD, SHIELD RECHARGE, SHIELD RECHARGE","",Giles,Zoltan,70,3,0,0,0,0,0,2,1,12,46,0,Emily,Zoltan,70,0,30,0,0,3,1,3,1,0,46,2,Valeriya,Zoltan,37,0,0,0,61,1,1,2,2,0,46,0,Kirby,Zoltan,51,0,0,28,0,2,0,2,0,0,46,0,Alison,Rock,150,24,0,0,0,0,0,0,1,54,33,1,,,,,,,,,,,,,,,,,,,,,,,,,,,,,,,,,,,,,,,,,,,,,,,,,,,,,,,,,,,,,,,,,,,,,,,
48,4,HOSTILE,Mantis Controlled Sector,31%,19,600,5,2190,"","Take this bit of scrap as a down-payment. We'll use your jump signatures to follow you. You're really helping us out here. Added a quest marker to your map!","",31,18,8,10,26,5,100,8,5,2,0,3,1,0,1,1,0,6,3,0,LASER BURST 5,LASER BURST 5,SHOTGUN,,3,0,0,ANTI DRONE,DEFENSE 1,0,0,0,0,0,0,0,0,0,0,0,0,1,1,0,0,0,0,0,0,0,1,0,1,0,1,0,2,0,"ENERGY SHIELD, SHIELD RECHARGE, SHIELD RECHARGE","",Giles,Zoltan,70,3,0,0,0,0,0,2,1,12,47,0,Emily,Zoltan,70,0,30,0,0,3,1,3,1,0,47,2,Valeriya,Zoltan,45,0,0,0,61,1,1,2,2,0,47,0,Kirby,Zoltan,59,0,0,28,0,2,0,2,0,0,47,0,Alison,Rock,150,24,0,0,0,0,0,0,1,54,34,1,,,,,,,,,,,,,,,,,,,,,,,,,,,,,,,,,,,,,,,,,,,,,,,,,,,,,,,,,,,,,,,,,,,,,,,FED_BOMBER,12,16,0,10,3,100,15,4,4,0,4,1,0,1,1,0,4,0,0,SHOTGUN,ION CHARGEGUN,,,0,0,0,1,1,0,0,0,0,0,0,0,0,0,0,0,0,0,0,0,0,0,0,0,1,0,0,0,1,0,0,0,"",Frederick,Human,100,0,0,Turing,Human,100,0,0,Kapalka,Human,100,0,0,,,,,,,,,,,false,1,false,,0,3
49,4,HOSTILE,Mantis Controlled Sector,41%,19,600,5,2205,"","There's nothing here but space debris and some uninhabitable planetoids.","",31,18,7,10,26,5,100,8,5,2,0,3,1,0,1,1,0,6,3,0,LASER BURST 5,LASER BURST 5,SHOTGUN,,3,0,0,ANTI DRONE,DEFENSE 1,0,0,0,0,0,0,0,0,0,0,0,0,1,1,0,0,0,0,0,0,0,1,0,1,0,1,0,2,0,"ENERGY SHIELD, SHIELD RECHARGE, SHIELD RECHARGE","",Giles,Zoltan,70,3,0,0,0,0,0,2,1,12,48,0,Emily,Zoltan,70,0,30,0,0,3,1,3,1,0,48,2,Valeriya,Zoltan,53,0,0,0,61,1,1,2,2,0,48,0,Kirby,Zoltan,67,0,0,28,0,2,0,2,0,0,48,0,Alison,Rock,150,24,0,0,0,0,0,0,1,54,35,1,,,,,,,,,,,,,,,,,,,,,,,,,,,,,,,,,,,,,,,,,,,,,,,,,,,,,,,,,,,,,,,,,,,,,,,
50,4,HOSTILE,Mantis Controlled Sector,51%,19,620,5,2250,"","Debris from a battle is scattered around this system. A few pieces bounce against your ship. You passively scan them and discover there is a functioning weapon among them!","",51,18,6,10,26,5,100,8,5,2,0,3,1,0,1,1,0,6,3,0,LASER BURST 5,LASER BURST 5,SHOTGUN,BOMB 1,3,0,0,ANTI DRONE,DEFENSE 1,0,0,0,0,0,0,0,0,0,0,0,0,1,1,0,0,0,0,0,0,0,1,0,1,0,1,0,2,0,"ENERGY SHIELD, SHIELD RECHARGE, SHIELD RECHARGE","",Giles,Zoltan,70,3,0,0,0,0,0,2,1,12,49,0,Emily,Zoltan,70,0,30,0,0,3,1,3,1,0,49,2,Valeriya,Zoltan,61,0,0,0,61,1,1,2,2,0,49,0,Kirby,Zoltan,70,0,0,28,0,2,0,2,0,0,49,0,Alison,Rock,150,24,0,0,0,0,0,0,1,54,36,1,,,,,,,,,,,,,,,,,,,,,,,,,,,,,,,,,,,,,,,,,,,,,,,,,,,,,,,,,,,,,,,,,,,,,,,
51,4,HOSTILE,Mantis Controlled Sector,60%,19,620,5,2265,"","The Rebels are already here! The crew braces for impact, but none comes. The sensors report the unmanned rebel supply ship is malfunctioning and is stuck in vending mode - for a little scrap you can take your pick.","System: medbay, teleporter, hacking, Crew: Rock, Mantis, Mantis, Weapon: MISSILES 3, MISSILES HULL, LASER HEAVY 1, Drone: BATTLE, DEFENSE 1, SHIP REPAIR, ",51,18,5,10,26,5,100,8,5,2,0,3,1,0,1,1,0,6,3,0,LASER BURST 5,LASER BURST 5,SHOTGUN,BOMB 1,3,0,0,ANTI DRONE,DEFENSE 1,0,0,0,0,0,0,0,0,0,0,0,0,1,1,0,0,0,0,0,0,0,1,0,1,0,1,0,2,0,"ENERGY SHIELD, SHIELD RECHARGE, SHIELD RECHARGE","",Giles,Zoltan,70,3,0,0,0,0,0,2,1,12,50,0,Emily,Zoltan,70,0,30,0,0,3,1,3,1,0,50,2,Valeriya,Zoltan,69,0,0,0,61,1,1,2,2,0,50,0,Kirby,Zoltan,70,0,0,28,0,2,0,2,0,0,50,0,Alison,Rock,150,24,0,0,0,0,0,0,1,54,37,1,,,,,,,,,,,,,,,,,,,,,,,,,,,,,,,,,,,,,,,,,,,,,,,,,,,,,,,,,,,,,,,,,,,,,,,
52,4,HOSTILE,Mantis Controlled Sector,70%,20,659,5,2369,"","The ship explodes, leaving behind a substantial collection of useful scrap material.","",144,18,5,10,28,5,100,8,5,2,0,3,2,0,1,1,0,6,3,0,LASER BURST 5,LASER BURST 5,,,3,0,0,ANTI DRONE,DEFENSE 1,0,0,0,0,0,0,0,0,0,0,0,0,1,0,0,0,0,0,0,0,0,1,0,1,0,1,0,2,0,"ENERGY SHIELD, SHIELD RECHARGE, SHIELD RECHARGE","",Giles,Zoltan,16,3,0,0,0,0,0,2,1,12,51,0,Emily,Zoltan,70,0,30,0,0,3,1,3,1,0,51,2,Valeriya,Zoltan,70,0,0,0,69,1,1,2,2,0,51,1,Kirby,Zoltan,70,0,0,41,0,2,1,2,1,0,51,0,Alison,Rock,150,30,0,0,0,0,0,0,1,68,38,2,,,,,,,,,,,,,,,,,,,,,,,,,,,,,,,,,,,,,,,,,,,,,,,,,,,,,,,,,,,,,,,,,,,,,,,
53,4,HOSTILE,Mantis Controlled Sector,80%,21,736,5,2529,"","Apparently the ship that was being assaulted was a science vessel. They thank you for saving them and offer a small reward.","",131,15,4,12,32,5,61,8,5,2,0,3,2,0,1,1,0,7,3,0,LASER BURST 5,LASER BURST 5,,,3,0,0,ANTI DRONE,DEFENSE 1,0,0,0,0,0,0,0,0,0,0,0,0,1,0,0,0,0,0,0,0,0,1,0,1,0,1,1,2,0,"ENERGY SHIELD, SHIELD RECHARGE, SHIELD RECHARGE","",Giles,Zoltan,4,3,0,0,0,0,1,2,2,12,52,0,Emily,Zoltan,70,0,30,0,0,3,1,3,1,0,52,2,Valeriya,Zoltan,9,0,0,0,73,1,1,2,2,0,52,1,Kirby,Zoltan,70,0,0,46,0,2,1,2,1,0,52,0,Alison,Rock,150,30,0,0,0,0,0,0,1,71,39,2,,,,,,,,,,,,,,,,,,,,,,,,,,,,,,,,,,,,,,,,,,,,,,,,,,,,,,,,,,,,,,,,,,,,,,,
54,4,HOSTILE,Mantis Controlled Sector,90%,22,766,6,2619,"","The ship explodes, leaving behind a substantial collection of useful scrap material.","",41,13,3,13,33,6,75,9,5,0,0,3,1,0,1,0,0,8,7,0,LASER BURST 5,LASER BURST 5,,,3,0,0,ANTI DRONE,DEFENSE 1,0,0,0,0,0,0,0,0,0,0,0,0,1,0,0,0,0,0,0,0,0,1,0,1,0,1,0,2,0,"ENERGY SHIELD, SHIELD RECHARGE, SHIELD RECHARGE","",Giles,Zoltan,12,3,0,0,0,0,1,2,2,12,53,0,Emily,Zoltan,21,0,30,0,0,3,1,3,1,0,53,2,Valeriya,Zoltan,11,0,0,0,78,1,1,2,2,0,53,1,Kirby,Zoltan,45,0,0,46,0,2,1,2,1,0,53,0,Alison,Rock,52,30,0,0,0,1,0,1,1,71,40,2,Grozoly,Mantis,100,0,0,0,65,1,0,1,0,0,0,0,,,,,,,,,,,,,,,,,,,,,,,,,,,,,,,,,,,,,,,,,,,,,,,,,,,,,,,,,
55,4,HOSTILE,Mantis Controlled Sector,100%,22,766,6,2634,"","","",21,13,7,12,33,6,70,10,5,1,0,3,1,0,1,0,0,8,7,0,LASER BURST 5,LASER BURST 5,,,3,0,0,ANTI DRONE,DEFENSE 1,0,0,0,0,0,0,0,0,0,0,0,0,1,0,0,0,0,0,0,0,0,1,0,1,0,1,0,2,0,"ENERGY SHIELD, SHIELD RECHARGE, SHIELD RECHARGE","",Giles,Zoltan,20,3,0,0,0,0,1,2,2,12,54,0,Emily,Zoltan,29,0,30,0,0,3,1,3,1,0,54,2,Valeriya,Zoltan,19,0,0,0,78,1,1,2,2,0,54,1,Kirby,Zoltan,53,0,0,46,0,2,1,2,1,0,54,0,Alison,Rock,60,30,0,0,0,1,0,1,1,71,41,2,Grozoly,Mantis,100,0,0,0,65,1,0,1,0,0,1,0,,,,,,,,,,,,,,,,,,,,,,,,,,,,,,,,,,,,,,,,,,,,,,,,,,,,,,,,,
56,5,CIVILIAN,Engi Homeworlds,0%,22,766,6,2649,"","You have arrived in Engi space. The Mantis have been threatening the Engi core worlds, but you should be able to stock up for your journey.","",21,13,6,12,33,6,70,10,5,1,0,3,1,0,1,0,0,8,7,0,LASER BURST 5,LASER BURST 5,,,3,0,0,ANTI DRONE,DEFENSE 1,0,0,0,0,0,0,0,0,0,0,0,0,1,0,0,0,0,0,0,0,0,1,0,1,0,1,0,2,0,"ENERGY SHIELD, SHIELD RECHARGE, SHIELD RECHARGE","",Giles,Zoltan,28,3,0,0,0,0,1,2,2,12,55,0,Emily,Zoltan,37,0,30,0,0,3,1,3,1,0,55,2,Valeriya,Zoltan,27,0,0,0,78,1,1,2,2,0,55,1,Kirby,Zoltan,61,0,0,46,0,2,1,2,1,0,55,0,Alison,Rock,68,30,0,0,0,1,0,1,1,71,42,2,Grozoly,Mantis,100,0,0,0,65,1,0,1,0,0,2,0,,,,,,,,,,,,,,,,,,,,,,,,,,,,,,,,,,,,,,,,,,,,,,,,,,,,,,,,,
57,5,CIVILIAN,Engi Homeworlds,0%,22,821,6,2747,"","Fury sparks in the eyes of the Mantis. He won't go easily, and causes serious damage before he can be captured.","",76,8,5,12,33,6,60,10,5,1,1,3,2,0,1,0,0,8,7,0,LASER BURST 5,LASER BURST 5,,,3,0,0,ANTI DRONE,DEFENSE 1,0,0,0,0,0,0,0,0,0,0,0,0,1,0,0,0,0,0,0,0,0,1,0,1,0,1,0,2,0,"ENERGY SHIELD, SHIELD RECHARGE, SHIELD RECHARGE","",Giles,Zoltan,36,3,0,0,0,0,1,2,2,12,56,0,Emily,Zoltan,45,0,30,0,0,3,1,3,1,0,56,2,Valeriya,Zoltan,35,0,0,0,78,1,1,2,2,0,56,1,Kirby,Zoltan,69,0,0,46,0,2,1,2,1,0,56,0,Alison,Rock,76,30,0,0,0,1,0,1,1,71,43,2,Grozoly,Mantis,100,0,0,0,65,1,0,1,0,0,3,0,,,,,,,,,,,,,,,,,,,,,,,,,,,,,,,,,,,,,,,,,,,,,,,,,,,,,,,,,
58,5,CIVILIAN,Engi Homeworlds,0%,22,844,6,2796,"","Your crew grabs what they can and returns to the ship before the asteroid hits. You take a look at what you've recovered once you move clear of the asteroid field.","",99,8,4,12,33,6,77,10,5,1,0,3,1,0,1,1,0,8,7,0,LASER BURST 5,LASER BURST 5,SHOTGUN,,3,0,0,ANTI DRONE,DEFENSE 1,0,0,0,0,0,0,0,0,0,0,0,0,1,0,0,0,0,0,0,0,0,1,0,1,0,1,0,2,0,"ENERGY SHIELD, SHIELD RECHARGE, SHIELD RECHARGE","",Giles,Zoltan,70,0,0,0,0,1,0,3,2,12,57,0,Emily,Zoltan,70,0,27,0,0,0,0,3,1,0,57,2,Valeriya,Zoltan,22,0,0,0,78,4,1,5,2,0,57,1,Kirby,Zoltan,14,0,0,46,0,2,1,2,1,0,57,0,Alison,Rock,21,30,0,0,0,1,0,1,1,71,44,2,Grozoly,Mantis,46,0,0,0,65,1,0,1,0,0,4,0,,,,,,,,,,,,,,,,,,,,,,,,,,,,,,,,,,,,,,,,,,,,,,,,,,,,,,,,,
59,5,CIVILIAN,Engi Homeworlds,5%,22,844,7,2811,"","A message arrives: Your scrap, ours. Our weapons for you. You're about to raise the shields when you realize it's just an Engi trader looking for a trade.","Crew: Engi, Engi, Engi, Drone: DEFENSE 1, COMBAT 1, COMBAT 2, System: medbay, cloaking, mind, Weapon: BOMB 1, SHOTGUN, LASER BURST 2 A, ",81,8,3,12,33,7,77,10,5,1,0,3,1,0,1,1,0,8,7,0,LASER BURST 5,LASER BURST 5,,,3,0,0,ANTI DRONE,DEFENSE 1,0,0,0,0,0,0,0,0,0,0,0,0,1,0,0,0,0,0,0,0,0,1,0,1,0,1,0,2,0,"ENERGY SHIELD, SHIELD RECHARGE, SHIELD RECHARGE","",Giles,Zoltan,70,0,0,0,0,1,0,3,2,12,58,0,Emily,Zoltan,70,0,27,0,0,0,0,3,1,0,58,2,Valeriya,Zoltan,30,0,0,0,78,4,1,5,2,0,58,1,Kirby,Zoltan,22,0,0,46,0,2,1,2,1,0,58,0,Alison,Rock,29,30,0,0,0,1,0,1,1,71,45,2,Grozoly,Mantis,54,0,0,0,65,1,0,1,0,0,5,0,Elizabeth,Engi,100,0,30,0,0,0,0,0,0,0,0,0,,,,,,,,,,,,,,,,,,,,,,,,,,,,,,,,,,,,,,,,,,,
60,5,CIVILIAN,Engi Homeworlds,15%,22,844,7,2826,"","An Engi ship hails: Engine upgrade necessary for travel home. Sale of equipment necessary for engine upgrade.","System: teleporter, cloaking, hacking, Weapon: BOMB FIRE, BOMB BREACH 2, BEAM FIRE, Augment: FTL BOOSTER, ION ARMOR, DEFENSE SCRAMBLER, ",81,8,2,12,33,7,89,10,5,0,0,3,1,0,1,1,0,8,4,0,LASER BURST 5,LASER BURST 5,,,3,0,0,ANTI DRONE,DEFENSE 1,0,0,0,0,0,0,0,0,0,0,0,0,1,0,0,0,0,0,0,0,0,1,0,1,0,1,0,2,0,"ENERGY SHIELD, SHIELD RECHARGE, SHIELD RECHARGE","",Giles,Zoltan,70,0,0,0,0,1,0,3,2,12,59,0,Emily,Zoltan,70,0,27,0,0,0,0,3,1,0,59,2,Valeriya,Zoltan,38,0,0,0,78,4,1,5,2,0,59,1,Kirby,Zoltan,30,0,0,46,0,2,1,2,1,0,59,0,Alison,Rock,37,30,0,0,0,1,0,1,1,71,46,2,Grozoly,Mantis,62,0,0,0,65,1,0,1,0,0,6,0,Elizabeth,Engi,100,0,30,0,0,0,0,0,0,0,1,0,,,,,,,,,,,,,,,,,,,,,,,,,,,,,,,,,,,,,,,,,,,
61,5,CIVILIAN,Engi Homeworlds,25%,23,863,8,2900,"","To your surprise your Engi crewmember reforms. It looks as if the virus reconstituted, repurposed, and reprogrammed the Engi host and wants to travel with you... and it seems to have learned a great deal from its time on your ship.","",43,18,11,12,35,8,92,10,5,0,0,3,1,0,1,1,0,8,8,0,LASER BURST 5,LASER BURST 5,,,3,0,1,ANTI DRONE,DEFENSE 1,0,0,0,0,0,0,0,0,0,0,0,0,1,0,0,0,0,0,0,0,0,1,0,1,0,1,0,2,0,"ENERGY SHIELD, SHIELD RECHARGE, SHIELD RECHARGE","FTL JUMPER, FTL JUMPER",Giles,Zoltan,70,0,0,0,0,1,0,3,2,12,60,0,Emily,Zoltan,70,0,27,0,0,0,0,3,1,0,60,2,Valeriya,Zoltan,46,0,0,0,78,4,1,5,2,0,60,1,Kirby,Zoltan,38,0,0,53,0,2,1,2,1,0,60,0,Alison,Rock,45,30,0,0,0,1,0,1,1,73,47,2,Grozoly,Mantis,70,0,2,0,65,1,0,1,0,0,7,0,Elizabeth,Engi,0,0,30,0,0,0,0,0,0,0,2,0,Virus,Engi,100,30,30,110,130,36,16,0,0,0,0,0,,,,,,,,,,,,,,,,,,,,,,,,,,,,,
62,5,CIVILIAN,Engi Homeworlds,34%,24,896,8,2994,"","The ship explodes, leaving behind a substantial collection of useful scrap material.","",76,18,13,11,36,7,94,10,5,0,0,3,1,0,1,1,0,8,8,0,LASER BURST 5,LASER BURST 5,,,3,0,0,ANTI DRONE,DEFENSE 1,0,0,0,0,0,0,0,0,0,0,0,0,1,0,0,0,0,0,0,0,0,1,0,1,0,1,0,2,0,"ENERGY SHIELD, SHIELD RECHARGE, SHIELD RECHARGE","",Giles,Zoltan,70,0,0,0,0,1,0,3,2,12,61,0,Emily,Zoltan,70,0,27,0,0,0,0,3,1,0,61,2,Valeriya,Zoltan,54,0,0,0,78,4,1,5,2,0,61,1,Kirby,Zoltan,46,0,0,53,0,2,1,2,1,0,61,0,Alison,Rock,53,30,0,0,0,1,0,1,1,74,48,2,Grozoly,Mantis,78,0,3,0,65,1,0,1,0,0,8,0,Virus,Engi,100,30,30,110,130,36,16,1,0,0,1,0,,,,,,,,,,,,,,,,,,,,,,,,,,,,,,,,,,,,,,,,,,,
63,5,CIVILIAN,Engi Homeworlds,44%,25,915,8,3068,"","With all of the would-be pirates dead, you think it best not to return to the settlement... You prepare to jump.","",95,16,13,11,37,7,83,10,5,0,0,3,1,0,1,1,0,8,8,0,LASER BURST 5,LASER BURST 5,,,3,0,0,ANTI DRONE,DEFENSE 1,0,0,0,0,0,0,0,0,0,0,0,0,1,0,0,0,0,0,0,0,0,1,0,1,0,1,0,2,0,"ENERGY SHIELD, SHIELD RECHARGE, SHIELD RECHARGE","",Giles,Zoltan,63,0,0,0,0,0,0,3,2,12,62,0,Emily,Zoltan,66,0,27,0,0,0,0,3,1,0,62,2,Valeriya,Zoltan,16,0,0,0,78,4,1,5,2,0,62,1,Kirby,Zoltan,51,0,0,56,0,2,1,2,1,0,62,1,Alison,Rock,61,30,0,0,0,1,0,1,1,74,49,2,Grozoly,Mantis,86,0,3,0,65,1,0,1,0,0,9,0,Virus,Engi,100,30,30,110,130,36,16,1,0,0,2,0,,,,,,,,,,,,,,,,,,,,,,,,,,,,,,,,,,,,,,,,,,,
64,5,CIVILIAN,Engi Homeworlds,54%,25,915,8,3083,"","The Engi can do remarkable things with just a pile of scrap. The Engi hive at this beacon are selling equipment for just that.","Weapon: LASER HEAVY 1, LASER CHAINGUN 2, BOMB HEAL SYSTEM, Augment: ADV SCANNERS, TELEPORT HEAL, FLEET DISTRACTION, ",83,20,12,11,37,7,83,10,5,0,0,3,1,0,1,1,0,8,8,0,LASER BURST 5,LASER BURST 5,,,3,0,0,ANTI DRONE,DEFENSE 1,0,0,0,0,0,0,0,0,0,0,0,0,1,0,0,0,0,0,0,0,0,1,0,1,0,1,0,2,0,"ENERGY SHIELD, SHIELD RECHARGE, SHIELD RECHARGE","",Giles,Zoltan,70,0,0,0,0,0,0,3,2,12,63,0,Emily,Zoltan,70,0,27,0,0,0,0,3,1,0,63,2,Valeriya,Zoltan,24,0,0,0,78,4,1,5,2,0,63,1,Kirby,Zoltan,59,0,0,56,0,2,1,2,1,0,63,1,Alison,Rock,69,30,0,0,0,1,0,1,1,74,50,2,Grozoly,Mantis,94,0,3,0,65,1,0,1,0,0,10,0,Virus,Engi,100,30,30,110,130,36,16,1,0,0,3,0,,,,,,,,,,,,,,,,,,,,,,,,,,,,,,,,,,,,,,,,,,,
